Name,Address
MẦM NON CỔ NHUẾ 1,Phường Cổ Nhuế 1 – Q Bắc Từ Liêm – Tp Hà Nội
MẦM NON CỔ NHUẾ 2,Phường Cổ Nhuế 2 – Q Bắc Từ Liêm – Tp Hà Nội
MẦM NON ĐÔNG NGẠC A,Phường Đông Ngạc – Q Bắc Từ Liêm – Tp Hà Nội
MẦM NON ĐÔNG NGẠC B,Phường Đông Ngạc – Q Bắc Từ Liêm – Tp Hà Nội
MẦM NON HỒ TÙNG MẬU,Phường Phú Diễn – Q Bắc Từ Liêm – Tp Hà Nội
MẦM NON MINH KHAI,Phường Minh Khai – Q Bắc Từ Liêm – Tp Hà Nội
MẦM NON PHÚ DIỄN,Phường Phú Diễn – Q Bắc Từ Liêm – Tp Hà Nội
MẦM NON PHÚC DIỄN,Phường Phúc Diễn – Q Bắc Từ Liêm – Tp Hà Nội
MẦM NON TÂY TỰU,Phường Tây Tựu – Q Bắc Từ Liêm – Tp Hà Nội
MẦM NON THƯỢNG CÁT,Phường Thượng Cát – Q Bắc Từ Liêm – Tp Hà Nội
MẦM NON THỤY PHƯƠNG,Phường Thụy Phương – Q Bắc Từ Liêm – Tp Hà Nội
MẦM NON XUÂN ĐỈNH A,Phường Xuân Đỉnh – Q Bắc Từ Liêm – Tp Hà Nội
MẦM NON XUÂN TẢO,Phường Xuân Tảo – Q Bắc Từ Liêm – Tp Hà Nội
MẦM NON LIÊN MẠC,Thôn Yên Nội Xã Liên Mạc
MẦM NON AN TIÊN,Phường Cổ Nhuế 1 – Q Bắc Từ Liêm – Tp Hà Nội
MẦM NON KIM MAI,Phường Xuân Đỉnh – Q Bắc Từ Liêm – Tp Hà Nội
MẦM NON NGÔI NHÀ ÁNH SÁNG,Phường Xuân Đỉnh – Q Bắc Từ Liêm – Tp Hà Nội
MẦM NON SAO MAI,Phường Phúc Diễn – Q Bắc Từ Liêm – Tp Hà Nội
MẦM NON SƠN CA BÔNG,Phường Phúc Diễn – Q Bắc Từ Liêm – Tp Hà Nội
MẦM NON SƠN HÀ,Phường Cổ Nhuế 2 – Q Bắc Từ Liêm – Tp Hà Nội
MẦM NON TUỔI HOA,Phường Đông Ngạc – Q Bắc Từ Liêm – Tp Hà Nội
MẦM NON XUÂN ĐỈNH B,TDP Cáo Đỉnh – Xuân Đỉnh – BTL – HN
