Name,Address
MẦM NON LIỆP TUYẾT,Thôn Bái Ngoại – Xã Liệp Tuyết – Huyện Quốc Oai
MẦM NON LONG PHÚ,Thôn Long Phú – Xã Hoà Thạch – Huyện Quốc Oai
MẦM NON NGHĨA HƯƠNG,Thôn Văn Khê – Xã Nghĩa Hương – Huyện Quốc Oai
MẦM NON NGỌC LIỆP,Xã Ngọc Liệp – Huyện Quốc Oai
MẦM NON NGỌC MỸ,Thôn Ngọc Than – Xã Ngọc Mỹ – Huyện Quốc Oai
MẦM NON PHÚ CÁT,Thôn 5 – Xã Phú Cát – Huyện Quốc Oai
MẦM NON PHÚ MÃN,Thôn Đồng Âm – Xã Phú Mãn – Huyện Quốc Oai
MẦM NON PHƯỢNG CÁCH,Thôn 2 – Xã Phượng Cách – Huyện Quốc Oai
MẦM NON SÀI SƠN A,Thôn Đa Phúc – Xã Sài Sơn – Huyện Quốc Oai
MẦM NON TÂN HOÀ,Thôn Yên Thái – Xã Tân Hoà – Huyện Quốc Oai
MẦM NON TÂN PHÚ,Xã Tân Phú – Huyện Quốc Oai
MẦM NON THẠCH THÁN,Xã Thạch Thán – Huyện Quốc Oai
MẦM NON THỊ TRẤN QUỐC OAI A,Thị Trấn Quốc Oai – huyện Quốc Oai
MẦM NON TUYẾT NGHĨA,Thôn Đồng Sơn – Xã Tuyết Nghĩa – Huyện Quốc Oai
MẦM NON YÊN SƠN,Thôn Sơn Trung – Xã Yên Sơn – Huyện Quốc Oai
MẦM NON SƠN CA – QUỐC OAI,Đội 2 – Công Ty Chè Long Phú – Xã Hoà Thạch – Huyện Quốc Oai
MẦM NON BÌNH PHÚ B,Thôn Phú Ổ -xã Bình Phú – Huyện Thạch Thất
MẦM NON BÌNH YÊN B,Thôn Vân Lôi – xã Bình Yên – Huyện Thạch Thất
MẦM NON 19/05,Thôn Phú Nghĩa – Xã Phú Kim – Thạch Thất
MẦM NON BÌNH PHÚ A,Thôn Thái Hòa – Bình Phú – Thạch Thất
MẦM NON BÌNH YÊN A,Thôn Phúc Tiến – Bình Yên – Thạch Thất
MẦM NON CẨM YÊN,Thôn Yên Lỗ – Xã Cẩm Yên – Huyện Thạch Thất
MẦM NON CẦN KIỆM,Xóm mới – Cần Kiệm – Huyện Thạch Thất
MẦM NON MINH HÀ CANH NẬU,Thôn 9 – Canh Nậu – Thạch Thất
MẦM NON CHÀNG SƠN,Thôn 4 – Chàng Sơn – Thạch Thất
MẦM NON ĐẠI ĐỒNG,Thôn Hàn Chùa – Đại Đồng – Huyện Thạch Thất
MẦM NON DỊ NẬU,Thôn Hoà Bình – Dị Nậu – Thạch Thất
MẦM NON ĐỒNG TRÚC,Thôn Đồng Trúc – Xã Đồng Trúc – Huyện Thạch Thất
MẦM NON HẠ BẰNG,Thôn 8 – Gò Giang – Hạ Bằng – Thạch Thất
MẦM NON HƯƠNG NGẢI,Thôn 5 – Xã Hương Ngải – Thạch Thất
MẦM NON HỮU BẰNG,Thôn Đình Chùa – Xã Hữu Bằng – Thạch Thất
MẦM NON KIM QUAN,Thôn 4 – Xã Kim Quan – Huyện Thạch Thất
MẦM NON LẠI THƯỢNG,Thôn Lại Thượng – Xã Lại Thượng – Huyện Thạch Thất
MẦM NON LIÊN QUAN,Thôn Chi Quan 2 – Liên Quan – Thạch Thất
MẦM NON PHÚ KIM,Thôn Phú Kim – Phú Kim – Thạch Thất
MẦM NON PHÙNG XÁ,Thôn 4 – Phùng Xá – Thạch Thất
MẦM NON TÂN XÃ,Thôn Cừ Viên – Tân Xã – Huyện Thạch Thất
MẦM NON THẠCH HOÀ,Thôn 8 – Xã Thạch Hòa – Huyện Thạch Thất
MẦM NON THẠCH XÁ,Thôn Yên – Xã Thạch Xá – Huyện Thạch Thất
MẦM NON TIẾN XUÂN,Xóm Chùa 2 – Xã Tiến Xuân – Huyện Thạch Thất
MẦM NON YÊN BÌNH,Thôn Dân Lập – Xã Yên Bình – Huyện Thạch Thất
MẦM NON YÊN TRUNG,Thôn Bối- Yên Trung- Thạch Thất
MẦM NON ĐẠI YÊN,Xã Đại Yên
MẦM NON ĐỒNG LẠC,Xã Đồng Lạc
MẦM NON ĐỒNG PHÚ,Xã Đồng Phú
MẦM NON ĐÔNG PHƯƠNG YÊN,Xã Đông Phương Yên
MẦM NON ĐÔNG SƠN,Xã Đông Sơn
MẦM NON HOÀ CHÍNH,Xã Hòa Chính
MẦM NON HOA MAI,Xã Thủy Xuânt Iên
MẦM NON HOÀNG DIỆU,Xã Hoàng Diệu
MẦM NON HOÀNG VĂN THỤ,Xã Hoàng Văn Thụ
MẦM NON HỒNG PHONG,Xã Hồng Phong
MẦM NON HỢP ĐỒNG,Xã Hợp Đồng
MẦM NON HỮU VĂN,Xã Hữu Văn
MẦM NON KHU VỰC,Tt Chúc Sơn
MẦM NON LAM ĐIỀN,Xã Lam Điền
MẦM NON MỸ LƯƠNG,Xã Mỹ Lương
MẦM NON NAM PHƯƠNG TIẾN,Xã Nam Phương Tiến
MẦM NON NGỌC HOÀ,Xã Ngọc Hòa
MẦM NON PHÚ NAM AN,Xã Phú Nam An
MẦM NON PHÚ NGHĨA,Xã Phú Nghĩa
MẦM NON PHỤNG CHÂU,Xã Phụng Châu
MẦM NON QUẢNG BỊ,Xã Quảng Bị
MẦM NON TÂN TIẾN,Xã Tân Tiến
MẦM NON THANH BÌNH,Xã Thanh Bình
MẦM NON THƯỢNG VỰC,Xã Thượng Vực
MẦM NON THUỴ HƯƠNG,Xã Thụy Hương
MẦM NON THUỶ XUÂN TIÊN,Xã Thủy Xuân Tiên
MẦM NON TIÊN PHƯƠNG,Xã Tiên Phương
MẦM NON TỐT ĐỘNG,Xã Tốt Động
MẦM NON TRẦN PHÚ,Xã Trần Phú
MẦM NON TRUNG HOÀ,Xã Trung Hòa
MẦM NON YÊN,Xã Trường Yên
MẦM NON TT CHÚC SƠN A,Tt Chúc Sơn
MẦM NON VĂN VÕ,Xã Văn Võ
MẦM NON XUÂN MAI,Tt Xuân Mai
MẦM NON HOA TRẠNG NGUYÊN,Xã Thủy Xuân Tiên
MẦM NON J106,Tt Xuân Mai
MẦM NON Hoa Mi,Tt Xuân Mai
MẦM NON CAO VIÊN,"Xã Cao Viên , Huyện Thanh Oai"
MẦM NON CỰ KHÊ,"Xã Cự Khê , Huyện Thanh Oai"
MẦM NON DÂN HOÀ,"Xã Dân Hoà , Huyện Thanh Oai"
MẦM NON ĐỖ ĐỘNG,"Xã Đỗ Động , Huyện Thanh Oai"
MẦM NON HỒNG DƯƠNG,"Xã Hồng Dương , Huyện Thanh Oai"
MẦM NON KIM AN,"Xã Kim An , Huyện Thanh Oai"
MẦM NON KIM THƯ,"Xã Kim Thư , Huyện Thanh Oai"
MẦM NON LIÊN CHÂU,Liên Châu- Thanh Oai
MẦM NON MỸ HƯNG,"Xã Mỹ Hưng , Huyện Thanh Oai"
MẦM NON PHƯƠNG TRUNG I,"Xã Phương Trung , Huyện Thanh Oai"
MẦM NON PHƯƠNG TRUNG II,"Xã Phương Trung , Huyện Thanh Oai"
MẦM NON TAM HƯNG A,"Xã Tam Hưng , Huyện Thanh Oai"
MẦM NON TAM HƯNG B,"Xã Tam Hưng , Huyện Thanh Oai"
MẦM NON TÂN ƯỚC,"Xã Tân Ước , Huyện Thanh Oai"
MẦM NON THANH CAO,"Xã Thanh Cao , Huyện Thanh Oai"
MẦM NON THANH MAI,Thôn My Thượng- Xã Thanh Mai- Thanh Oai
MẦM NON THANH THUỲ,"Xã Thanh Thuỳ , Huyện Thanh Oai"
MẦM NON THANH VĂN,"Xã Thanh Văn , Huyện Thanh Oai"
MẦM NON THỊ TRẤN KIM BÀI,"TT Kim Bài , Huyện Thanh Oai"
MẦM NON XUÂN DƯƠNG,"Xã Xuân Dương , Huyện Thanh Oai"
MẦM NON BÍCH HOÀ,"Xã Bích Hoà , Huyện Thanh Oai"
MẦM NON BÌNH MINH I,"Xã Bình Minh , Huyện Thanh Oai"
MẦM NON BÌNH MINH II,"Xã Bình Minh , Huyện Thanh Oai"
MẦM NON CAO DƯƠNG,"Xã Cao Dương , Huyện Thanh Oai"
MẦM NON CHƯƠNG DƯƠNG,Chương Dương – Thường Tín
MẦM NON DŨNG TIẾN,Dũng Tiến – Thường Tín
MẦM NON DUYÊN THÁI,Duyên Thái – Thường Tín
MẦM NON HÀ HỒI,Hà Hồi- Thường Tín-hà Nội
MẦM NON HIỀN GIANG,Hiền Giang – Thường Tín
MẦM NON HOÀ BÌNH,Hoà Bình – Thường Tín
MẦM NON HOA SEN,Thị Trấn Thường Tín – Thường Tín
MẦM NON HỒNG VÂN,Hồng Vân – Thường Tín
MẦM NON KHÁNH HÀ,Khánh Hà – Thường Tín
MẦM NON LÊ LỢI,Lê Lợi – Thường Tín
MẦM NON LIÊN PHƯƠNG,Liên Phương – Thường Tín
MẦM NON MINH CƯỜNG,Minh Cường – Thường Tín
MẦM NON NGHIÊM XUYÊN,Nghiêm Xuyên – Thường Tín
MẦM NON NGUYỄN TRÃI,Nguyễn Trãi – Thường Tín
MẦM NON NHỊ KHÊ,Nhị Khê – Thường Tín
MẦM NON NINH SỞ,Ninh Sở – Thường Tín
MẦM NON QUẤT ĐỘNG,Quất Đông – Thường Tín
MẦM NON TÂN MINH,Tân Minh – Thường Tín
MẦM NON THẮNG LỢI,Thắng Lợi – Thường Tín
MẦM NON THỐNG NHẤT,Thống Nhất – Thường Tín
MẦM NON THƯ PHÚ,Thư Phú – Thường Tín
MẦM NON TIỀN PHONG,Tiền Phong – Thường Tín
MẦM NON TÔ HIỆU,Tô Hiệu – Thường Tín
MẦM NON TỰ NHIÊN,Tự Nhiên – Thường Tín
MẦM NON VĂN BÌNH,Văn Bình – Thường Tín
MẦM NON VẠN ĐIỂM,Vạn Điểm – Thường Tín
MẦM NON VĂN PHÚ,Văn Phú – Thường Tín
MẦM NON VÂN TẢO,"Vân Tảo, Thường Tín"
MẦM NON VĂN TỰ,Văn Tự – Thường Tín
MẦM NON BẠCH HẠ,Bạch Hạ – Phú Xuyên
MẦM NON CHÂU CAN,Châu Can – Phú Xuyên
MẦM NON CHUYÊN MỸ,Chuyên Mỹ – Phú Xuyên
MẦM NON ĐẠI THẮNG,Đại Thắng – Phú Xuyên
MẦM NON ĐẠI XUYÊN,Đại Xuyên – Phú Xuyên
MẦM NON HOÀNG LONG,Hoàng Long – Phú Xuyên
MẦM NON HỒNG MINH,Hồng Minh – Phú Xuyên
MẦM NON HỒNG THÁI,Hồng Thái – Phú Xuyên
MẦM NON KHAI THÁI,Khai Thái – Phú Xuyên
MẦM NON MINH TÂN,Minh Tân – Phú Xuyên
MẦM NON NAM PHONG,Nam Phong – Phú Xuyên
MẦM NON NAM TRIỀU,Nam Triều – Phú Xuyên
MẦM NON PHÚ TÚC,Phú Túc – Phú Xuyên
MẦM NON PHÚ YÊN,Phú Yên – Phú Xuyên
MẦM NON PHÚC TIẾN,Phúc Tiến – Phú Xuyên
MẦM NON PHƯỢNG DỰC,Phượng Dực – Phú Xuyên
MẦM NON QUANG LÃNG,Quang Lãng – Phú Xuyên
MẦM NON QUANG TRUNG,Quang Trung – Phú Xuyên
MẦM NON SAO MAI,TT Phú Minh – Phú Xuyên
MẦM NON SƠN HÀ,Sơn Hà – Phú Xuyên
MẦM NON TÂN DÂN,Tân Dân – Phú Xuyên
MẦM NON THUỴ PHÚ,Thụy Phú – Phú Xuyên
MẦM NON TRI THUỶ,Tri Thủy – Phú Xuyên
MẦM NON TRI TRUNG,Tri Trung – Phú Xuyên
MẦM NON TRUNG TÂM,TT Phú Xuyên – Phú Xuyên
MẦM NON TT PHÚ MINH,TT Phú Minh – Phú Xuyên
MẦM NON TT PHÚ XUYÊN,TT Phú Xuyên – Phú Xuyên
MẦM NON VĂN HOÀNG,Văn Hoàng – Phú Xuyên
MẦM NON VĂN NHÂN,Văn Nhân – Phú Xuyên
MẦM NON VÂN TỪ,Vân Từ – Phú Xuyên
MẦM NON ĐÔNG LỖ,Viên Đình – Đông Lỗ – Ứng Hòa
MẦM NON LIÊN BẠT,Lương Xá – Liên Bạt – Ứng Hòa
MẦM NON TẢO DƯƠNG VĂN,Tảo Khê- Tảo Dương Văn- Ứng Hòa
MẦM NON THỊNH,Trung Thịnh – Trường Thịnh- Ứng Hoà
MẦM NON TRUNG TÚ,Chẩn Kỳ – Trung Tú- Ứng Hòa
MẦM NON VIÊN NỘI,Thôn Thượng – Viên Nội – Ứng Hòa
MẦM NON CAO THÀNH,Cao Lãm – Cao Thành- Ứng Hòa
MẦM NON ĐẠI CƯỜNG,Kim Giang – Đại Cường – Ứng Hòa
MẦM NON ĐẠI HÙNG,Trung Thượng – Đại Hùng – Ứng Hòa
MẦM NON ĐỘI BÌNH,Triều Khúc – Đội Bình – Ứng Hòa
MẦM NON ĐỒNG TÂN,Mỹ Cầu – Đồng Tân – Ứng Hòa
MẦM NON ĐỒNG TIẾN,Đoàn Xá – Đồng Tiến
MẦM NON HOÀ LÂM,Trạch Bái – Hoà Lâm – Ứng Hoà
MẦM NON HOÀ NAM,Đinh Xuyên – Hoà Nam- Ứng Hòa
MẦM NON HOÀ PHÚ,Lương Sơn – Hòa Phú – Ứng Hòa
MẦM NON HOA SƠN,Trần Đăng – Hoa Sơn – Ứng Hòa
MẦM NON HOÀ XÁ,Riếng Rợ – Hòa Xá – Ứng Hòa
MẦM NON HỒNG QUANG,Bài Lâm Hạ – Hồng Quang – Ứng Hòa
MẦM NON KIM ĐƯỜNG,Tu Lễ – Kim Đường – Ứng Hòa
MẦM NON LƯU HOÀNG,Ngoại Hoàng – Lưu Hoàng – Ứng Hòa
MẦM NON MINH ĐỨC,Thôn Cầu – Minh Đức – Ứng Hòa
MẦM NON PHÙ LƯU,Thôn Hạ – Phù Lưu – Ứng Hòa
MẦM NON PHƯƠNG TÚ,Dương Khê – Phương Tú – Ứng Hòa
MẦM NON QUẢNG PHÚ CẦU,Quảng Phú Cầu
MẦM NON SƠN CÔNG,Nghi Lộc- Sơn Công- Ứng Hòa
MẦM NON TÂN PHƯƠNG,Tân Phương – Thị Trấn – Ứng Hòa
MẦM NON THỊ TRẤN VÂN ĐÌNH,47 Quang Trung – Thị Trấn Vân Đình – Ứng Hoà
MẦM NON TRẦM LỘNG,An Cư – Trầm Lộng- Ứng Hòa
MẦM NON VẠN THÁI,Nội Xá – Vạn Thái – Ứng Hòa
MẦM NON VIÊN AN,Viên Ngoại – Viên An – Ứng Hòa
