Name,Address
Trường Mầm non Dịch Vọng,"Số 2 Nguyễn Thị Thập Quận Cầu Giấy, Thành Phố Hà Nội"
Trường Mầm non Dịch Vọng Hậu,"Số 2, đường Trần Quốc Hoàn, Quận Cầu Giấy, Thành Phố Hà Nội"
Trường Mầm non Hoa Hồng,số 01 phố Trần Tử Bình - Nghĩa Tân - Cầu Giấy - Hà Nội
Trường Mầm non Hoa Mai,"Ngõ 72, tổ 15 Dương Quảng Hàm, Quan Hoa, Quận Cầu Giấy, Thành Phố Hà Nội"
Trường Mầm non Họa My,Khu tập Đồng xa – Mai Dịch – Cầu Giấy
Trường Mầm non Mai Dịch,"243 Phố Mai Dịch, Quận Cầu Giấy, Thành Phố Hà Nội"
Trường Mầm non Nghĩa Đô,"Quận Cầu Giấy, Thành Phố Hà Nội"
Trường Mầm non Quan Hoa,"Số 8 ngõ 92 Đường Nguyễn Khánh Toàn ,Quận Cầu Giấy, Thành Phố Hà Nội"
Trường Mầm Non Sao Mai,"Tổ 24 - phố Dương Khuê- Phường Mai Dịch, Quận Cầu Giấy, Thành Phố Hà Nội"
Trường Mầm non Sơn Ca,"Quận Cầu Giấy, Thành Phố Hà Nội"
Trường Mầm non Trung Hòa,"Số 5 Ngõ 37 Nguyễn Thị Định - Trung Hòa - Quận Cầu Giấy, Thành Phố Hà Nội"
Trường Mầm non Tuổi Hoa,"Ngõ 100 Hoàng Quốc Việt, Quận Cầu Giấy, Thành Phố Hà Nội"
Trường Mầm non Yên Hòa," Phường Yên Hòa-Trung Kính-Quận Cầu Giấy, Thành Phố Hà Nội"
Trường Mầm non Ánh Sao,"Nghĩa Tân, Cầu Giấy, Hanoi"
Trường Mầm non Hoa Thủy Tiên,"Số 387, Hoàng Quốc Việt, Cầu Giấy, Hà Nội"
Trường Mẫu giáo dân lập SOS Hà Nội,"Số 2 Phạm Thận Duật, Phường Mai dịch, Quận Cầu Giấy- Hà Nội"
Trường Mầm non Lý Thái Tổ 2 (cơ sở 1),"Phố Nguyễn Thị Thập, P. Trung Hòa, Q. Cầu Giấy, TP. Hà Nội"
Trường Mầm non Lý Thái Tổ 2 (cơ sở 2),Ngõ 23 - Phố Đỗ Quang - P. Trung Hòa - Q. Cầu Giấy - Tp. Hà Nội
Trường Mầm non Hồng Vân,"Số 49 Ngõ 165 Xuân Thủy, Phường Dịch Vọng Hậu, Quận Cầu Giấy, Thành phố Hà Nội"
Trường Mầm non Đoàn Thị Điểm,"Số 11 ngõ 42 Trần Bình, Phường Mai Dịch, Quận Cầu Giây, Thành phố Hà Nội"
Trường Mầm Non Chích Bông,"15 Đ. 800A, Nghĩa Đô, Cầu Giấy, Hà Nội"
Trường Mầm non Hoa Linh - Baby Home,"Khu K - Làng Quốc Tế Thăng long, Cầu Giấy, Hà Nội"
Trường Mầm non Just Kids Mandarin Garden,"Đường Hoàng Minh Giám, Phường Trung Hòa, Quận Cầu Giấy, Hà Nội"
Trường Mầm non Just Kids  Trần Quốc Toản,"72 Trần Quốc Toản, Trần Hưng Đạo, Hoàn Kiếm, HN"
Trường Mầm non Just Kids Tây Hồ,"215 Âu Cơ, Quảng An, Tây Hồ, Hà Nội"
Trường Mầm non Ngôi Sao Mới New Star Kids,"99 Chùa Hà, Phường Dịch Vọng, Quận Cầu Giấy, Hà Nội"
Trường Mầm non GP Academy,"Số 1 Phùng Chí Kiên, phường Nghĩa Đô, quận Cầu Giấy, TP. Hà Nội"
Trường Mầm non quốc tế Global,"Lô C1, 2, 3, 4, D34 - KĐT Yên Hòa - Cầu Giấy - Quận Cầu Giấy"
Trường mầm non Vimeco,"4 Nguyễn Chánh, Trung Hoà, Cầu Giấy, Hà Nội"
Trường Mầm non Ngôi Sao Sáng NewStar,Số 32 ngõ 204 Trần Duy Hưng - Hà Nội
Trường Mầm non Ánh Dương Sunshine,"Số 47 Nguyễn Khả Trạc, Phường Mai Dịch, Quận Cầu Giấy, Hà Nội"
Trường Mầm non Liễu Giai,"Tòa Nhà N07B3 Khu Đô thị mới Dịch Vọng, Thành Thái, Cầu Giấy, Hà Nội"
Trường Mầm non Bibo House,"Tầng 1 – tòa nhà MHDI, số 60, Hoàng Quốc Việt, Hà Nội"
Trường Mầm non Hoa Đào Sakura Montessori,"Lô TH1 KĐT mới Dịch Vọng, Cầu Giấy, Hà Nội"
Trường Mầm non Thăng Long KidsMart,Lô NT1 – Khu đô thị mới Dịch Vọng - phố Thọ Tháp - phường Dịch Vọng – Quận Cầu Giấy – Hà Nội
Trường Mầm non Mặt Trời Bé Thơ Sunrise Kidz,"Số 14 Khúc Thừa Dụ, Dịch Vọng, Cầu Giấy, Hà Nội"
Trường Mầm non Búp Sen Xanh,"H8 - H9 , ngõ 130 Xuân Thủy, Cầu Giấy, Hà Nội"
Trường Mầm non Harvard Nhỏ,"Toà nhà 25T2, Nguyễn Thị Thập, Trung Hoà, Cầu Giấy, Hà Nội"
Trường Mầm non Trường Học Vui,12/12 – Phạm Tuấn Tài – QCầu Giấy – Hà Nội
Trường Mầm non Trăng Đỏ RedMoon,"Đường Trung Yên 6, KĐT Trung Yên, Cầu Giấy, Hà Nội"
Trường Mầm non Việt Kids,"NT2, Khu đô thị mới Dịch Vọng, Cầu giấy, Hà Nội"
Trường Mầm non Hà Nội Montessori," Ngõ 89 Nguyễn Phong Sắc, Cầu Giấy, Hà Nội"
Trường Mầm non Hòa Bình Peace School,"Lô C10/NT2 Khu đô thị Nam Trung Yên, đường Nguyễn Chánh, Q. Cầu Giấy, Hà Nội"
Trường Mầm non Eduplay Garden Hà Nội,"Tòa B, Vinaconex 1, 289A, Khuất Duy Tiến, Cầu Giấy, Hà Nội"
Trường Mầm non Trung Yên 2,"Đường Trung Yên 10, Khu Đô thị Trung Yên, Phường Yên Hòa, quận Cầu Giấy, Thành phố Hà Nội"
Trường Mầm non Brighton Montessori (BMV),"Cung năng khiếu Louis, Số 2 Nguyễn Thị Thập, Đối diện cổng 3 toà nhà Mandarin Garden"
Trường Mầm non Happy Smile,"Số 55 phố Trương Công Giai, phường Dịch Vọng, quận Cầu Giấy, Hà Nội"
Trường Mầm non Năng Khiếu Louis,"Số 171 Hoàng Ngân (Số 2 Nguyễn Thị Thập), P. Trung Hoà, Quận Cầu Giấy, Hà Nội"
Trường Mầm non Nụ Cười Bé Thơ,"32 Dịch Vọng, Cầu Giấy, Hà Nội"
Trường Mầm non Hà Nội Irang,"Tầng 3, Tòa Nhà 25T1, Hoàng Đạo Thúy, Phường Trung Hòa, Quận Cầu Giấy, Hà Nội"
Trường Mầm non Thăng Long Academy,"Tòa Nhà, Tầng 1, Tháp A, Thăng Long Number One, Cầu Giấy, Hà Nội"
Trường Mầm non Hoa Trà My II,Khu đô thị Nam Trung Yên – Trung Hòa
Trường Mầm non Ánh Sáng Mặt Trời,"Tầng 1, Tầng 2, Tòa nhà chung cư cao tầng CT1-CT2 (Green Park), phố Dương Đình Nghệ, Phường Yên Hoà, Quận Cầu Giấy, Hà Nội, Vietnam"
Trường Mầm non Liễu Giai Kids By Nature (KBN),"36A Nguyễn Chánh, Yên Hòa, Cầu Giấy, Hà Nội"
Trường Mầm non Hoa Sen,"Số 03 Nguyễn Xuân Linh, Trung Hòa, Cầu Giấy, Hà Nội"
MẦM NON CỔ NHUẾ 1,Phường Cổ Nhuế 1 – Q Bắc Từ Liêm – Tp Hà Nội
MẦM NON CỔ NHUẾ 2,Phường Cổ Nhuế 2 – Q Bắc Từ Liêm – Tp Hà Nội
MẦM NON ĐÔNG NGẠC A,Phường Đông Ngạc – Q Bắc Từ Liêm – Tp Hà Nội
MẦM NON ĐÔNG NGẠC B,Phường Đông Ngạc – Q Bắc Từ Liêm – Tp Hà Nội
MẦM NON HỒ TÙNG MẬU,Phường Phú Diễn – Q Bắc Từ Liêm – Tp Hà Nội
MẦM NON MINH KHAI,Phường Minh Khai – Q Bắc Từ Liêm – Tp Hà Nội
MẦM NON PHÚ DIỄN,Phường Phú Diễn – Q Bắc Từ Liêm – Tp Hà Nội
MẦM NON PHÚC DIỄN,Phường Phúc Diễn – Q Bắc Từ Liêm – Tp Hà Nội
MẦM NON TÂY TỰU,Phường Tây Tựu – Q Bắc Từ Liêm – Tp Hà Nội
MẦM NON THƯỢNG CÁT,Phường Thượng Cát – Q Bắc Từ Liêm – Tp Hà Nội
MẦM NON THỤY PHƯƠNG,Phường Thụy Phương – Q Bắc Từ Liêm – Tp Hà Nội
MẦM NON XUÂN ĐỈNH A,Phường Xuân Đỉnh – Q Bắc Từ Liêm – Tp Hà Nội
MẦM NON XUÂN TẢO,Phường Xuân Tảo – Q Bắc Từ Liêm – Tp Hà Nội
MẦM NON LIÊN MẠC,Thôn Yên Nội Xã Liên Mạc
MẦM NON AN TIÊN,Phường Cổ Nhuế 1 – Q Bắc Từ Liêm – Tp Hà Nội
MẦM NON KIM MAI,Phường Xuân Đỉnh – Q Bắc Từ Liêm – Tp Hà Nội
MẦM NON NGÔI NHÀ ÁNH SÁNG,Phường Xuân Đỉnh – Q Bắc Từ Liêm – Tp Hà Nội
MẦM NON SAO MAI,Phường Phúc Diễn – Q Bắc Từ Liêm – Tp Hà Nội
MẦM NON SƠN CA BÔNG,Phường Phúc Diễn – Q Bắc Từ Liêm – Tp Hà Nội
MẦM NON SƠN HÀ,Phường Cổ Nhuế 2 – Q Bắc Từ Liêm – Tp Hà Nội
MẦM NON TUỔI HOA,Phường Đông Ngạc – Q Bắc Từ Liêm – Tp Hà Nội
MẦM NON XUÂN ĐỈNH B,TDP Cáo Đỉnh – Xuân Đỉnh – BTL – HN
Mầm non 3-2,39 Tô Hiệu - phường Nguyễn Trãi - quận Hà Đông- TP Hà Nội
Mầm non Biên Giang,"Phường Biên Giang, quận Hà Đông, thành phố Hà Nội"
Mầm non Búp Sen Hồng,"Phường Mộ Lao, Quận Hà Đông, P. Mộ Lao, Hà Đông, Hà Nội"
Mầm non Đồng Dương,Tổ 11 - Đồng Mai - Hà Đông - Hà Nội
Mầm non Đồng Mai," Đồng Mai Hà Đông, Phường Đồng Mai, Quận Hà Đông, Hà Nội"
Mầm non Dương Nội,Dương Nội - Hà Đông - Hà Nội
Mầm non Hà Cầu,Đường Lê Hồng Phong - Phường Hà Cầu - Hà Đông - Hà Nội
Mầm non Hà Trì,Phố Lê Lai - Phường Hà Cầu - Quận Hà Đông - Hà Nội
Mầm non Hoa Hồng,Số 30 ngõ 4 Bà Triệu - Hà Đông - Hà Nội
Mầm non Hoa Mai,"Phường Vạn Phúc, Quận Hà Đông, Vạn Phúc, Hà Đông"
Mầm non Hoa Sen,Đường 19/5 - Văn Quán - Hà Đông - Hà Nội
Mầm non Kiến Hưng,Số 70 - TDP số 3 - Phường Kiến Hưng - Hà Đông - Hà Nội
Mầm non La Dương,"Trường mầm non La Dương, Phường Dương Nội - Hà Đông"
Mầm non Mậu Lương,Khu đấu giá - Tổ 10 - Kiến Hưng - Hà Đông - Hà Nội
Mầm non Nguyễn Trãi,"Phố Hoàng Văn Thụ, Nguyễn Trãi, Hà Đông, Hà Nội"
Mầm non Phú La,Khu đô thị Văn Phú mới - Phường Phú La - Hà Đông - Hà Nội
Mầm non Phú Lãm,Phường Phú Lãm - Quận Hà Đông - Thành phố Hà Nội
Mầm non Phú Lương,Tổ 18 - Phú Lương - Hà Đông - Hà Nội
Mầm non Quang Trung,202 Đường Quang Trung - Quang Trung - Hà Đông - Hà Nội
Mầm non Sơn Ca,"Phường Phúc La, quận Hà Đông, thành phố Hà Nội"
Mầm non Văn Khê,Khu tái định cư Ngô Thì Nhậm - Phường Hà Cầu - Hà Đông
Mầm non Vạn Phúc,Số 39 - Phố Lụa - Tổ dân phố Bạch Đằng - Vạn Phúc - Hà Đông - Hà Nội
Mầm non Yên Hòa,"TDP số 12, P. Yên Nghĩa, Q. Hà Đông, TP Hà Nội"
Mầm non Yên Nghĩa,Tổ dân phố số 3 - Phường Yên Nghĩa -Quận Hà Đông - TP. Hà Nội
Mầm non Yết Kiêu,56 - Tiểu Công Nghệ - Yết Kiêu - Hà Đông - Hà Nội
Mầm non Hàng Đào,"Số 35A-TDP 20, Phường Kiến Hưng, Quận Hà Đông, Hà Nội"
Mầm non Hương Sen,"9, Ngõ 6 Tổ Dân Phố số 5, Phú Lâm, Hà Đông, Hà Nội"
Mầm non Ánh Dương,Tổ dân phố 10- phường Phúc La- Quận Hà Đông- Hà Nội
Mầm non Bình Minh,"306A, khu dịch vụ Đào Đất Hàng Bè - Hà Đông - Hà Nội"
Mầm non Họa My,"Phố Ao Sen, P. Mộ Lao, Hà Đông, Hà Nội"
Mầm non Lê Trọng Tấn," Yên Nghĩa, Quận Hà Đông, Hà Nội"
Mầm non Phú Lương I,Tổ 5 Văn Nội - Phú Lương - Hà Đông - Hà Nội
Mầm non Phú Lương II,Tổ 15 Phường Phú Lương- Quận Hà Đông
Mầm non Yên Nghĩa I,"Khu A đất dịch vụ Yên Nghĩa, tổ 17 - Phường Yên Nghĩa - Quận Hà Đông - Hà Nội"
Mầm non Lê Quý Đôn,Khu đô thị mới Dương Nội- Phường Dương Nội- Quận Hà Đông- Thành phố Hà Nội
Mầm non Hoàng Hanh," Tổ dân phố Hoàng Hanh, Phường Dương Nội, Quận Hà Đông, Thành phố Hà Nội"
Mầm non Huyền Kỳ,"Ngõ 2, tổ 7 Huyền Kỳ, Phường Phú Lãm, Quận Hà Đông, Thành phố Hà Nội"
Mầm non Sen Hồng," Tổ dân phố Thành Công, Phường Dương Nội, Quận Hà Đông, Hà Nội"
Mầm non Kim Đồng,"Khu đất dịch vụ liền kề 20A-B, Phường Dương Nội, Quận Hà Đông, Hà Nội"
Mầm non Trần Quốc Toản,"Tổ dân phố Hoàng Văn Thụ, Phường Dương Nội, Quận Hà Đông, Thành phố Hà Nội"
Mầm non Hòa Bình,"TDP 14, P. Yên Nghĩa, Q. Hà Đông, TP. Hà Nội"
Mầm non La Khê,"Khu tái định cư 4A, Tổ dân phố 7, Phường La Khê, Quận Hà Đông, Hà Nội"
MẦM NON BA TRẠI A,Xã ba Trại- Ba Vì
MẦM NON CẨM LĨNH B,"Cẩm Lĩnh, Ba Vì, Hà Nội"
MẦM NON CHU MINH,Xã Chu Minh
MẦM NON KHÁNH THƯỢNG A,Khánh Thượng-Ba Vì
MẦM NON PHÚ CHÂU,Xã Phú Châu
MẦM NON TẢN VIÊN,Xã Tản Lĩnh
MẦM NON TTNC BÒ & ĐỒNG CỎ,Xã Tản Lĩnh
MẦM NON BA TRẠI B,Xã Ba Trại
MẦM NON BA VÌ,Xã Ba Vì
MẦM NON CẨM LĨNH A,Xã Cẩm Lĩnh
MẦM NON CAM THƯỢNG,Xã Cam Thượng
MẦM NON CHÂU SƠN,Xã Châu Sơn
MẦM NON CỔ ĐÔ,Xã Cổ Đô
MẦM NON ĐÔNG QUANG,Xã Đông Quang
MẦM NON ĐỒNG THÁI,Xã Đồng Thái
MẦM NON KHÁNH THƯỢNG B,Xã Khánh Thượng
MẦM NON MINH CHÂU,Xã Minh Châu
MẦM NON MINH QUANG,Xã Minh Quang
MẦM NON 1-6,Thị Trấn Tây Đằng
MẦM NON PHONG VÂN,Xã Phong Vân
MẦM NON PHÚ CƯỜNG,Xã Phú Cường
MẦM NON PHÚ ĐÔNG,Xã Phú Đông
MẦM NON PHÚ PHƯƠNG,Xã Phú Phương
MẦM NON PHÚ SƠN,Xã Phú Sơn
MẦM NON SƠN ĐÀ,Xã Sơn Đà
MẦM NON TẢN HỒNG,Xã Tản Hồng
MẦM NON TẢN LĨNH,Xã Tản Lĩnh
MẦM NON TÂY ĐẰNG,Thị Trấn Tây Đằng
MẦM NON THÁI HOÀ,Xã Thái Hòa
MẦM NON THUẦN MỸ,Xã Thuần Mỹ
MẦM NON THUỴ AN,Xã Thụy An
MẦM NON TIÊN PHONG,Xã Tiên Phong
MẦM NON TÒNG BẠT,Xã Tòng Bạt
MẦM NON VÂN HOÀ,Xã Vân Hòa
MẦM NON VAN THẮNG,Xã Van Thắng
MẦM NON VẬT LẠI,Xã Vật Lại
MẦM NON YÊN BÀI A,Xã Yên Bài
MẦM NON YÊN BÀI B,Xã Yên Bài
MẦM NON TƯ THỤC LƯƠNG THẾ VINH,Xã Vật Lại- Huyện Ba Vì- HN
MẦM NON AN MỸ,An Mỹ - Mỹ Đức
MẦM NON AN PHÚ,An Phú - Mỹ Đức 
MẦM NON AN TIẾN,An Tiến - Mỹ Đức
MẦM NON BỘT XUYÊN,Bột Xuyên - Mỹ Đức
MẦM NON ĐẠI HƯNG,Đại Hưng - Mỹ Đức
MẦM NON ĐẠI NGHĨA,Đại Nghĩa - Mỹ Đức
MẦM NON ĐỐC TÍN,Đốc Tín - Mỹ Đức
MẦM NON ĐỒNG TÂM,Đồng Tâm - Mỹ Đức
MẦM NON HỒNG SƠN,Hồng Sơn - Mỹ Đức
MẦM NON HỢP TIẾN,Hợp Tiến - Mỹ Đức
MẦM NON HỢP THANH,Hợp Thanh - Mỹ Đức
MẦM NON HÙNG TIẾN,Hùng Tiến - Mỹ Đức
MẦM NON HƯƠNG SƠN,Hương Sơn - Mỹ Đức
MẦM NON LÊ THANH A,Lê Thanh - Mỹ Đức
MẦM NON LÊ THANH B,Lê Thanh - Mỹ Đức
MẦM NON MỸ THÀNH,Mỹ Thành- Mỹ Đức
MẦM NON PHÙ LƯU TẾ,Xã Phù Lưu Tế - Mỹ Đức
MẦM NON PHÚC LÂM,Xã Phúc Lâm - Mỹ Đức
MẦM NON PHÙNG XÁ,Xã Phùng Xá - Mỹ Đức
MẦM NON TẾ TIÊU,Thị trấn Đại Nghĩa - Mỹ Đức
MẦM NON TUY LAI,Xã Tuy Lai - Mỹ Đức
MẦM NON THƯỢNG LÂM,Xã Thượng Lâm - Mỹ Đức
MẦM NON VẠN KIM,Xã Vạn Kim - Mỹ Đức
MẦM NON XUY XÁ,Xã Xuy Xá- Mỹ Đức
Mầm non Cát Linh,"Cát Linh, Đống Đa, Hanoi"
Mầm non Văn Hương,"95 Ngõ Văn Hương, Hàng Bột, Đống Đa, Hà Nội"
Mầm non Đống Đa,"1 Đào Duy Anh, Kim Liên, Đống Đa, Hà Nội"
Mầm non Kim Liên,"Số 19 Hoàng Tích Trí, Kim Liên, Đống Đa, Hà Nội"
Mầm non Hoa Sữa,"27 Phố Lương Định Của, Đông Tác, Đống Đa, Hà Nội"
Mầm non Bình Minh,"Số 30 ngõ 354/15, Ngõ 354 Trường Chinh, Khương Thượng, Đống Đa, Hà Nội"
Mầm non Họa Mi,"244 Khâm Thiên, Đống Đa, Hà Nội"
Mầm non Tuổi Hoa,"Khu B, Nam, Thành Công, Láng Hạ, Đống Đa, Hà Nội"
Mầm non Láng Thượng,"80 Chùa Láng, Láng Thượng, Đống Đa, Hà Nội"
Mầm non Sao Mai,"48 Ngõ Lương Sử C, Văn Chương, Đống Đa, Hà Nội"
Mầm non Tây Sơn,"01 Tây Sơn, Quang Trung, Đống Đa, Hà Nội"
Mầm non Ngã Tư Sở,"229 Tây Sơn, Ngã Tư Sở, Đống Đa, Hà Nội"
Mầm non Mầm Xanh,"143 Hào Nam, Chợ Dừa, Đống Đa, Hà Nội"
Mầm non Sơn Ca,"68 Ngõ Trại Tóc-Đê La Thành, Quận Đống Đa, Hà Nội"
Mầm non Phương Liên,"150, Kim Hoa, Phường Phương Liên, Quận Đống Đa, Hà Nội"
Mầm non Phương Mai,"Ngõ 102 Trường Chinh, Phương Đình, Đống Đa, Hà Nội"
Mầm non Quang Trung,"90 Trần Quang Diệu, Quang Trung, Đống Đa, Hà Nội"
Mầm non Hoa Mai,"Ngõ An Trạch, Phường Quốc Tử Giám, Quận Đống Đa, Cát Linh, Đống Đa, Hà Nội"
Mầm non Hoa Hồng,"50 Thái Thịnh II, Phường Thịnh Quang, Q. Đống Đa, Tp. Hà Nội"
Mầm non Vĩnh Hồ,"101 Ngõ Thịnh Quang, Thịnh Quang, Đống Đa, Hà Nội"
Mầm non Nắng Hồng,"2 Ngõ Trung Tả, Thổ Quan, Đống Đa, Hà Nội"
Mầm non Hoa Sen,"280 Phố Đặng Tiến Đông, Chợ Dừa, Đống Đa, Hà Nội"
Mầm non Trung Tự,"Số 4 Đặng Văn Ngữ, Quận Đống Đa, Hà Nội"
Mầm non Trung Phụng,"Số 45 ngõ 143 phố chợ Khâm Thiên, Phường Trung Phụng, Quận Đống Đa, Hà Nội"
Mầm non Văn Chương,"65 Ngõ Văn Chương 2, Văn Chương, Đống Đa, Hà Nội"
Mầm non Kim Đồng,"58 Ngõ Ngô Sỹ Liên, Văn Miếu, Đống Đa, Hà Nội"
Mầm non Văn Miếu,"67 Văn Miếu, Đống Đa, Hà Nội"
Mầm non Bé Gấu,"10 Ngõ Hàng Bột, Cát Linh, Đống Đa, Hà Nội"
Mầm non Trẻ em tương lai,"90 Phố Giảng Võ, Kim Mã, Đống Đa, Hà Nội"
Mầm non Thế Hệ Mới,"58 Hồ Văn Chương, Quận Đống Đa, Hà Nội"
Mầm non LSM - Kim Liên,"Cơ sở 8: Tầng G3, chung cư B4 Phạm Ngọc Thạch, Phường Kim Liên, Quận Đống Đa, Hà Nội"
Mầm non Shiningstar,"25 Vũ Ngọc Phan, Láng Hạ, Đống Đa, Hà Nội"
Mầm non Việt Kids,"55-57 ngõ 5 Láng Hạ, Phường Thành Công, Quận Ba Đình, Hà Nội"
Mầm non Vinschool,"54 Nguyễn Chí Thanh, Láng Thượng, Đống Đa, Hà Nội"
Mầm non Vườn Hạnh Phúc,"30 Nguyễn Chí Thanh, Láng Thượng, Đống Đa, Hà Nội"
Mầm non Minh Hải,"Ngõ 19 Nguyễn Quang Diệu, Chợ Dừa, Đống Đa, Hà Nội"
Mầm non Tiểu Tiên,"142 Hào Nam, Chợ Dừa, Đống Đa, Hà Nội"
Mầm non Sao xanh,"2 Nguyễn Phúc Lai, Chợ Dừa, Đống Đa, Hà Nội"
Mầm non Ngôi Nhà Của Bé,"17 Ngõ 62 Đặng Văn Ngữ, Phương Liên, Đống Đa, Hà Nội"
Mầm non Mặt Trời Bé Con,"B11, 181 Nguyễn Lương Bằng, Đống Đa, Hà Nội, Việt Nam"
Mầm non Những Ước Mơ Xanh,"Số 20 phố Tây Sơn, Phường Quang Trung, Quận Đống Đa, Thành phố Hà Nội"
Mầm non TH School,"6 Chùa Bộc, Quang Trung, Đống Đa, Hà Nội"
Mầm non Mặt Trời Xanh,"276 Khâm Thiên, Thổ Quan, Đống Đa, Hà Nội"
Mầm non Tuổi Thơ Tài Năng,"7/56/221, Tôn Đức Thắng, Quận Đống Đa, Thành Phố Hà Nội, Thổ Quan, Đống Đa, Hà Nội"
Mầm non Khánh Ly,"số 34 ngõ 218 Tây Sơn, Trung Liệt, Quận Đống Đa, Hà Nội"
Mầm non Ngôi Nhà Hồng,"Số 159 Đặng Tiến Đông, Quận Đống Đa, Hà Nội"
Mầm non Ngôi Sao Việt Mỹ,"Số 1, ngõ 15, Huỳnh Thúc Kháng, Láng Hạ, Quận Đống Đa, Hà Nội"
Mầm non Tuổi Thơ,"4 Thổ Quan, Đống Đa, Hà Nội"
Mầm non A Ba Đình,số 23 Phố Chu Văn An - Điện Biên - Ba Đình
Mầm non Chim Non,82/56 Kim Mã- Ba Đình
Mầm non Hoa Đào,Số 4 Phố Hoàng Diệu
Mầm non Hoa Hồng,Số 110 Phố Quán Thánh
Mầm non Hoa Mai,Số 111 Phố Nguyễn Trường Tộ
Mầm non Hoa Hướng Dương,"Số 120 Phố Đào Tấn, Cống Vị, Ba Đình"
Mầm non A,Số 23 Phố Chu Văn An
Mầm non 1/6,Số 147 Phố Nguyễn Thái Học
Mầm non số 10,Số 21 Ngõ 100 Phố Đội Cấn
Mầm non số 2,Số 62 Phố Phó Đức Chính
Mẫu giáo số 3,"Số 2 Phố Phan Huy Ích, Ba Đình"
Mầm non số 5,"Làng Ngọc Hà, Ba Đình"
Mầm non số 7,"Ngõ 660 Đường La Thành, Ba Đình"
Mầm non số 8,"Số 123 Phố An Xá, Ba Đình"
Mầm non số 9,"Số 7, Ngõ 379 Phố Đội Cấn"
Mầm non Sao Mai,Số 33 Phố Vĩnh Phúc
Mầm non Sơn Ca,Số 22 Phố Sơn Tây
Mầm non Thành Công,Khu A - TT Thành Công
Mầm non Tuổi Hoa,"Khu B Phố Trần Huy Liệu, Phường Giảng Võ"
Mầm non Tuổi Thơ,Số 25 Ngõ 447 Phố Kim Mã
MẦM NON GIÁP BÁT – HOÀNG MAI,"Tổ 5, Phường Giáp Bát"
MẦM NON HOA SỮA – HOÀNG MAI,"Tổ 5, phường Đại Kim"
MẦM NON SƠN CA – HOÀNG MAI,"132 Phố Thanh Đàm, Phường Thanh Trì"
MẦM NON BÌNH MINH – HOÀNG MAI,"Số 10, ngõ 92, đường Giáp Bát, quận Hoàng Mai, Hà Nội"
MẦM NON ĐẠI KIM,Số 276 Đại Từ- Đại Kim- Hoàng Mai- HN
MẦM NON ĐỊNH CÔNG,Tổ 23 – Phường Định Công
MẦM NON HOA HỒNG – HOÀNG MAI,Tổ 1 – Phường Tân Mai
MẦM NON HOA MAI – HOÀNG MAI,Khu phố 9 – Phường Tân Mai – quận Hoàng Mai – Hà Nội
MẦM NON HOÀNG LIỆT,"Số 3, tổ 15, Tứ Kỳ, Hoàng Liệt, Hoàng Mai, Hà Nội"
MẦM NON HOÀNG VĂN THỤ – HOÀNG MAI,121 – Đường Hoàng Mai
MẦM NON LĨNH NAM,"Tổ 4-phố Nam Dư, Phường Lĩnh Nam, Quận Hoàng Mai, Hà Nội"
MẦM NON MAI ĐỘNG,108 phố Mai Động- Phường Mai Động – Quận Hoàng Mai – Hà Nội
MẦM NON 10-10 – HOÀNG MAI,55 – Phố Nguyễn An Ninh – Phường Tương Mai
MẦM NON TÂN MAI,Ngõ 94 – Phường Tân Mai
MẦM NON THANH TRÌ,Xóm Vĩnh Thuận
MẦM NON THỊNH LIỆT,"Tổ 34, 39 Thịnh Liệt – Hoàng Mai – Hà Nội"
MẦM NON TRẦN PHÚ – HOÀNG MAI,Tổ 8 – Phường Trần Phú
MẦM NON TUỔI THƠ – HOÀNG MAI,Khu Đô thị Đền Lừ I – Phường Hoàng Văn Thụ – Quận Hoàng Mai – Hà Nội
MẪU GIÁO TƯƠNG MAI,135 – Phố Nguyễn An Ninh
MẦM NON VĨNH HƯNG,Số 4 – Ngõ 126
MẦM NON YÊN SỞ – HOÀNG MAI,Tổ 5 – Phường Yên Sở
Trường Mầm non 20-10,"số 40, phố Thợ Nhuộm, quận Hoàn Kiếm, Hà Nội"
Trường Mẫu giáo Hoa Hồng,"8 Đường Thành, Cửa Đông, Hoàn Kiếm, Hà Nội"
Trường Mầm non Đinh Tiên Hoàng,"47 Đinh Tiên Hoàng, Hàng Bạc, Hoàn Kiếm, Hà Nội"
Trường Mầm non Chim Non,"52 Hàng Tre, Lý Thái Tổ, Hoàn Kiếm, Hà Nội"
Trường Mầm non Tháng Tám,"3 Nhà Chung, Hàng Trống, Hoàn Kiếm, Hà Nội"
Trường Mầm non Hoa Sen,89 Vọng Hà - Chương Dương - Hoàn Kiếm - Hà Nội
Trường Mầm non Sao Mai,"62 Lý Thường Kiệt, Hoàn Kiếm, Hà Nội"
Trường Mẫu giáo Quang Trung,43 Phố Quang Trung - 64 Trần Quốc Toản
Trường Mầm non Lý Thường Kiệt,"57 Lý Thường Kiệt, Trần Hưng Đạo, Hoàn Kiếm, Hà Nội"
Trường Mầm non Bà Triệu,"65 Bà Triệu, Trần Hưng Đạo, Hoàn Kiếm, Hà Nội"
Trường Mẫu giáo Mầm Non A,"88 Thợ Nhuộm, Trần Hưng Đạo, Hoàn Kiếm, Hà Nội"
Trường Mầm non Tuổi Hoa,"1 Nguyễn Tư Giản, Phúc Tân, Hoàn Kiếm, Hà Nội"
Trường Mẫu giáo Tuổi Thơ,"22 Hàng Buồm, Quận Hoàn Kiếm, Thành phố Hà Nội"
Trường Mầm non Nắng Mai,53 - 55 Hàng Giấy - Hoàn Kiếm - Hà Nội
Trường Mẫu giáo Măng Non,"9 Lý Thường Kiệt, Phan Chu Trinh, Hoàn Kiếm, Hà Nội"
Trường Mầm non Hoạ Mi,"39 Phố Hàng Giấy, Hàng Mã, Hoàn Kiếm, Hà Nội"
Trường Mầm non 1-6,"42 Phố Hàng Vải, Phường Hàng Bồ, Quận Hoàn Kiếm, Thành phố Hà Nội"
Trường Mầm non Bình Minh,"75 Hàng Bông, Hoàn Kiếm, Hà Nội"
Trường Mầm non Sao Sáng,"44 Trần Hưng Đạo, Hoàn Kiếm, Hà Nội"
MẦM NON AN DƯƠNG,Số 75 An Dương – Yên Phụ
MẦM NON BÌNH MINH – TÂY HỒ,Ngõ 218 Lạc Long Quân
MẦM NON CHU VĂN AN,17-19 phố Thụy Khuê
MẦM NON NHẬT TÂN,"Số 31,ngõ 399 Nhật Tân"
MẦM NON PHÚ THƯỢNG,"Tổ 1 Cụm 1 P Phú Thượng, Tây Hồ"
MẦM NON QUẢNG AN,Số 3/67 Tô Ngọc Vân
MẦM NON TỨ LIÊN,Số 39 ngõ 124 đường Tây Hồ
MẦM NON XUÂN LA,Tổ 27cụm 4 Phường X La
MẦM NON HÀ NỘI ACADEMY,D45-46 – Ciputra – Tây Hồ
MẦM NON QuỐC TẾ HÀ NỘI,"Số 28/52 Tô Ngọc Vân, Quận Tây Hồ, Hà Nội"
MẦM NON TT ABC,"8 Âu Cơ, Tây Hồ"
MẦM NON TT Bé Gấu Maplle Canada,Thụy Khuê – Tây Hồ
MẦM NON TT BEN BEN,Số 9 Võng Thị-Tây Hồ
MẦM NON TT HỒNG HuẾ,"SN3A ngách 38/23 Xuân La – Quận Tây Hồ, Hà Nội"
MẦM NON TT THÀNH CÔNG VSK,"B19 TT Bộ GD-ĐT, ngách 46 ngõ 191 Lạc Long Quân, Tây Hồ"
MẦM NON TT Văn Hiến,Nhật Tân
MẦM NON TT Vầng Trăng,"Số 628 phố Hoàng Hoa Thám, Quận Tây Hồ, Hà Nội"
MẦM NON TT Vườn Tuổi Thơ,Quảng An
MẦM NON Horizon – TÂY HỒ,Quảng An
MẦM NON TT HOA ANH ĐÀO,"Số 275 Đường Âu Cơ, Phường Quảng An, Tây Hồ"
MẦM NON TT Trải Nghiệm Xanh,"Lạc Long QUân, Tây Hồ"
MẦM NON TT Hoa Hướng Dương,Nhật Tân
MẦM NON TT SƠN CA,"Số 7 Phố Võng Thị, Phường Bưởi, Tây Hồ"
MẦM NON TUỔI THƠ A,45 phố Yên Phụ
MẦM NON ÁNH SAO,Tổ 21 phường Thượng Thanh
MẦM NON BẮC BIÊN,
MẦM NON BẮC CẦU,
MẦM NON ĐÔ THỊ SÀI ĐỒNG – LONG BIÊN,Khu đô thị Sài Đồng
MẦM NON ĐÔ THỊ VIỆT HƯNG,Khu đô thị Việt Hưng
MẦM NON GIA THƯỢNG,
MẦM NON HOA PHƯỢNG,"Tổ 2, Phường Cự Khối"
MẦM NON HOA THỦY TIÊN,VIỆT HƯNG
MẦM NON THẠCH CẦU,
MẦM NON TUỔI HOA – LONG BIÊN,Tổ 7 phường Phúc Lợi
MẦM NON BỒ ĐỀ,"Phường Bồ Đề, Long Biên"
MẦM NON CHIM ÉN,"113 Phố Nguyễn Sơn, Long Biên"
MẦM NON CỰ KHỐI,"ĐC: Tổ 11 PCự Khối, Long Biên – ĐTVP: 0436755019"
MẦM NON GIA THUỴ,"Số 20/640 Phố Nguyễn Văn Cừ, Long Biên"
MẦM NON GIANG BIÊN,"Tổ 5 PGiang Biên, Long Biên"
MẦM NON HOA SEN – LONG BIÊN,"Tổ 27, Phường Đức Giang, Long Biên"
MẦM NON HOA SỮA – LONG BIÊN,"Ngõ 121 Phố Sài Đồng, Long Biên"
