Name,Address
MẦM NON LONG BIÊN,"Tổ 16, phường Long Biên, QLong Biên"
MẦM NON NGỌC THUỴ,"Tổ 17 Pngọc Thuỵ, Long Biên"
MẦM NON PHÚC ĐỒNG,"Ngách 355/41 Nguyễn Văn Linh, Long Biên"
MẦM NON PHÚC LỢI,"Tổ 14, phường Phúc Lợi, Long Biên"
MẦM NON SƠN CA – LONG BIÊN,"Số 26 Ngõ 66 Đường Ngọc Lâm, Long Biên"
MẦM NON THẠCH BÀN,"Tổ 13, Phường Thạch Bàn, Long Biên"
MẦM NON THƯỢNG THANH,"Tổ 10 PThượng Thanh, Long Biên"
MẦM NON VIỆT HƯNG,"PViệt Hưng, Qlong Biên"
MẦM NON ĐỨC GIANG,"Số 14 ngõ 350 Ngô Gia Tự, P Đức Giang"
MẦM NON HOA MAI – LONG BIÊN,Tổ 6 phường Thạch Bàn
MẦM NON TT BI BI,Số 39 lô 1 – Khu tái định cư P Long Biên
MẦM NON TT HUỆ MINH,129/131 tổ 22 phường Thượng Thanh
MẦM NON TT SAO VIỆT,"A4,A6-BT18 Khu đô thị Việt Hưng, P Giang Biên – ĐT: 0436574268"
MẦM NON TT SEN HỒNG,"Số 188 Nguyễn Sơn, PBồ Đề"
MẦM NON TT THIÊN ĐƯỜNG TRẺ THƠ,"Lô số 8, KĐT Việt Hưng, PGiang Biên"
MẦM NON TT TUỔI THẦN TIÊN,"Số 1 ngách 2/43 Lệ Mật, tổ 7 P Việt Hưng"
MẦM NON TT TUỔI THƠ,Số 11 phố Bồ Đề
MẦM NON TT ƯỚC MƠ XANH,Số 15 ngách 564/32 Nguyễn Văn Cừ
MẦM NON TT VIN HOMES,"Lô E8 khu đô thị Vincom Village, P Việt Hưng"
MẦM NON TT ÁNH DƯƠNG – LONG BIÊN,"99A, tổ 1, Pngọc Thuỵ, Long Biên"
MẦM NON TT BAN MAI – LONG BIÊN,"Biệt Thự B5, Khu Đô Thị Việt Hưng, Long Biên"
MẦM NON TT BÌNH MINH – LONG BIÊN,"Tổ 2 – Ck2- PThượng Thanh, Long Biên"
MẦM NON TT THĂNG LONG KIDSMART,Số 37 ngõ 67 phố Đức Giang
MẦM NON TT Công ty Diêm,"Đức Giang, Long Biên"
MẦM NON TT BEN BEN,"Số 9 ngách 32/564 Nguyễn Văn Cừ, PGia Thụy"
MẦM NON TT HẢI PHƯƠNG,"F206-208 K12, Tầng 2, Khu Đô Thị Việt Hưng, Long Biên"
MẦM NON TT THẢO LINH,"Số 7 ngõ 163 Nguyễn Văn Cừ, PNgọc Lâm"
MẦM NON TT HOA HỒNG – LONG BIÊN,"Cụm Dân Cư Số 4, PBồ Đề, Long Biên"
MẦM NON TT HOẠ MI – LONG BIÊN,"Số 10 Ngõ 1, P Ngọc Lâm, Long Biên"
MẦM NON TT LÂU ĐÀI XANH,"Phố Hoa Lâm, P Đức Giang"
MẦM NON TT CÔNG TY MAY 10,"765A Sài Đồng, Long Biên"
MẦM NON TT SAO MAI – LONG BIÊN,"54/310 Nguyễn Văn Cừ, Pbồ Đề, Long Biên"
MẦM NON TT CÔNG TY CỔ PHẦN X22,"Số 4 Ngõ 55, Tổ 19 PSài Đồng, Long Biên"
MẦM NON TT NGÔI SAO XANH,"A1, khu 5 tầng TT trường Đảng, Sài Đồng"
MẦM NON TT CÔNG TY XE LỬA GIA LÂM,"443 Đường Ngọc Lâm, Long Biên"
MẦM NON TT CÔNG TY Z133,"Phường Ngọc Thuỵ, QLong Biên"
MẦM NON BẠCH ĐẰNG,B6 ĐẦM TRẤU – PHUỜNG BẠCH ĐẰNG- HBT
MẦM NON HOA HỒNG,Số 63 Ngõ Quỳnh – Thanh Nhàn
MẦM NON LÊ ĐẠI HÀNH,53 Lê Đại Hành
MẦM NON THANH NHÀN,"Số 278 Phố Trần Khát Chân, Hai Bà Trưng, Hà Nội"
MẦM NON VÂN HỒ,Số 66 Ngõ Vân Hồ III – Phường Lê Đại Hành
MẦM NON 8-3,Phố 8/3
MẦM NON ÁNH SAO – HAI BÀ TRƯNG,20b Ngõ 874 Minh Khai
MẦM NON BÁCH KHOA,K1/46 Tạ Quang Bửu
MẦM NON ĐỒNG TÂM – HAI BÀ TRƯNG,128c Đại La
MẦM NON HOA PHƯỢNG – HAI BÀ TRƯNG,194 Bà Triệu
MẦM NON HOA THUỶ TIÊN – HAI BÀ TRƯNG,"A10 Đầm Trấu, Bạch Đằng"
MẦM NON LẠC TRUNG,Ngõ 19 Lạc Trung
MẦM NON LÊ QUÝ ĐÔN – HAI BÀ TRƯNG,Số 9 Lê Quý Đôn
MẪU GIÁO BÁCH KHOA,80/40 Tạ Quang Bửu
MẪU GIÁO BẠCH MAI,Ngõ 37 Phố Bạch Mai
MẪU GIÁO BÙI THỊ XUÂN,12 Đoàn Trần Nghiệp
MẪU GIÁO CHIM NON,86 Phố Lò Đúc
MẪU GIÁO ĐỐNG MÁC,146 Lò Đúc
MẪU GIÁO NGUYỄN CÔNG TRỨ,TT Nguyễn Công Trứ
MẪU GIÁO SAO SÁNG,Số 5 Phố Nguyễn Thượng Hiền
MẦM NON MINH KHAI – HAI BÀ TRƯNG,11 Minh Khai
MẦM NON NGÔ THÌ NHẬM,31 Phố Thi Sách
MẦM NON NGUYỄN CÔNG TRỨ,Tập Thể Nguyễn Công Trứ
MẦM NON QUỲNH LÔI,Ngõ Hồng Mai
MẦM NON QUỲNH MAI,Số 9 Kim Ngưu
MẦM NON TRƯƠNG ĐỊNH,Ngõ Thống Nhất
MẦM NON TUỔI HOA – HAI BÀ TRƯNG,Số 11 Ngõ 381 Phố Bạch Mai
MẦM NON VIỆT BUN,27 Phố Hương Viên
MẦM NON VĨNH TUY,Phường Vĩnh Tuy
MẦM NON ÁNH SAO MAI,69 ngõ 255 Phố Vọng
MẦM NON BÉ GẤU,"Số 157 Bùi Thị Xuân, Hai Bà Trưng, Hà Nội"
MẦM NON KOALA HOUSE,"Số 31 Phố Bà Triệu, Hai Bà Trưng, Hà Nội"
MẦM NON MAPLE BEAR,"Tầng 7 Vincom Mai Hắc Đế, Hai Bà Trưng, Hà Nội"
MẦM NON THẾ GiỚI TRẺ THƠ,14 Ngõ Huế – Phố Huế
MẦM NON VIỆT MỸ,"Số 248B Phố Huế, Hai Bà Trưng, Hà Nội"
MẦM NON VINSCHOOL T1,T1 KHU ĐÔ THỊ TIMESCITY – MINH KHAI- HBT
MẦM NON VINSCHOOL T2,T2 Khu đô thị Timecity – Minh Khai – HBT
MẦM NON VINSCHOOL T8,T8 KHU ĐÔ THỊ TIME CITY – MINH KHAI – HBT
MẦM NON VINSCHOOL T9,T9 KHU ĐÔ THỊ TIMESCITY – MINH KHAI – HBT
MẦM NON CHÍP CHÍP,34 Trần Xuân Soạn
MẦM NON HƯƠNG DUNG,119 Lê Thanh Nghị
MẦM NON MAI LINH,Số 7 Ngõ Thi Sách
MẦM NON NỐT NHẠC VUI,Số 3 Dãy A Ngõ 61 Lạc Trung
MẦM NON SMILEKIDS,32/5/ngõ 259 Phố Vọng
MẦM NON VẦNG TRĂNG,487 Kim Ngưu
MẦM NON VICTORIA,131 Thanh Nhàn
MẦM NON ÁNH SAO – THANH XUÂN,"Ngõ 320 – Đường Khương Đình, Phường Hạ Đình"
MẦM NON CÔNG TY 20,"35 Phan Đình Giót, Phường Phương Liệt"
MẦM NON HOA MAI – THANH XUÂN,"128b Hoàng Văn Thái, Phường Khương Mai"
MẦM NON HOẠ MY – THANH XUÂN,"143 Quan Nhân, Phường Nhân Chính"
MẦM NON HOA SEN – THANH XUÂN,129 Đường Nguyễn Trãi
MẦM NON KHƯƠNG ĐÌNH,Ngõ 54 – Bùi Xương Trạch
MẦM NON KHƯƠNG TRUNG,Số 25 Ngõ 162 Đường Khương Trung
MẦM NON MÙA XUÂN – THANH XUÂN,Số 15 Ngõ 3 -Cù Chính Lan
MẦM NON NHÂN CHÍNH,"46 Phố Nhân Hoà, Phường Nhân Chính"
MẦM NON PHƯƠNG LIỆT,"Số 1 Ngõ 36, Phường Phương Liệt"
MẦM NON SAO SÁNG – THANH XUÂN,"Ngõ 58- Hoàng Đạo Thành, Phường Kim Giang"
MẦM NON SƠN CA – THANH XUÂN,"Số 80 Hoàng Đạo Thành, Phường Kim Giang"
MẦM NON THĂNG LONG,133 Đường Nguyễn Trãi
MẦM NON THANH XUÂN BẮC,B1 – TT Thanh Xuân Bắc
MẦM NON THANH XUÂN NAM,3/18/469 – Nguyễn Trãi
MẦM NON TRÀNG AN,C19 – Nguyễn Quý Đức – Thanh Xuân
MẦM NON HOA HỒNG,Nhân Chính – Thanh Xuân – Hà Nội
MẦM NON TUỔI HOA – THANH XUÂN,"Tổ 56 Xóm Mới, Phường Thanh Xuân Nam"
MẦM NON TUỔI THƠ – THANH XUÂN,58 Ngõ 328 Nguyễn Trãi
MẦM NON TƯ THỤC CÔNG DÂN TOÀN CẦU,"Tầng 3 Hacinco, Thanh Xuân, Hà Nội"
MẦM NON TƯ THỤC HÀ NỘI KINDER LAND,"Nhà 16A Khu LICOGI, Thanh Xuân, Hà Nội"
MẦM NON TƯ THỤC HOA HỒNG,
MẦM NON TƯ THỤC HOA KỲ,"Tầng 2, Tòa nhà R2, Khu đô thị Royal City"
MẦM NON TƯ THỤC HTC PHƯƠNG LIỆT,Ngõ Phương Liệt – Thanh Xuân – Hà Nội
MẦM NON TƯ THỤC MAI CA,"Số 1;4 Ngõ 19A Nguyễn Trãi, Thanh Xuân, Hà Nội"
MẦM NON TƯ THỤC MAI PHƯƠNG,37 Phố Hoàng Ngân
MẦM NON TƯ THỤC NGÔI NHÀ TRẺ THƠ,
MẦM NON TƯ THỤC NGÓN TAY BAY,
MẦM NON TƯ THỤC VINSCHOOL,"Tầng 2, Nhà R1 Khu đô thị Royal City, 72A Nguyễn Trãi"
MẦM NON TUỔI THẦN TIÊN,55A ngõ 144 phố Quan Nhân
MẦM NON TƯ THỤC HOA TRÀ MY,NT2 Trung Hoà – Nhân Chính
MẦM NON HÀ ANH,9 Ngõ 2 Nguyễn Viết Xuân
MẦM NON HOA PHƯỢNG,"Đông Xuân, Sóc Sơn"
MẦM NON NAM SƠN,"Nam Sơn, Sóc Sơn"
MẦM NON PHÚ CƯỜNG B,"Phú Cường, Sóc Sơn, Hà Nội"
MẦM NON THỊ TRẤN SÓC SƠN,"Thị trấn Sóc Sơn, Sóc Sơn"
MẦM NON BẮC PHÚ,"Bắc phú, Sóc Sơn"
MẦM NON BẮC SƠN,"Bắc Sơn, Sóc Sơn"
MẦM NON ĐÔNG XUÂN,"Đông Xuân, Sóc Sơn"
MẦM NON ĐỨC HOÀ,"Đức Hoà, Sóc Sơn"
MẦM NON HIỀN NINH,"Hiền Ninh, Sóc Sơn"
MẦM NON HỒNG KỲ,"Hồng kỳ, Sóc Sơn"
MẦM NON KIM LŨ,"Kim Lũ, Sóc Sơn"
MẦM NON LIÊN CƠ,"Thị trấn Sóc Sơn, Sóc Sơn"
MẦM NON MAI ĐÌNH A,"Mai Đình, Sóc Sơn"
MẦM NON MAI ĐÌNH B,"Mai Đình, Sóc Sơn"
MẦM NON MINH PHÚ,"Minh Phú, Sóc Sơn"
MẦM NON MINH TRÍ,"Minh Trí, Sóc Sơn"
MẦM NON PHÚ CƯỜNG A,"Phú Cường, Sóc Sơn"
MẦM NON PHÙ LINH,"Phù Linh, Sóc Sơn"
MẦM NON PHÙ LỖ,"Phù Lỗ, Sóc Sơn"
MẦM NON PHÚ MINH,"Phú Minh, Sóc Sơn"
MẦM NON QUANG TIẾN,"Quang Tiến, Sóc Sơn"
MẦM NON TÂN DÂN,"Tân Dân, Sóc Sơn"
MẦM NON TÂN HƯNG,"Tân Hưng, Sóc SơnTân Hưng, Sóc Sơn"
MẦM NON TÂN MINH,"Tân Minh, Sóc Sơn"
MẦM NON THANH XUÂN,"Thanh Xuân, Sóc Sơn"
MẦM NON TIÊN DƯỢC A,"Tiên Dược, Sóc Sơn"
MẦM NON TRUNG GIÃ,"Trung Giã, Sóc Sơn"
MẦM NON VIỆT LONG,"Việt Long, Sóc Sơn"
MẦM NON XUÂN GIANG,"Xuân Giang, Sóc Sơn"
MẦM NON XUÂN THU,"Xuân Thu, Sóc Sơn"
MẦM NON TIÊN DƯỢC B,Xã Tiên Dược
MẦM NON TIÊN DƯỢC B,Thôn Đồng Lạc- xã Tiên Dược- Huyện Sóc Sơn
MẦM NON SAO MAI,"Mai Đình, Sóc Sơn"
MẦM NON HOA SÚNG,"Mai Đình, Sóc Sơn"
MẦM NON KIM CHUNG A,Thôn Bầu-xã Kim Chung-huyện Đông Anh
MẦM NON ÁNH DƯƠNG,Xã Tiên Dương – Đông Anh
MẦM NON BẮC HỒNG,Xã Bắc Hồng – Đông Anh
MẦM NON CỔ LOA,Xã Cổ Loa – Đông Anh
MẦM NON ĐẠI MẠCH,Xã Đại Mạch – Đông Anh
MẦM NON ĐÔNG HỘI,Xã Đông Hội – Đông Anh
MẦM NON DỤC TÚ,Xã Dục Tú – Đông Anh
MẦM NON HẢI BỐI,Xã Hảo Bối – Đông Anh
MẦM NON HOA LÂM,Xã Mai Lâm – Đông Anh
MẦM NON HOA MAI,Xã Liên Hà – Đông Anh
MẦM NON HỌA MI,Xã Vĩnh Ngọc – Đông Anh
MẦM NON HOA SEN,Xã Việt Hùng – Đông Anh
MẦM NON HOA SỮA,Xã Dục Tú – Đông Anh
MẦM NON KIM CHUNG – ĐÔNG ANH,Xã Kim Chung – Đông Anh
MẦM NON KIM NỖ,Xã Kim Nỗ – Đông Anh
MẦM NON LIÊN HÀ – ĐÔNG ANH,Xã Liên Hà – Đông Anh
MẦM NON MAI LÂM,Xã Mai Lâm – Đông Anh
MẦM NON NAM HỒNG,Xã Nam Hồng – Đông Anh
MẦM NON NGUYÊN KHÊ,Xã Nguyên Khê – Đông Anh
MẦM NON SAO MAI – ĐÔNG ANH,Thị Trấn Đông Anh
MẦM NON TÀM XÁ,Xã Tàm Xá – Đông Anh
MẦM NON THÀNH LOA,Xã Cổ Loa – Đông Anh
MẦM NON THUỴ LÂM,Xã Thuỵ Lâm – Đông Anh
MẦM NON TUỔI THƠ,Xã Uy Nỗ – Đông Anh
MẦM NON UY NỖ,Xã Uy Nỗ – Đông Anh
MẦM NON VÂN HÀ – ĐÔNG ANH,Xã Vân Hà – Đông Anh
MẦM NON VÂN NỘI,Xã Vân Nội – Đông Anh
MẦM NON VIỆT HÙNG,Xã Việt Hùng – Đông Anh
MẦM NON VÕNG LA,Xã Võng La – Đông Anh
MẦM NON XUÂN NỘN,Xã Xuân Nộn – Đông Anh
MẦM NON TIÊN DƯƠNG,Xã Tiên Dương – Đông Anh
MẦM NON VĨNH NGỌC,Xã Vĩnh Ngọc – Đông Anh
MẦM NON XUÂN CANH,Xã Xuân Canh – Đông Anh
MẦM NON DƯƠNG QUANG,"Xã Dương Quang, Gia Lâm"
MẦM NON DƯƠNG XÁ,"Xã Dương Xá, Gia Lâm"
MẦM NON HOA SỮA – GIA LÂM,"Xã Yên Viên, Gia Lâm"
MẦM NON PHÙ ĐỔNG,"Xã Phù Đổng, Gia Lâm"
MẦM NON BÁT TRÀNG,"Xã Bát Tràng, Huyện Gia Lâm"
MẦM NON CỔ BI,"Xã Cổ Bi, Gia Lâm"
MẦM NON ĐA TỐN,"Xã Đa Tốn, Gia Lâm"
MẦM NON ĐÌNH XUYÊN,"Xã Đình Xuyên, Gia Lâm"
MẦM NON ĐÔNG DƯ,"Xã Đông Dư, Gia Lâm"
MẦM NON DƯƠNG HÀ,"Xã Dương Hà, Gia Lâm"
MẦM NON HOA HỒNG – GIA LÂM,
MẦM NON HOA PHƯỢNG – GIA LÂM,"Xã Trâu Quỳ, Gia Lâm"
MẦM NON KIÊU KỴ,"Xã Kiêu Kỵ, Gia Lâm"
MẦM NON KIM LAN,"Xã Kim Lan, Gia Lâm"
MẦM NON KIM SƠN – GIA LÂM,"Xã Kim Sơn, Gia Lâm"
MẦM NON LỆ CHI,"Xã Lệ Chi, Gia Lâm"
MẦM NON NINH HIỆP,"Xã Ninh Hiệp, Gia Lâm"
MẦM NON PHÚ THỊ,"Xã Phú Thị, Gia Lâm"
MẦM NON THỊ TRẤN YÊN VIÊN,"Thị Trấn Yên Viên, Gia Lâm"
MẦM NON TRÂU QUỲ,"Thị Trấn Trâu Quỳ, Gia Lâm"
MẦM NON TRUNG MẦU,"Xã Trung Mầu, Gia Lâm"
MẦM NON VĂN ĐỨC,"Xã Văn Đức, Gia Lâm"
MẦM NON YÊN THƯỜNG,"Xã Yên Thường, Gia Lâm"
MẦM NON A ĐẶNG XÁ,Khu đô thị Đặng Xá
MẦM NON BÌNH MINH,"Xã Ninh Hiệp, Gia Lâm"
MẦM NON BAN MAI – GIA LÂM,"622 Hà Huy Tập, Yên Viên, Gia Lâm"
MẦM NON ĐẶNG XÁ,"Xã Đặng Xá, Gia Lâm"
MẦM NON HOA SEN – GIA LÂM,
MẦM NON SAO MAI – GIA LÂM,
MẦM NON PHÙNG KHOANG,"179 Phùng Khoang, phường Trung Văn"
MẦM NON ĐẠI MỖ A,Xóm Đình – phường Đại Mỗ
MẦM NON ĐẠI MỖ B,TDP Ngọc Trục – phường Đại Mỗ
MẦM NON MỄ TRÌ,"Xóm 4, Mễ Trì Thượng, phường Mễ Trì"
MẦM NON MỸ ĐÌNH 1,"Đình Thôn, phường Mỹ Đình 1"
MẦM NON PHÚ ĐÔ,Số nhà 71 – Tổ 4 – phường Phú Đô
MẦM NON TÂY MỖ A,"Khu Vường Mồng, phường Tây Mỗ"
MẦM NON TÂY MỖ B,Thôn Miêu Nha – phường Tây Mỗ
MẦM NON TRUNG VĂN,Phường Trung Văn
MẦM NON XUÂN PHƯƠNG,"Tổ dân phố Ngọc Mạch, phường Xuân Phương"
MẦM NON PHƯƠNG CANH,"TDP Hòe Thị, Phường Phương Canh"
MẦM NON ANH ĐÀO,"Tổ dân phố Phượng, Phường Tây Mỗ"
MẦM NON BÌNH MINH,"Số 4, ngõ 199, dường Hồ Tùng Mậu, Phường Cầu Diễn"
MẦM NON BƯỚC CHÂN VUI NHỘN,"Lô 123, TT3, Khu đô thị Mỹ Đình Sông Đà, phường Mỹ Đình 1"
MẦM NON CHOONGANG,"Lô 106 khu nhà TT3, khu đô thị Mỹ Đình, Mễ Trì Phường Mỹ Đình 2"
MẦM NON ETON HOUSE,"Tầng 3, Tòa A, Lô A6 Keangnam, Đường Dương Đình Nghệ"
MẦM NON FLC,"Tầng 1, Tòa nhà FLC Landmark Tower, Lê Đức Thọ, Mỹ Đình 1"
MẦM NON HOA ANH ĐÀO,"Khu đô thị Mỹ Đình 1, pHường Cầu Diễn"
MẦM NON HOA ĐÀO MONTESSORI,"Lô B2, BT5, Khu đô thị mới Mỹ Đình 2"
MẦM NON HOA KỲ,"NT2, Phố Hoài Thanh, phường Mỹ Đình 2"
MẦM NON HOA SỮA,"TDP số 3, phường Phú Đô"
MẦM NON HƯƠNG SEN,Phường Đại Mỗ
MẦM NON KIC MONTESSORI Việt Nam,"Tầng 1 và 2, đơn nguyên 1, Tòa nhà CT4, Khu đô thị Mỹ Đình – Mễ Trì"
MẦM NON LÔMÔNÔXỐP,"Đường Mễ Trì, Phường Mễ Trì"
MẦM NON MĂNG NON (BAMBOO),"Tầng 1, Chung cư CT3A, Khu đô thị Mỹ Đình 2"
MẦM NON NHỮNG THIÊN THẦN NHỎ,"Số 2, Ngách 1, Ngõ 267 Hồ Tùng Mậu, tổ 15, phường Cầu Diễn"
MẦM NON SẮC MÀU TUỔI THƠ,"Lô HH3, Khu DDGPMB và đấu giá QSD đất, phường Mỹ Đình 2"
MẦM NON SƠN CA XANH,"Số 66, đường Nguyễn Đổng Chi, phường Càu Diễn"
MẦM NON THẾ GIỚI TRẺ EM THE MAMOR,"C005 đến C011, The Moner hà Nội, Khu đô thị mới Mỹ Đình – Mễ Trì"
MẦM NON TIA NẮNG MẶT TRỜI,"Lô số 8, Khu C, Phường Mỹ Đình 2"
MẦM NON TUỔI THƠ,"Số 118, ngõ 50, Mễ Trì Thượng, phường Mễ Trì"
MẦM NON VIỆT HÀ,"Số 9, Nhân Mỹ, ngõ 322, đường Mỹ Đình, phường Mỹ Đình 1"
MẦM NON VƯỜN HOA HƯỚNG DƯƠNG,Khu đô thị An Sinh- phường Cầu Diễn
MẦM NON VƯỜN TRẺ THƠ,"BT1, Lô 15, Khu đô thị mới Mễ Trì Hạ, phường Mễ Trì"
MẦM NON VƯỜN XANH,"CT4, Khu đô thị mới Studio, Phường Mỹ Đình 1"
MẦM NON HAPYKID,"Số 40, ngõ 20, đường Mỹ Đình, phường Mỹ Đình 2"
MẦM NON LÊ QUÝ ĐÔN – TỪ LIÊM,"Khu Đô Thị Mỹ Đình 2, Đường Lê Đức Thọ, phường Mỹ Đình 2, Từ Liêm"
MẦM NON NGÔI NHÀ HỒNG,"Số 1, Ngách 54/39, phường Mỹ Đình 1"
MẦM NON A NGỌC HỒI,Ngọc Hồi – Thanh Trì
MẦM NON A VẠN PHÚC,Vạn Phúc – Thanh Trì
MẦM NON B ĐÔNG MỸ,Đông Mỹ – Thanh Trỉ
MẦM NON B NGỌC HỒI,Ngọc Hồi – Thanh Trì
MẦM NON B NGŨ HIỆP,Thôn Tương Chúc xã Ngũ Hiệp – Thanh Trì Hà Nội
MẦM NON B THỊ TRẤN VĂN ĐIỂN,Khu TT Công ty Pin – Thị Trấn Văn Điển – Thanh Trì
MẦM NON B TỨ HIỆP,Tứ Hiệp – Thanh Trì
MẦM NON ĐẠI ÁNG,Đại Áng – Thanh Trì
MẦM NON DUYÊN HÀ,Duyên Hà – Thanh Trì
MẦM NON HỮU HOÀ,Hữu Hoà – Thanh Trì
MẦM NON QUỲNH ĐÔ,Thôn Quỳnh Đô – Xã Vĩnh Quỳnh – Thanh Trì
MẦM NON TẢ THANH OAI,Đội 2 Tả Thanh Oai – Thanh Trì
MẦM NON TÂN TRIỀU,Tân Triều – Thanh Trì
MẦM NON VĨNH QUỲNH,Thôn Vĩnh Ninh – Vĩnh Quỳnh – Thanh Trì
MẦM NON YÊN NGƯU,Tam Hiệp – Thanh Trì
MẦM NON YÊN XÁ,Yên Xá –Tân Triều – Thanh Trì – Hà Nội
MẦN NON C THỊ TRẤN VĂN ĐIỂN,Khu Tập thể Yên Ngưu- Thị trấn Văn Điển – Thanh Trì
MẦM NON A LIÊN NINH,Liên Ninh – Thanh Trì
MẦM NON A THANH LIỆT,Thanh Liệt – Thanh Trì
MẦM NON A THỊ TRẤN VĂN ĐIỂN,Số 20 – Tổ 4- Khu Chợ Thị Trấn Văn Điển – Thanh Trì
MẦM NON A TỨ HIỆP,Tứ Hiệp – Thanh Trì
MẦM NON B LIÊN NINH,Liên Ninh – Thanh Trì
MẦM NON B THANH LIỆT,Thanh Liệt – Thanh Trì
MẦM NON B VẠN PHÚC,Thôn 3 xã Vạn Phúc – Thanh Trì
MẦM NON A ĐÔNG MỸ,Xã Đông Mỹ – Thanh Trì
MẦM NON HUỲNH CUNG,Ngõ 178 Phan Trọng Tuệ – Tam Hiệp – Thanh Trì
MẦM NON A NGŨ HIỆP,Ngũ Hiệp – Thanh Trì
MẦM NON TỰU LIỆT,Tam Hiệp – Thanh Trì
MẦM NON YÊN MỸ,Xóm 10 Yên Mỹ – Thanh Trì
MẦM NON VƯỜN TRẺ THƠ,Thôn Yên Xá – Tân Triều – Thanh Trì – Hà Nội
MẦM NON HOA HỒNG,Đường 70b Ngũ Hiệp –Thanh Trì
MẦM NON TUỔI HOA,Số 66 Ngõ 405 đường Ngọc Hồi – TT Văn Điển – Thanh Trì
MẦM NON TUỔI THẦN TIÊN,209 Tập Thể Kho 6 – TT Văn Điển – Thanh Trì
MẦM NON CHI ĐÔNG,TT Chi Đông – Mê Linh
MẦM NON CHU PHAN,Xã Chu Phan – Mê Linh
MẦM NON ĐẠI THỊNH,Xã Đại Thịnh – Mê Linh
MẦM NON HOÀNG KIM,Xã Hoàng Kim -mê Linh
MẦM NON KIM HOA,Xã Kim Hoa – Mê Linh
MẦM NON LIÊN MẠC – MÊ LINH,Xã Liên Mạc – Mê Linh
MẦM NON MÊ LINH,Xã Mê Linh – Mê Linh
MẦM NON QUANG MINH A,TT Quang Minh – Mê Linh
MẦM NON QUANG MINH B,TT Quang Minh – Mê Linh
MẦM NON TAM ĐỒNG,Xã Tam Đồng – Mê Linh
MẦM NON THẠCH ĐÀ A,Xã Thạch Đà – Mê Linh
MẦM NON THẠCH ĐÀ B,Xã Thạch Đà – Mê Linh
MẦM NON THANH LÂM,Xã Thanh Lâm – Mê Linh
MẦM NON TIỀN PHONG B – MÊ LINH,Xã Tiền Phong – Mê Linh
MẦM NON TIỀN PHONG A – MÊ LINH,Thôn Yên Nhân
MẦM NON TIẾN THẮNG,Xã Tiến Thắng – Mê Linh
MẦM NON TIẾN THỊNH,Xã Tiến Thịnh – Mê Linh
MẦM NON TRÁNG VIỆT,Xã Tráng Việt – Mê Linh
MẦM NON TỰ LẬP,Xã Tự Lập – Mê Linh
MẦM NON VĂN KHÊ – MÊ LINH,Xã Văn Khê – Mê Linh
MẦM NON VẠN YÊN,Xã Vạn Yên – Mê Linh
MẦM NON CỔ ĐÔNG,Xã Cổ Đông
MẦM NON ĐƯỜNG LÂM,Xã Đường Lâm
MẦM NON HOẠ MI – SƠN TÂY,Phường Lê Lợi
MẦM NON KIM SƠN – SƠN TÂY,Xã Kim Sơn
MẦM NON PHÚ THỊNH,Phường Phú Thịnh
MẦM NON QUANG TRUNG – SƠN TÂY,Phường Quang Trung
MẦM NON SƠN CA – SƠN TÂY,Phường Ngô Quyền
MẦM NON SƠN ĐÔNG,Xã Sơn Đông
MẦM NON SƠN LỘC,Phường Sơn Lộc
MẦM NON THANH MỸ,Xã Thanh Mỹ
MẦM NON TRUNG HƯNG,Phường Trung Hưng
MẦM NON TRUNG SƠN TRẦM,Phường Trung Sơn Trầm
MẦM NON VIÊN SƠN,Phường Viên Sơn
MẦM NON XUÂN KHANH,Phường Xuân Khanh
MẦM NON XUÂN SƠN,Xã Xuân Sơn
MẦM NON BA TRẠI A,Xã ba Trại- Ba Vì
MẦM NON CẨM LĨNH B,
MẦM NON CHU MINH,Xã Chu Minh
MẦM NON KHÁNH THƯỢNG A,Khánh Thượng-Ba Vì
MẦM NON PHÚ CHÂU,Xã Phú Châu
MẦM NON TẢN VIÊN,Xã Tản Lĩnh
MẦM NON TTNC BÒ & ĐỒNG CỎ,Xã Tản Lĩnh
MẦM NON BA TRẠI B,Xã Ba Trại
MẦM NON BA VÌ,Xã Ba Vì
MẦM NON CẨM LĨNH A,Xã Cẩm Lĩnh
MẦM NON CAM THƯỢNG,Xã Cam Thượng
MẦM NON CHÂU SƠN,Xã Châu Sơn
MẦM NON CỔ ĐÔ,Xã Cổ Đô
MẦM NON ĐÔNG QUANG,Xã Đông Quang
MẦM NON ĐỒNG THÁI,Xã Đồng Thái
MẦM NON KHÁNH THƯỢNG B,Xã Khánh Thượng
MẦM NON MINH CHÂU,Xã Minh Châu
MẦM NON MINH QUANG,Xã Minh Quang
MẦM NON 1-6,Thị Trấn Tây Đằng
MẦM NON PHONG VÂN,Xã Phong Vân
MẦM NON PHÚ CƯỜNG – BA VÌ,Xã Phú Cường
MẦM NON PHÚ ĐÔNG,Xã Phú Đông
MẦM NON PHÚ PHƯƠNG,Xã Phú Phương
MẦM NON PHÚ SƠN,Xã Phú Sơn
MẦM NON SƠN ĐÀ,Xã Sơn Đà
MẦM NON TẢN HỒNG,Xã Tản Hồng
MẦM NON TẢN LĨNH,Xã Tản Lĩnh
MẦM NON TÂY ĐẰNG,Thị Trấn Tây Đằng
MẦM NON THÁI HOÀ,Xã Thái Hòa
MẦM NON THUẦN MỸ,Xã Thuần Mỹ
MẦM NON THUỴ AN,Xã Thụy An
MẦM NON TIÊN PHONG,Xã Tiên Phong
MẦM NON TÒNG BẠT,Xã Tòng Bạt
MẦM NON VÂN HOÀ,Xã Vân Hòa
MẦM NON VAN THẮNG,Xã Van Thắng
MẦM NON VẬT LẠI,Xã Vật Lại
MẦM NON YÊN BÀI A,Xã Yên Bài
MẦM NON YÊN BÀI B,Xã Yên Bài
MẦM NON TƯ THỤC LƯƠNG THẾ VINH,Xã Vật Lại- Huyện Ba Vì- HN
MẦM NON HIỆP THUẬN,Xã Hiệp Thuận
MẦM NON PHƯƠNG ĐỘ,Xã Phương Độ
MẦM NON TÍCH GIANG,Xã Tích Giang
MẦM NON VÂN HÀ – PHÚC THỌ,Xã Vân Hà
MẦM NON HÁT MÔN,Xã Hát Môn
MẦM NON LONG XUYÊN,Phòng GD & ĐT
MẦM NON NGỌC TẢO,Xã Ngọc Tảo
MẦM NON PHÚC HOÀ,Xã Phúc Hòa
MẦM NON PHỤNG THƯỢNG,Xã Phung Thượng
MẦM NON SEN CHIỂU,Xã Sen Chiểu
MẦM NON TAM HIỆP,Xã Tam Hiệp
MẦM NON TAM THUẤN,Xã Tam Thuấn
MẦM NON THANH ĐA,Xã Thanh Đa
MẦM NON THI TRẤN PHÚC THỌ,Thị Trấn Phúc Thọ
MẦM NON THỌ LỘC,Xã Thọ Lộc
MẦM NON THƯỢNG CỐC,Xã Thượng Cốc
MẦM NON TRẠCH MỸ LỘC,Xã Trạch Mỹ Lộc
MẦM NON VÂN NAM,Xã Vân Nam
MẦM NON VÂN PHÚC,Xã Vân Phúc
MẦM NON VÕNG XUYÊN A,Xã Võng Xuyên
MẦM NON VÕNG XUYÊN B,Xã Võng Xuyên
MẦM NON XUÂN PHÚ,Xã Xuân Phú
MẦM NON HOA MAI,Xã Phụng Thượng
MẦM NON LIÊN HIỆP,Xã Liên Hiệp
MẦM NON ĐAN PHƯỢNG,Thôn Đông Khê- Xã Đan Phượng – Đan Phượng
MẦM NON ĐỒNG THÁP,Thôn Bãi Tháp – Đồng Tháp – Đan Phượng
MẦM NON HẠ MỖ,"Đội 6, Xã Hạ Mỗ – Đan Phượng"
MẦM NON HỒNG HÀ,Cụm 2 – Hồng Hà – Đan Phượng
MẦM NON HUYỆN – ĐAN PHƯỢNG,Số 6 Ngõ 132 Phố Phan Đình Phùng-thị Trấn Phùng-đan Phượng-hà Nội
MẦM NON LIÊN HÀ – ĐAN PHƯỢNG,"Thôn Quý, xã Liên Hà – Đan Phượng"
MẦM NON LIÊN HỒNG,"Thôn Tổì, xã Liên Hồng – Đan Phượng"
MẦM NON LIÊN TRUNG,"Thôn Trung, xã Liên Trung – Đan Phượng"
MẦM NON PHƯƠNG ĐÌNH,"Thôn Địch Trung, Xã Phương Đình – Đan Phượng"
MẦM NON SONG PHƯỢNG,"Thôn Thu Quế, Xã Song Phượng – Đan Phượng"
MẦM NON TÂN HỘI,Thôn Vĩnh Kỳ – Tân Hội – Đan Phượng
MẦM NON TÂN LẬP,Thôn Ngọc Kiệu- Xã Tân Lập- Huyện Đan Phượng
MẦM NON THỊ TRẤN PHÙNG,Phố Thuỵ Ứng – Thị Trấn Phùng – Đan Phượng
MẦM NON THỌ AN,Thôn Đông Hải – xã Thọ An- Đan Phượng
MẦM NON THỌ XUÂN,Thôn Thống Nhất- Thọ Xuân – Đan Phượng
MẦM NON THƯỢNG MỖ,THôn 3 – xã Thượng Mỗ – Đan Phượng
MẦM NON TRUNG CHÂU,"Thôn 4, Trung Châu, Đan Phượng"
MẦM NON An Khánh C,"An Khánh, Hoài Đức, Hà Nộii"
MẦM NON An Thượng B,
MẦM NON Cát Quế B,Cát Quế- Hoài Đức
MẦM NON Đức Giang B,
MẦM NON SONG PHƯƠNG B,
MẦM NON Vân Côn B,
MẦM NON Vân Côn C,
MN Tiền Yên B,Xã Tiền Yên- Hoài Đức
MẦM NON 10-10 – HOÀI ĐỨC,Kim Chung- Hoài Đức
MẦM NON AN KHÁNH A,An Khánh- Hoài Đức
MẦM NON AN KHÁNH B,An Khánh- Hoài Đức
MẦM NON An Thượng A,An Thượng – Hoài Đức
MẦM NON CÁT QUẾ A,Cát Quế- Hoài Đức
MẦM NON ĐẮC SỞ,Đắc Sở- Hoài Đức
MẦM NON DI TRẠCH,Thôn Dền – Di Trạch – Hoài Đức
MẦM NON ĐÔNG LA,Đông La – Hoài Đức
MẦM NON ĐỨC GIANG A – HOÀI ĐỨC,Đức Giang- Hoài Đức
MẦM NON ĐỨC THƯỢNG – HOÀI ĐỨC,Đức Thượng- Hoài Đức
MẦM NON DƯƠNG LIỄU,Dương Liễu- Hoài Đức
MẦM NON Kim Chung,Kim Chung- Hoài Đức
MẦM NON LA PHÙ,La Phù- Hoài Đức
MẦM NON LẠI YÊN,Xã Lại Yên- Hoài Đức
MẦM NON MINH KHAI – HOÀI ĐỨC,Minh Khai- Hoài Đức
MẦM NON SƠN ĐỒNG,Sơn Đồng- Hoài Đức
MẦM NON SONG PHƯƠNG A,Song Phương- Hoài Đức
MẦM NON HOA SEN – HOÀI ĐỨC,Thị Trấn Trạm Trôi- Hoài Đức
MẦM NON Tiền Yên A,Tiền Yên- Hoài Đức
MẦM NON VÂN CANH,Kim Hoàng – Vân Canh – Hoài Đức
MẦM NON Vân Côn A,Xã Vân Côn -hoài Đức
MẦM NON YÊN SỞ – HOÀI ĐỨC,Yên Sở – Hoài Đức
Mầm non Hoa Mai,Xã An Thượng
MẦM NON Newsun,Đức Thượng- Hoài Đức- Hà Nội
MẦM NON Tư thục Hương Sen,TT Trạm Trôi- Hoài Đức
MN Sao Mai,Xã Đức Thượng- Hoài Đức
MẦM NON ĐÔNG YÊN B,Thôn Việt Yên – Xã Đông Yên – Huyện Quốc Oai
MẦM NON SÀI SƠN B,Thôn Thụy Khuê – xã Sài Sơn – huyện Quốc Oai
MẦM NON THỊ TRẤN QUỐC OAI B,Thôn Du Nghệ – thị trấn Quốc Oai – Huyện Quốc Oai
MẦM NON ĐÔNG XUÂN,thôn Cửa Khâu – Xã Đông Xuân – Huyện Quốc Oai
MẦM NON CẤN HỮU,thôn Cấn Thượng – Xã Cấn Hữu – Huyện Quốc Oai
MẦM NON CỘNG HOÀ,Xóm Sổ – Xã Cộng Hoà – Huyện Quốc Oai
MẦM NON ĐẠI THÀNH,Thôn Tình Lam – Xã Đại Thành – Huyện Quốc Oai
MẦM NON ĐỒNG QUANG,Thôn Yên Nội – Xã Đồng Quang – Huyện Quốc Oai
MẦM NON ĐÔNG YÊN A,Thôn Đông Thượng – Xã Đông Yên – Huyện Quốc Oai
MẦM NON HOÀ THẠCH,Thôn Bạch Thạch – Xã Hoà Thạch – Huyện Quốc Oai
MẦM NON HUYỆN – QUỐC OAI,Thị Trấn Quốc Oai – Huyện Quốc Oai
