category,location,name,open_time,point,price
Chuyên món chả cá,"Số 77 Hào Nam, P. Ô Chợ Dừa, Q. Đống Đa",Chả Cá Hàng Sơn - Hào Nam ,10h30 – 14h00 & 17h30 – 22h00,3.8,200.000 - 300.000 đ/người
Gọi món Thái Lan,"Lô T261, Tầng 2, TTTM Aeon Mall Hà Đông, P. Dương Nội, Q. Hà Đông",ThaiExpress - Aeon Mall Hà Đông,11h00 – 14h00 & 17h30 - 21h30,3.9,250.000 - 350.000 vnđ/người
Chuyên món chả cá,"Số 15 Trần Hưng Đạo, P. Phan Chu Trinh, Q. Hoàn Kiếm",Chả Cá Hàng Sơn - Trần Hưng Đạo,10h30 – 14h00 & 17h30 – 22h00,3.8,200.000 - 300.000 đ/người
Chuyên hải sản ,"295 Trần Đại Nghĩa, P. Trương Định, Q. Hai Bà Trưng",Mr Tom American - Hải Sản Cajun Mỹ - Trần Đại Nghĩa  ,10h00 – 22h00,3.6,300.000 - 500.000 đ/người
Gọi món Huế ,"L4 – 02 Vincom Ocean Park Gia Lâm,Huyện Gia Lâm",Nét Huế - Ocean Park Gia Lâm,09h30 - 22h00,3.5,50.000 - 150.000 đ/người
Gọi món Thái,"Số 57 phố Bùi Thị Xuân, P. Nguyễn Du, Q. Hai Bà Trưng",TSF - Thai Street Food - Bùi Thị Xuân ,11h00 – 15h00 & 17h00 – 23h00 ,3.8,150.000 - 250.000 đ/người
Gọi món Á,"12 Huỳnh Thúc Kháng, P. Thành Công, Q.Ba Đình",Sentosa - Huỳnh Thúc Kháng,11h00 – 21h00,3.8,180.000 - 230.000 đ/người
Gọi món (Món ăn trên đĩa nóng),"Tầng B1, TTTM Times City, Minh Khai, Q. Hai Bà Trưng, Hà Nội",Hotto - Times City  ,10h00 – 21h00,3.8,80.000 - 150.000 đ/người
Gọi món Việt," Số 1 Đường Võ nguyên Giáp, Thôn Thái Phù, Xã Mai Đình, Huyện Sóc Sơn",Thảo Nguyên Xanh Restaurant - Võ Nguyên Giáp,10h30 – 13h30 & 17h30 – 21h30,3.8,250.000 – 300.000 đ/người
Gọi món Việt (Món đường phố),"TTTM Vincom, Tầng 5, Số 2 Phạm Ngọc Thạch, Q. Đống Đa",VietStreet - Vincom Phạm Ngọc Thạch,10h00 – 21h00,3.8,120.000 - 180.000 đ/người
Gọi món (Món ăn trên đĩa nóng),"Tầng 5, TTTM Vincom Nguyễn Chí Thanh",Hotto - Vincom Nguyễn Chí Thanh,10h00 – 21h00,3.8,80.000 - 150.000 đ/người
"Buffet lẩu, Gọi món Việt (Chuyên lẩu)","Số 17, Ngõ 20 Nguyễn Chánh, P. Trung Hòa, Q. Cầu Giấy (Ngõ 204 Trần Duy Hưng đi vào)",Lẩu Sơn Tùng - Nguyễn Chánh,10h00 - 13h30 & 17h00 - 22h00,3.7,150.000 – 200.000 đ/người
Buffet Nướng Lẩu Hàn Quốc,"B2-R4-17, Tầng hầm B2, TTTM Royal City, Số 72A Nguyễn Trãi, Q. Thanh Xuân",Gri & Gri - Royal City,10h00 - 21h30,4,230.000 - 300.000 đ/người
Gọi món Việt,"F3-C01, Tầng 3, TTTM Lotte Center, 54 Liễu Giai, Q. Ba Đình",Phố Ngon 37 – Lotte Center ,10h30 – 21h30,3.9,200.000 - 250.000 vnđ/người
Gọi món Nhật,"Số 48 Đào Tấn, Q. Ba Đình",Sushi Hokkaido Sake - 48 Đào Tấn,10h30 - 13h30 & 17h30 - 21h00,4.1,470.000 - 500.000 vnđ/người
Gọi món Nhật Bản,"Tầng 1, Tòa nhà Hanoi Tower, Số 49, Phố Hai Bà Trưng, Q. Hoàn Kiếm",Tamaya Japanese Restaurant - Hai Bà Trưng ,"10h00 - 14h00 ,  17h00 - 22h00",4,300.000 - 500.000 đ/người
Gọi món Nhật Bản,"Số 84 Đào Tấn, P. Cống Vị, Q. Ba Đình",Kegon Japanese Restaurant - Đào Tấn,11h00 – 14h00 & 17h00 – 22h00,3.8,200.000  – 500.000đ/người
Buffet lẩu Hong Kong,"Số 81 Trung Hoà, P. Trung Hoà, Q. Cầu Giấy",IPOT - Lẩu Hồng Kông - Trung Hòa,"10h30 – 14h00 , 18h00 – 22h00",3.8,200.000  – 300.000 đ/người
"Buffet, gọi món nướng lẩu Thái Lan","Tầng 5, TTTM MIPEC Long Biên, Số 2 Phố Long Biên II, P. Ngọc Lâm, Q. Long Biên",Asian BBQ & Hotpot - Mipec Long Biên,10h00 – 22h00,3.6,80.000  – 120.000 đ/người
Buffet nướng lẩu,"B7 Khu biệt thự liền kề Pandora, Số 53 Triều Khúc.Q.  Thanh Xuân",Buffet Lẩu Nướng Nhất Nhất - Triều Khúc,10h00 - 14h00 và 17h00 - 22h00,3.9,120.000 - 220.000 đ/người
Gọi món Âu (Chuyên Steak Pháp),"Số 34 Phan Chu Trinh, Q. Hoàn Kiếm",Le Monde Steak - Phan Chu Trinh,11h00-14h00 & 17h00-21h30,3.7,150.000 - 250.000 vnđ/người
Buffet nướng lẩu Hàn Quốc,"Tầng 5, Vincom Nguyễn Chí Thanh, số 54A Nguyễn Chí Thanh, P. Láng Thượng, Q. Đống Đa",King BBQ Buffet - Vincom Nguyễn Chí Thanh,10h00 - 22h00,4,250.000 - 400.000 đ/người
"Gọi món, buffet Nhật Bản","Tầng 02, Viettower, Số 01 Thái Hà, P. Trung Liệt, Q. Đống Đa",Isushi – Thái Hà ,10h30 – 14h00 và 17h00 – 22h00,4,350.000 - 550.000 vnđ/người
"Gọi món Á, Âu (Bia tươi Tiệp)","Số 1A Tăng Bạt Hổ, P. Phạm Đình Hổ, Q. Hai Bà Trưng",Hoa Viên Brauhaus - Tăng Bạt Hổ,10h00 – 23h00,4,350.000 – 500.000 đ/người
Gọi món Việt,"Số 2B Phủ Doãn, P. Hàng Bông, Q. Hoàn Kiếm",Nem Nướng Xuân Dần - Phủ Doãn,10h00 – 14h30 & 16h00 – 22h00,3.4,100.000 – 150.000 đ/người
Gọi món nướng Hàn Quốc,"Shophouse lô B5-01, B5-02, B5-03 Vinhomes Gardenia, Đường Hàm Nghi, P. Cầu Diễn, Q. Nam Từ Liêm",Meat Plus 4+4 - Vinhomes Gardenia,11h00 – 14h00 & 17h00 – 22h00,3.8,250.000 – 300.000đ/người
Gọi món Tây Bắc,"Số 21 Phùng Hưng (ngắn), P. Hàng Mã, Q. Hoàn Kiếm",Quả Trám - Phùng Hưng  ,10h00 - 14h30 & 17h00 - 22h00,3.8,200.000 – 300.000 đ/người
Buffet lẩu Châu Á,"Tầng 3, Lotte Department Store, Số 54 Liễu Giai, P. Cống Vị, Q. Ba Đình ",Hotpot Story – Lotte Center,11h00 – 14h00 và 17h30 -  21h00,3.7,250.000 - 350.000 vnđ/người
Buffet nướng lẩu Nhật Bản,"Lotte Department Store, Tầng 3, Số 54 Liễu Giai, P. Cống Vị, Q. Ba Đình",Tasaki BBQ - Lotte Center,10h00 - 22h00,3.8,250.000 - 350.000 đ/người
Buffet; Gọi món Nhật Bản,"Số 152 Ngọc Khánh, P. Giảng Võ, Q. Ba Đình",G8 Osake House - 152 Ngọc Khánh  ,10h00 – 14h00 & 17h00 – 22h00,3.6,200.000 – 300.000 đ/người
Chuyên Cá Lăng và Bò nhúng dấm,"Nhà D8-9, khu nhà phố Dream Land, 107 Xuân La, P. Xuân Tảo, Q. Bắc Từ Liêm",Cá lăng ngự viên – Bò nhúng dấm F5 Farm – Xuân La,10h00 - 14h00 & 17h00 - 22h00,3.8,180.000 – 250.000 đ/người
Buffet lẩu & Dimsum,"Lô CX14 - KĐT Linh Đàm, P. Hoàng Liệt, Q. Hoàng Mai (Cạnh bể bơi Linh Đàm) ",Dimsum & Lẩu Trung Hoa – FengHuang – Linh Đàm,11h00 – 14h00 & 18h00 – 21h30,3.5,209.000 - 269.000 đ/người
Gọi món Việt,"Số 126 ngõ 553 Giải Phóng, P. Giáp Bát, Q. Hoàng Mai",Hải Nguyên Quán - Ngõ 553 Giải Phóng,09h00 – 22h00,3.3,150.000 – 200.000 đ/người
Gọi món Nhật Bản,"L3-RS1 Ciputra Hà Nội, P. Xuân Đỉnh, Q. Bắc Từ Liêm",Tomita Bento – Ciputra Hà Nội,10h30 – 13h30 & 17h30 – 21h30,4,150.000 – 250.000 đ/người
Gọi món nướng lẩu Hàn Quốc,"Tầng 5, TTTM Vincom, 191 Bà Triệu, P. Lê Đại Hành, Q. Hai Bà Trưng",King BBQ Deli – Vincom Bà Triệu ,10h00 - 22h00,4,200.000 - 400.000 đ/người
Buffet Nướng Lẩu Hàn Quốc,"Tầng 4, TTTM Savico Mega Mall Long Biên, 7-9 đường Nguyễn Văn Linh, Q. Long Biên",Buk Buk – Savico Mega Mall,10h00 - 22h00,3.6,150.000 - 250.000 đ/người
Chuyên món chả cá,"Số 339 -341 Trần Khát Chân, P. Thanh Nhàn, Q. Hai Bà Trưng",Chả Cá Gia Nguyễn - Trần Khát Chân,09h00 - 14h00 và 17h00 - 22h00,3.8,150.000 - 200.000 đ/người
Gọi món Việt (Chuyên hải sản),"Số 12 Phạm Huy Thông, Q. Ba Đình",Sơn Thủy Restaurant - Phạm Huy Thông,10h30 – 13h30 và 17h30 – 21h30,3.8,250.000 – 500.000 đ/người
Gọi món Việt,"Khu liên hiệp thể thao cây xanh (đối diện sân tập gold), P. Kiến Hưng, Q. Hà Đông",Tre Viên Quán - Hà Đông,10h00 – 22h00,3.5,150.000  – 200.000 đ/người
Gọi món Việt (Cơm Tấm),"Số 70 Phố Dịch Vọng Hậu, P. Dịch Vọng Hậu, Q. Cầu Giấy ",Cơm Tấm Tường Hân – Dịch Vọng Hậu,10h00 - 13h30 & 17h00 - 20h00,3.8,60.000 - 90.000 đ/người
Gọi món Âu,"Số 33 Tô Ngọc Vân, Q. Tây Hồ",Daluva Restaurant Bar – Tô Ngọc Vân,10h30 – 23h00,3.5,150.000 – 250.000 đ/người
"Gọi món Singapore, Buffet nướng lẩu","Số 76 Yên Phụ nhỏ, Khách sạn The Hanoi Club, Q. Tây Hồ",Tivoli - The Hanoi Club Hotel,Alacarte: 11h00 – 22h00; Buffet T7: 18h00 – 21h30,3.8,150.000 – 350.000 đ/người
Gọi món Ý,"Số 2 Chương Dương Độ, Thiên Sơn Plaza, Tầng 1, Q. Hoàn Kiếm",Mamma Mia - Italian Restaurant,11h00 – 14h00 và 18h00 – 22h00,3.8,280.000 – 350.000 đ/người
Gọi món Trung Hoa,"Số 2A Láng Hạ, Q. Ba Đình",Meiwei – Láng Hạ,10h00 - 22h00,3.9,150.000 - 250.000 đ/người
Gọi món Nhật Bản,"Số 67 Hoàng Cầu, P. Ô Chợ Dừa, Q. Đống Đa",Sio Sushi - Hoàng Cầu,10h30 – 14h00 & 17h30 – 22h00,4,150.000 – 200.000 đ/người
Buffet nướng lẩu Hàn Quốc,"Số 229 Tô Hiệu, P. Dịch Vọng, Q. Cầu Giấy",Wang Wang – Tô Hiệu,11h00 – 13h30 & 17h30 – 21h30,3.5,115.000 – 190.000đ/người
Gọi món Nhật Bản,"Số 13 Lê Đại Hành, P.Lê Đại Hành, Q. Hai Bà Trưng",Sio Sushi - Lê Đại Hành ,10h30 – 14h00 & 17h30 – 22h00,4,150.000 – 200.000 đ/người
Gọi món Nhật Bản,"Số 20 Đào Tấn, P. Cống Vị, Q. Ba Đình",Taki Taki - Đào Tấn,"10h00 -14h00, 17h00 – 22h00",3.8,300.000  – 500.000 đ/người
Gọi món Việt,"Tầng 2 & 3, Số 27 Lê Văn Lương, Tòa nhà Hanoi Center Point,Q. Thanh Xuân",Đại Lâm Mộc - Lê Văn Lương,"10h30 -14h00, 17h30 – 22h00",3.9,300.000 – 500.000 đ/người
Buffet Lẩu Châu Á,"Gian TN55, Hầm B1, TTTM Vincom Mega Times City, Số 458 Minh Khai, Q. Hai Bà Trưng",Hotpot Story – Times City,10h00 - 13h00 & 18h00 – 21h00,3.7,250.000 - 350.000 vnđ/người
Gọi món Huế,"Vincom Sky Lake Phạm Hùng,Tầng 3, L3 – 12,  P. Mỹ Đình, Q. Nam Từ Liêm",Nét Huế - Vincom Sky Lake Phạm Hùng,09h30 – 21h00,3.8,50.000 - 150.000 đ/người
Beer - Club,"Số 32 Lò Sũ, Tầng 13-14-15, P. Lý Thái Tổ, Q. Hoàn Kiếm, Hà Nội",Diamond Sky Bar - Lò Sũ,11h30 – 24h00,4.5,400.000 – 600.000 đ/người
Chuyên lẩu nấm,"Số 17 Huỳnh Thúc Kháng, P. Láng Hạ, Q. Đống Đa",Lẩu Nấm Ashima - Huỳnh Thúc Kháng ,10h30 - 14h00 & 17h00 - 21h00,3.9,350.000 - 400.000 đ/người
Gọi món Việt,"Số 159 Hoàng Ngân, P. Trung Hòa, Q. Cầu Giấy",Cầm Viên Quán – Hoàng Ngân,10h30 - 13h30 và 17h30 - 21h30,3.5,250.000 – 350.000 đ/người
Chuyên lẩu Nấm,"60 Giang Văn Minh, Q. Ba Đình",Lẩu Nấm Ashima - Giang Văn Minh,11h00 – 22h00,3.9,350.000 - 400.000 đ/người
Chuyên lẩu nấm,"Tòa nhà N04, Tầng 2, đường Hoàng Đạo Thúy, P. Trung Hòa, Q. Cầu Giấy",Lẩu Nấm Ashima - Hoàng Đạo Thúy ,10h30 - 14h00 & 17h00 - 21h00,3.9,350.000 - 400.000 đ/người
Gọi món Mỹ,"Số 56 Trần Quốc Toản, P. Trần Hưng Đạo, Q. Hoàn Kiếm",RICO Steakhouse - Trần Quốc Toản,10h00 - 14h00 & 17h00 - 22h00,4,500.000 – 1.000.000 đ/người
Gọi món lẩu hơi,"B2 – 05A Vinhomes Gardenia Hàm Nghi ,  Mỹ Đình , Q. Nam Từ Liêm",Lẩu Hấp Fresh - Vinhomes Gardenia Hàm Nghi,"10h30 - 14h00, 17h00 - 22h00",3.7,200.000 – 300.000 đ/người
Chuyên món Chim,"BT50 - TT4, Đường Số 1, Khu ĐTM thành phố Giao Lưu, 232 Phạm Văn Đồng, P. Cổ Nhuế 1, Q. Bắc Từ Liêm",Chim To Dần - Hà Nam Quán - Phạm Văn Đồng,09h00 - 22h00,3.5,120.000 - 200.000 đ/người
Gọi món Việt,"Số 24 Mạc Thái Tông, P. Trung Hòa, Q. Cầu Giấy",Quán Nhà Ta - Mạc Thái Tông,11h00 - 14h00 & 17h00 - 21h00,3.5,150.000 – 250.000 đ/người
Buffet lẩu băng chuyền,"Tầng G, Dophin Plaza, số 6 Nguyễn Hoàng, P. Mỹ Đình 2, Q. Cầu Giấy",Lẩu Băng Chuyền Kichi-Kichi - Dolphin Plaza,11h00 - 14h00 & 17h00 - 21h30,3.9,230.000 - 280.000 đ/người
Buffet Lẩu Châu Á,"Royal City, tầng B2, Lô B2-R6-39, số 72A Nguyễn Trãi, P. Thượng Đình, Q. Thanh Xuân ",Hotpot Story - Royal City  ,11h00 - 14h00 & 18h00 - 21h00,3.7,250.000 - 350.000 vnđ/người
Gọi món Thái Lan,"Tầng 3, Lotte Center , 54 Liễu Giai, P. Cống Vị, Q. Ba Đình",ThaiExpress – Lotte Center     ,10h30 – 21h30,3.9,250.000 - 350.000 vnđ/người
Buffet lẩu băng chuyền,"Số 105 Trần Thái Tông, P. Dịch Vọng Hậu, Q. Cầu Giấy",Lẩu Băng Chuyền Kichi-Kichi - Trần Thái Tông,17h00 - 21h30,3.9,230.000 - 280.000 đ/người
Gọi món Huế,"Số 57 Lạc Trung, P. Vĩnh Tuy, Q. Hai Bà Trưng",Nét Huế - Lạc Trung ,07h00 - 22h00,3.5,50.000 - 150.000 đ/người
Gọi món Thái Lan,"Tầng 5, Vincom Center , 191 Bà Triệu, P. Lê Đại Hành, Q. Hai Bà Trưng",ThaiExpress - Vincom Bà Triệu      ,10h30 – 21h30,3.9,250.000 - 350.000 vnđ/người
Buffet nướng lẩu Hàn Quốc,"18BT5 Nguyễn Khuyến – Văn Quán, Q. Hà Đông (cạnh Highland Coffee Nguyễn Khuyến)",GOPchain – Quán thịt nướng & lẩu Hàn Quốc – Nguyễn Khuyến,10h30 – 14h00 & 17h00 – 23h00,3.7,120.000 - 260.000 vnđ/người
Gọi món Việt (Đặc sản xứ Thanh),"Số 91 Trần Quốc Vượng, P. Dịch Vọng Hậu, Q. Cầu Giấy ",Hương Vị Xứ Thanh - Trần Quốc Vượng,08h00 - 14h00 & 16h30 - 21h00,3.6,80.000 - 150.000 đ/người
Gọi món Việt,"Số 38 Trần Kim Xuyến, P. Yên Hòa, Q. Cầu Giấy",Cá 38 - Vua Cá Sông - Trần Kim Xuyến,"10h00 – 14h00, 17h00 – 22h00 ",3.8,150.000 – 250.000 đ/người
Buffet nướng lẩu,"TT02-01 Mon City, Ngõ 4 Hàm Nghi, P.  Mỹ Đình 2, Q. Nam Từ Liêm",Buffet Lẩu Nướng Nhất Nhất – Mon City,10h00 - 14h00 và 17h00 - 22h00,3.9,120.000 - 220.000 đ/người
Chuyên cá hồi,"Số 19, Ngõ 17 Lê Văn Thiêm, P. Nhân Chính, Q. Thanh Xuân ",Cá Hồi Phương Linh – Lê Văn Thiêm ,10h00 - 13h00 & 17h00 - 21h00,3.5,250.000 – 300.000 đ/người
Gọi món Mỹ,"Tầng 5, TTTM Vincom 54 Nguyễn Chí Thanh, P. Láng Thượng, Q. Đống Đa",Cowboy Jack’s Saloon – Vincom Nguyễn Chí Thanh,10h30 – 21h30,3.8,200.000 - 250.000 vnđ/người
Gọi món Trung Hoa,"Royal City, Tầng B2, Lô B2-R3-09B+C, 72 Nguyễn Trãi, P. Thượng Đình, Q.Thanh Xuân ",Meiwei – Royal City     ,10h00 - 22h00,3.9,150.000 - 250.000 đ/người
Buffet Lẩu Nướng Hàn Quốc,"Số 02 BT – 1B KĐT Văn Quán, P. Phúc La, Q. Hà Đông",Wang Wang – Quán thịt nướng Hàn Quốc – KĐT Văn Quán ,11h00 – 13h30 & 17h30 – 21h30,3.8,115.000 – 190.000đ/người
Buffet lẩu băng chuyền,"TTTM Savico, Tầng 3, Số 07 - 09 đường Nguyễn Văn Linh, P. Gia Thụy, Q. Long Biên",Lẩu Băng Chuyền Kichi-Kichi - Savico Long Biên,11h00 – 14h00 & 17h00 – 21h30,3.9,230.000 - 280.000 vnđ/người
Gọi món Việt (Chuyên Dê),"Số 1 ngõ 167 Tây Sơn, P. Quang Trung, Q. Đống Đa",Lẩu Dê Nhất Ly - Tây Sơn,10h00 - 14h00 và 16h00 - 21h30,4,230.000 - 350.000 vnđ/người
Buffet Lẩu Trung Hoa,"18 Đoàn Trần Nghiệp ,Q. Hai Bà Trưng ",Hoolong - Dumpling Bar - Đoàn Trần Nghiệp,10h30 - 12h30 & 17h30 - 20h00,3.8,250.000 - 350.000 đ/người
Cơm niêu Singapore,"78 Vương Thừa Vũ, P. Khương Trung, Q. Thanh Xuân ",Kombo - Cơm Niêu Singapore - Vương Thừa Vũ,10h30 - 21h30,3.5,70.000 - 100.000 đ/người
Cơm niêu Singapore,"Kiot 18, Tòa nhà Rainbow, KĐT Tây Nam Linh Đàm, Q. Hoàng Mai",Kombo - Cơm Niêu Singapore - Linh Đàm,10h30 - 21h30,3.2,70.000 - 100.000 đ/người
Buffet Nướng Lẩu hải sản,"Tầng 4, TTTM Mac Plaza,số 10 Trần Phú,Q.Hà Đông",Cheep Eats - Buffet nướng - lẩu - hải sản - Trần Phú,11h00 - 14h30 và 17h00 - 22h00,4,200.000 - 280.000 đ/người
"Gọi món, Buffet nướng lẩu Hàn Quốc","Số 460 - 462 Nguyễn Văn Cừ, P. Gia Thụy, Q. Long Biên",King BBQ - Nguyễn Văn Cừ,10h00 - 14h00 & 17h00 - 21h00,4,250.000 - 350.000 đ/người
"Buffet, Gọi món Nhật Bản","Số 76 Bùi Thị Xuân, P. Bùi Thị Xuân, Q. Hai Bà Trưng ",Tonchan Ramen - Bùi Thị Xuân,10h30 – 14h00 và  17h00 – 22h00,3.6,150.000 - 200.000 đ/người
Buffet nướng lẩu Hải sản ,"BT 03 - 96B, Nguyễn Huy Tưởng, P. Thanh Xuân Trung, Q. Thanh Xuân",OHCHA - Nguyễn Huy Tưởng,11h00  - 14h00 và 17h00 -  22h00,3.8,200.000 - 300.000 vnđ/người
"Buffet, Gọi món Nhật Bản","Số 120A Phan Kế Bính kéo dài, P. Cống Vị, Q. Ba Đình ",Tonchan Ramen – Phan Kế Bính,10h30 – 14h00 và 17h00 – 22h00,3.6,150.000 - 200.000 đ/người
Buffet nướng lẩu,"Số 188 đường Thượng Đình, P. Thượng Đình, Q. Thanh Xuân ",Lẩu Nướng Không Khói Sài Gòn – 188 Thượng Đình ,11h00 - 14h00 và 16h00 - 23h00,3.5,150.000 - 250.000 đ/người
Buffet nướng lẩu,"Số 258, Đường Thượng Đình, P. Hạ Đình, Q.Thanh Xuân",Lẩu Nướng Không Khói Sài Gòn – 258 Thượng Đình ,11h00 - 14h00 và 16h00 - 23h00,3.5,150.000 - 250.000 đ/người
Chuyên món Gà,"Số 31I Láng Hạ, P. Thành Công, Q. Ba Đình ",Cơm gà Hải Nam – Kampong Chicken – Láng Hạ,10h00 - 14h30 và 17h00 - 21h30,3.5,150.000 - 250.000 đ/người
Gọi món Việt (Chuyên lòng),"Số 18 Phố Trần Thái Tông, P. Dịch Vọng Hậu, Q. Cầu Giấy ",Lòng “Chát” Quán - Trần Thái Tông,10h00 - 14h00 và 18h00 - 23h00,3.5,150.000 – 300.000 đ/người
Chuyên Cá Lăng,"Số 95-97 Trúc Bạch, P. Trúc Bạch, Q. Ba Đình",Quán Cá Phiến Hoan Việt Trì - Trúc Bạch  ,10h00 – 14h00 & 17h00 – 22h00,3.8,200.000 – 250.000 đ/người
Chuyên hải sản tươi sống,"Phong Lan 01-01, KDT Vinhomes Riverside The Harmony, Q. Long Biên ",Hải Sản Biển Đông - Vinhomes Riverside The Harmony Long Biên,10h30 - 21h30,4,250.000 - 400.000 vnđ/người
Gọi món Ý,"Tầng L3, Vincom Center Metropolis, 29 Liễu Giai, Q.Ba Đình",Capricciosa - Vincom Metropolis Liễu Giai,10h30 - 21h00,3.7,200.000 - 250.000 vnđ/người
Gọi món Nhật Bản,"Nhà A7-52 Nguyễn Chí Thanh, P. Láng Thượng, Q. Đống Đa",Taiyou Maguro - Cá Ngừ Đại Dương - Nguyễn Chí Thanh,10h00 – 22h00,4,400.000 đ/người
"Buffet, Gọi món Thái Lan, Buffet Lẩu","Số 122 - K1, Giảng Võ, Q. Ba Đình ",Bếp Thái Koh Yam - Giảng Võ   ,11h -13h30 & 17h30 - 20h30,3.8,200.000 - 260.000 đ/người
Gọi món Âu (Chuyên Steak Pháp),"Số 84 Trung Hòa, P. Trung Hòa, Q. Cầu Giấy ",Le Monde Steak - Trung Hòa,11h00-14h00 & 17h00-21h30,3.7,150.000 - 250.000 vnđ/người
Gọi món Thái Lan,"Tầng 1, TTTM Indochina Plaza Hanoi, 241 Xuân Thủy, Q. Cầu Giấy",ThaiExpress - Indochina Plaza Hanoi ,10h00 - 14h00 & 18h00 - 21h00,3.9,250.000 - 350.000 đ/người
Gọi món Trung Hoa,"Số 23B Hai Bà Trưng, P. Tràng Tiền, Q. Hoàn Kiếm",Mỹ Tường Viên - Hai Bà Trưng,11h00 - 13h30 & 18h00 - 21h00,4,200.000 - 300.000 đ/người
Buffet lẩu,"Số 65 đường Nguyễn Khang, P. Trung Hòa, Q. Cầu Giấy",Lẩu Pháp (Cô Hai Lẩu Mắm Cần Thơ) - Nguyễn Khang,11h00 - 13h30 & 17h30 - 21h30,3.5,100.000  – 150.000 đ/người
Gọi món Thái Lan,"Tầng 3, TTTM Aeon Mall Long Biên, Số 27, Đ. Cổ Linh, Q. Long Biên",ThaiExpress - Aeon Mall Long Biên,10h30 – 21h30,3.9,250.000 - 350.000 vnđ/người
Gọi món Việt,"Số 18 Tôn Thất Thiệp, P. Điện Biên, Q. Ba Đình",Old Hanoi Restaurant - Tôn Thất Thiệp,11h00 – 14h00 & 17h00 – 22h30,3.6,200.000  – 300.000 đ/người
Gọi món Nhật Bản,"Số 85 Triệu Việt Vương, P. Bùi Thị Xuân, Q. Hai Bà Trưng",Kiraku - Triệu Việt Vương,11h00 - 14h00 & 18h00 - 22h30,3.7,150.000 - 300.000 đ/người
Gọi món Thái Lan,"B2-R2-10, Royal City, 72A Nguyễn Trãi, P. Thượng Đình, Q.Thanh Xuân",ThaiExpress - Royal City,T2-T6:10h30 – 21h30,3.9,250.000 - 350.000 đ/người
Gọi món Nhật Bản,"Shophouse SH 30 Nguyễn Chánh, P. Trung Hoà, Q. Cầu Giấy",Hatoyama – Nguyễn Chánh,10h00 - 14h00 & 17h00 - 23h00,4,600.000 - 800.000 vnđ/người
Chuyên món gà Hàn Quốc,"AEON Mall Long Biên, Tầng 3, Số 27 Cổ Linh, P. Long Biên, Q. Long Biên ",Yoogane Chicken Galbi - Aeon Mall Long Biên,T2-T6: 10h00 – 22h00,4,150.000 - 200.000 vnđ/người
Buffet Hải Sản,"Tầng 3, Tòa nhà Golden Field, Số 24 Nguyễn Cơ Thạch, Q. Nam Từ Liêm",Adobi Buffet - Nguyễn Cơ Thạch,11h00 -13h00 & 18h00 - 20h30,3.8,330.000 - 430.000 đ/người
Buffet Dimsum & Lẩu,"Số 35 Trần Kim Xuyến, P. Yên Hòa, Q. Cầu Giấy",Dimsum & Lẩu Trung Hoa - FengHuang – Trần Kim Xuyến,11h00 - 13h00 & 18h00 - 20h00,3.5,209.000 - 269.000 đ/người
Gọi món Việt (Chuyên hải sản),"Số 68A Nguyễn Văn Tuyết, P.Ngã Tư Sở, Q.Đống Đa ",Hải Sản Nhà Tôi - Nguyễn Văn Tuyết,10h00 – 22h00,3.5,150.000 - 300.000 đ/người
Chuyên món Trâu,"Lô CC01 – KĐT An Hưng, P. Dương Nội, Q. Hà Đông",Trâu Ngon Quán -  Hà Đông,10h30 - 14h00 và 17h30 - 21h30,4,200.000  – 250.000đ/người
Gọi món Việt,"Số 63, Đường Cổ Linh, P.Thạch Bàn, Q.Long Biên",63 Cổ Linh – Đường Cổ Linh,10h00 – 22h00,3.8,150.000 - 200.000 đ/người
Buffet nướng Hàn Quốc,"Số 37 Đỗ Quang, P. Trung Hòa, Q. Cầu Giấy",Box BBQ - Đỗ Quang,"11h00 – 13h00, 17h00 – 21h00",4,200.000 - 250.000 đ/người
Buffet nướng lẩu Hàn Quốc,"Số 293 Tô Hiệu, P. Nghĩa Tân, Q. Cầu Giấy",KIMHO BBQ - Buffet Nướng & Lẩu - Tô Hiệu,11h00 - 21h00,3.6,150.000 - 270.000 đ/người
Gọi món Thái ,"Số 9 Phan Chu Trinh, Q. Hoàn Kiếm",Gusto Thai – Phan Chu Trinh,10h00 - 22h00 ,3.8,250.000 – 300.000đ/người
Gọi món Âu (Hải sản & Steak),"1A Tăng Bạt Hổ, P. Phạm Đình Hổ, Q. Hai Bà Trưng",RICO Seafood & Grill - Tăng Bạt Hổ,11h00 – 13h00 và 18h00 – 21h30,4,700.000 – 1.200.000 đ/người
Buffet Nướng Lẩu Hàn Quốc,"D7-15-17-19, Tầng hầm B1, TTTM Times City, Số 458 Minh Khai, Q. Hai Bà Trưng",Gri & Gri - Times City,10h00 - 21h30,4,230.000 - 300.000 đ/người
Gọi món Việt,"Tầng 5, TTTM Indochina Plaza Hanoi, 241 Xuân Thủy, P.Dịch Vọng Hậu, Q.Cầu Giấy",Phố Ngon 37 - IPH Xuân Thủy,10h30 – 21h00,3.9,200.000 - 250.000 vnđ/người
Gọi món Mỹ," Lô T314, Tầng 3, TTTM Aeon Mall Long Biên, 27 Cổ Linh, Q. Long Biên",Cowboy Jack’s Saloon - Aeon Mall Long Biên,10h30 – 21h30,3.8,200.000 - 250.000 vnđ/người
Gọi món Việt (Chuyên Vịt),"Số 10 Trần Quý Kiên, P. Dịch Vọng, Q. Cầu Giấy",Hoàng Ký - Chuỗi Vịt Quay Lu Đất Chính Hiệu - Trần Quý Kiên,10h30 – 14h00 & 17h00 – 22h00,3.5,100.000 – 150.000 đ/người
Gọi món Mỹ,"Tòa nhà 17T4 Hoàng Đạo Thúy, P. Nhân Chính, Q. Thanh Xuân",Cowboy Jack’s Saloon – Hoàng Đạo Thúy,10h30 – 21h30,3.8,200.000 - 250.000 vnđ/người
Bar - Club,"Số 59, Phố Nam Ngư, P. Cửa Nam, Q. Hoàn Kiếm",Jigger Cocktail & Wine Bar – 59 Nam Ngư,18h30 – 24h00,3.8,250.000 - 300.000 vnđ/người
Gọi món Thái Lan,"Tầng 5, TTTM Vincom, 54A Nguyễn Chí Thanh, Q. Đống Đa",ThaiExpress - Vincom Nguyễn Chí Thanh,10h30 – 21h30,3.9,250.000 - 350.000 vnđ/người
Gọi món Việt,"Số 5 Nguyên Hồng, P. Thành Công, Q. Ba Đình, Hà Nội",Ngói Đỏ Garden - Nguyên Hồng,10h00 - 21h00,3.7,200.000 - 250.000 đ/người
Chuyên lẩu nấm,"Số 182 Triệu Việt Vương, P. Bùi Thị Xuân, Q. Hai Bà Trưng",Lẩu Nấm Ashima - Triệu Việt Vương ,11h00 - 14h00 & 17h30 - 21h00,3.9,350.000 - 400.000 đ/người
"Buffet Nướng, Lẩu & Dimsum","Số 15 Nguyễn Văn Lộc, P. Mộ Lao, Q. Hà Đông",Deli 4B BBQ & Hotpot - Nguyễn Văn Lộc,10h45-13h30 & 17h45-21h00,3.8,150.000 - 180.000 đ/người
Gọi món Việt,"Số 69, Đường Nguyễn Khuyến, KĐT Văn Quán, P. Phúc La, Q.Hà Đông",Tiêu Dao Quán - Nguyễn Khuyến ,10h00 - 22h00,3.8,150.000 – 200.000 đ/người
Gọi món Việt (Chuyên hải sản),"Số 22, Đường Đỗ Đức Dục, P. Mễ Trì, Q. Nam Từ Liêm",Hương Việt - Đỗ Đức Dục  ,11h00 - 22h00,4,250.000 – 300.000 đ/người
Buffet lẩu băng chuyền,"Tòa nhà Watermark, 395 Lạc Long Quân, P. Nghĩa Đô, Q. Cầu Giấy",Lẩu Băng Chuyền Kichi-Kichi - Lạc Long Quân,11h00 - 14h00 & 17h00 - 21h30,3.9,230.000 - 280.000 đ/người
Gọi món Việt,"Số 732 Trương Định, P. Giáp Bát, Q. Hoàng Mai",Tre Vàng - 732 Trương Định,10h30 - 14h00 & 17h00 - 22h00 ,3.9,200.000 – 250.000 đ/người
Gọi món Á – Âu,"Số 33 Đông Các, P. Ô Chợ Dừa, Q. Đống Đa",Zamba Extra BBQ & Beer - Đông Các,10h30 – 21h00,3.8,220.000 - 300.000 đ/người
"Buffet, Gọi món Chay","Số 4A Ngõ 67 Lý Thường Kiệt, P. Trần Hưng Đạo, Q. Hoàn Kiếm",Chay Vị Lai - Lý Thường Kiệt,10h00 - 14h & 18h00 - 21h30,4,200.000 - 300.000 đ/người
Gọi món Việt (Chuyên gà),"Số 1 – C7, KĐT Geleximco, Lê Trọng Tấn, Q. Hà Đông",Gà tươi Mạnh Hoạch - Geleximco Lê Trọng Tấn,10h00 - 22h00,3.3,100.000 – 200.000 đ/người
Gọi món nướng Hàn Quốc,"Tầng 1 Nhà CC2, Đường Mễ Trì, P. Mỹ Đình 1, Q. Nam Từ Liêm",Meat Plus - Mỹ Đình,11h00 -14h30 & 17h00 - 22h00,3.8,250.000 - 300.000 vnđ/người
Gọi món Âu,"Số 10 Lê Ngọc Hân, P. Phạm Đình Hổ, Q. Hai Bà Trưng",The Valley House - Lê Ngọc Hân,10h00 - 14h30 & 17h30 - 22h00,3.8,200.000 - 350.000 vnđ/người
