category,location,name,open_time,point,price
Gọi món Tây Bắc,"Số 59 Nguyễn Lương Bằng, P. Nam Đồng, Q. Đống Đa",Bếp Mị - Nguyễn Lương Bằng,17h00 - 2h00 sáng hôm sau,3.8,150.000 - 250.000 đ/người
"Buffet lẩu, gọi món Nhật Bản","Tầng 2, TTTM Aeon Mall Hà Đông , P. Dương Nội, Q. Hà Đông",Sushi Kei - Aeon Mall Hà Đông,11h00 – 14h00 & 17h30 - 21h00,3.9,250.000 - 350.000 đ/người
Gọi món Nhật,"Đầu ngõ 4 Hàm Nghi (đối diện HD Mon), Phường Mỹ Đình 2, Quận Nam Từ Liêm",Alo Sushi - Hàm Nghi,10h00 – 22h00,4,100.000 - 300.000 đ/người
Gọi món Á ,"Số 48 Mã Mây, P.  Hàng Buồn, Q. Hoàn Kiếm",Bò Nướng Era - Mã Mây,10h30 – 22h00 ,4,100.000 - 200.000 đ/người
Gọi món Việt,"Đầu ngõ 4 Hàm Nghi (đối diện HD Mon), Phường Mỹ Đình 2, Quận Nam Từ Liêm",An Nam Cháo - Hàm Nghi,07h00 – 22h00,4,66.000 - 220.000 đ/người
Buffet & Gọi món Á - Âu,"Số 19 Đường Phạm Đình Hổ, P. Phạm Đình Hổ,  Q. Hai Bà Trưng",Khách sạn Sunway Hotel Hanoi – The Restaurant,06h00 – 22h00,4.2,150.000 - 350.000 đ/người
Buffet Nướng Lẩu,"Số 87 Lĩnh Nam, Tòa HH1 Shop House 8, Q.Hoàng Mai",King Fe - Buffet Nướng Lẩu - Lĩnh Nam,11h00-14h30 &17h30-22h30,3.5,169.000 - 298.000 đ/người
Gọi món Trung Hoa,"101K1 Giảng Võ, P. Cát Linh, Q. Đống Đa",Mỹ Tường Viên - Giảng Võ,10h30 – 22h00,4,200.000 - 350.000 đ/người
Gọi món Âu,"Tòa B6 The Golden Armor , Phố Nam Cao, P.Giảng Võ, Q.Ba Đình ",VanHoangGroup - L'amour  Steak - Nam Cao   , 06h00- 02h00 sáng hôm sau.,4,100.000 - 500.000 đ/người
Gọi món Việt (Chuyên Gà),"Số 269 Kim Mã, P. Giảng Võ, Q. Ba Đình",Vua Gà Tươi - Kim Mã,08h00 – 22h00,3.8,100.000 - 200.000 đ/người
Gọi món Âu & BBQ,"Số 4 Tông Đản, P. Lý Thái Tổ, Q. Hoàn kiếm",Wicked BBQ n’ Bar - Tông Đản,10h00 – 21h00,3.7,250.000 - 300.000 đ/người
Gọi món Lào,"Tòa Nhà M3-M4, Số 91 Nguyễn Chí Thanh, Q. Đống Đa",Khao Lao - Nguyễn Chí Thanh,11h00 - 14h00 & 18h00 - 21h00,3,200.000 - 300.000 đ/người
Gọi món Nhật,"Số 173 Yên Lãng, Q. Đống Đa",Let’s Sushi - Yên Lãng,10h00 - 13h45 &17h00 - 21h30,4,200.000 - 300.000 đ/người
"Gọi món, Buffet Nướng Lẩu Nhật Bản","Số 137 đường Mai Hắc Đế, P. Lê Đại Hành, Q. Hai Bà Trưng",Sakashi - Mai Hắc Đế,11h00 – 14h00 & 17h00 – 22h00,4,250.000 - 500.000 đ/người
Gọi món Thái,"Số 57 Chùa Láng, P. Láng Thượng, Q. Đống Đa",Mr. Tuktuk - Chùa Láng ,10h00 - 14h00 & 17h00 - 22h00,3.8,140.000 - 150.000 đ/người
Gọi món Việt,"Lô V6-A05 The Terra An Hưng, đường Nguyễn Thanh Bình, P. La Khê, Q. Hà Đông",Trạng Nguyên - Hà Đông,10h00 -14h00 & 16h30 - 22h00,4.2,150.000 - 250.000 đ/người
"Buffet Nướng Lẩu, Gọi món Việt","Số 65 Hàm Long, P. Hàng Bài, Q. Hoàn Kiếm",Chef Mama - Lẩu nướng thượng hạng - Hàm Long,10h00 - 14h00 & 17h00 - 22h00,3.9,250.000 - 500.000 đ/người
Đặc sản núi rừng,"Số BT10-12A KĐT An Hưng, 102 đường Tố Hữu, P. La Khê, Q. Hà Đông",Ẩm Thực Gió Việt - Hà Đông  ,10h00 - 22h00,3.8,150.000 - 350.000 đ/người
"Buffet Hải Sản, Gọi Món Viêt","Số 08TT2A, Ngõ 622 Phố Minh Khai, P. Vĩnh Tuy, Q. Hai Bà Trưng",Panxin - Minh Khai,10h30 - 14h30 & 16h30 - 22h30,3.8,250.000 - 650.000 đ/người
Gọi món Huế,"Số 12 Huỳnh Thúc Kháng, P. Thành Công, Q. Đống Đa",Long Hạnh Cơm - Bún bò Huế - Huỳnh Thúc Kháng   ,06h30 -14h00 & 17h00 - 22h00,3.5,100.000 - 150.000 đ/người
Gọi món Việt ,"Tầng 6, Số 17 Tràng Thi, P.Hàng Trống, Q. Hoàn Kiếm",Affa Restaurant - Tràng Thi,11h30 - 14h00 & 18h00 - 22h00,3.8,150.000 - 250.000 đ/người
Buffet Lẩu ,"Tầng 3, Số 40, TTTM Aeon Mall Long Biên, Số 27 Cổ Linh, P. Long Biên, Q. Long Biên",Buffet Lẩu Ếch Jiang Hu - Aeon Mall Long Biên,"T2-  T6: 11h00- 22h00 &T7,CN: 10h00 – 22h00",3.9,250.000 - 500.000 đ/người
"Buffet, Gọi món nướng Nhật Bản","F6 – B05 – 06, Tầng 6, Tòa nhà Lotte Centre, 54 Liễu Giai, P. Cống Vị, Q. Ba Đình",Shogun - Lotte Center,10h30 - 21h00,3.8,300.000 - 380.000 đ/người
"Buffet, Gọi món Thái","Biệt thự Hải Âu 01-01, Vinhomes Ocean Park, Xã Kiêu Kỵ, H. Gia Lâm",Bếp Thái Koh Yam - Vinhomes Ocean Park ,11h -13h30 & 17h30 - 20h30,4,150.000 - 300.000 đ/người
Gọi món Việt,"Số 12, Ngõ 1, Phố Dịch Vọng Hậu, P. Dịch Vọng, Q. Cầu Giấy",Kiên Hương Rừng - Dịch Vọng Hậu,10h00 - 24h00,4,150.000 - 250.000 đ/người
Bufet chay,"Tầng 3, số 109 Đào Tấn, Ngọc Khánh",Buffet chay Love Vegan - Đào Tấn  ,11h00- 14h00 & 18h00 – 20h30,3.8,100.000 - 150.000 đ/người
Gọi món Việt,"Số 2A, Ngõ 44 Đỗ Quang, P. Trung Hoà, Q. Cầu Giấy",Hồng Thái 3 -  Đặc sản Ngựa các món - Đỗ Quang,10h00 - 22h00,3.8,150.000 - 550.000 đ/người
Nướng Lẩu Trung Hoa,"Số 15A Hàng Cót, P. Hàng Mã, Q. Hoàn Kiếm,",Lẩu Tứ Xuyên - Hàng Cót,10h30-14h00 & 16h30-21h30,4,200.000 - 300.000 đ/người
Gọi món Việt,"Số 115 Trung Hòa, P. Yên Hòa, Q. Cầu Giấy",Tiệm Đà Lạt -Trung Hòa,06h00 – 14h30 & 17h00 – 22h00,4,200.000 - 300.000 đ/người
Gọi món nướng Hàn Quốc,"C4 Giảng Võ, Quận Ba Đình",Meat Plus - Giảng Võ  ,"T2-T7: 11h00 -14h30 & 17h00 - 21h30, CN: 11h00-22h00",4,250.000 - 300.000 đ/người
"Buffet, Gọi món Thái","Số 26 Vũ Phạm Hàm, P. Trung Hòa, Q. Cầu Giấy",Bếp Thái Koh Yam - Vũ Phạm Hàm,11h00 – 21h00,4.1,150.000 - 300.000 đ/người
Buffet Nướng Lẩu Hàn Quốc,"Số 109 đường Nguyễn Hoàng, P. Mỹ Đình 2, Q. Nam Từ Liêm",Shin BBQ - Nguyễn Hoàng,11h00-14h00 & 17h00-22h30,4.4,250.000 - 300.000 đ/người
Gọi món Lào,"2B Phạm Ngọc Thạch, P. Trung Tự, Q. Đống Đa",Khao Lao – Vincom Phạm Ngọc Thạch ,09h00 - 22h15,3.9,200.000 - 250.000 vnđ/người
Gọi món Việt,"18 Phan Bội Châu, Q. Hoàn Kiếm",Quán Ăn Ngon - Phan Bội Châu,06h30 - 21h45,4.1,180.000 - 250.000 vnđ/người
"Buffet, gọi món nướng lẩu Nhật Bản","Số 122 Trung Hòa, P. Yên Hòa, Q. Cầu Giấy",Sumo Yakiniku – Trung Hòa,11h00 - 21h00,3.9,250.000 - 400.000 vnđ/người
Gọi món Lào,"Tầng 1, Lô A004, Tháp The Manor, đường Mễ Trì, Q.Nam Từ Liêm",Khao Lao – The Manor,10h00 – 22h00,3.9,200.000 - 250.000 vnđ/người
Gọi món Nhật Bản,"27 Cổ Linh, Tầng 3, TTTM Aeon Mall Long Biên, Q.Long Biên",Sushi Kei - Aeon Mall Long Biên,10h00 - 14h30 và 17h30 - 22h30,3.9,200.000 - 300.000 vnđ/người
Gọi món Âu (phong cách Pháp),"Số 21 Lê Văn Hưu, Q. Hai Bà Trưng",GRILL66 Steakhouse - Lê Văn Hưu,10h00 – 22h00,3.8,150.000 - 250.000 đ/người
Gọi món Miền Nam,"Số 96 Chùa Hà, P. Quan Hoa, Q. Cầu Giấy",Hẻm Quán - Chùa Hà,10h30 - 22h00	,3.9,150.000 - 300.000 vnđ/người
"Buffet, gọi món nướng lẩu Nhật Bản","67 Tô Hiến Thành, Q. Hai Bà Trưng",Sumo Yakiniku - Tô Hiến Thành,11h00 - 14h00 & 18h00 - 22h00,3.9,250.000 - 400.000 vnđ/người
Gọi món Lẩu 1 người,"Tầng 2 & 3, Số 63A Trần Nhân Tông, Q. Hai Bà Trưng",Trư Ký Hotpot - Trần Nhân Tông,10h30 – 22h30,3.8,100.000 – 200.000 đ/người
Gọi món Miền Nam,"Số 151 - 161 Hoàng Cầu, P. Ô Chợ Dừa, Q. Đống Đa",Hẻm Quán – Hoàng Cầu,10h30 – 22h30,3.9,150.000 - 300.000 vnđ/người
"Buffet lẩu, gọi món Nhật Bản","Vincom Center, 54A Nguyễn Chí Thanh, Tầng 5,  P. Láng Thượng, Q. Đống Đa",Daruma – Vincom Nguyễn Chí Thanh,10h30 – 21h30,3.9,250.000 - 400.000 đ/người
Buffet lẩu Châu Á,"Vincom Nguyễn Chí Thanh, Tầng 5, 54A Nguyễn Chí Thanh, Q. Đống Đa",Hotpot Story – Vincom Nguyễn Chí Thanh ,11h00 - 13h00 & 18h00 - 21h00,3.7,250.000 - 350.000 vnđ/người
Buffet Lẩu Châu Á,"Số 126 Nguyễn Khánh Toàn, Q. Cầu Giấy",Hotpot Story - Nguyễn Khánh Toàn,11h00 - 13h00 & 18h00 - 21h00,3.7,250.000 - 350.000 vnđ/người
Buffet Nướng & Lẩu,"số 96 - 96B Nguyễn Huy Tưởng, P. Thanh Xuân Trung, Q. Thanh Xuân",Buffet Sapasa - Nguyễn Huy Tưởng ,11h00 - 13h30 & 18h00 - 21h00,3.5,200.000 - 300.000 đ/người
"Buffet lẩu, gọi món Nhật Bản","Indochina Plaza Hanoi, Tầng 1, 241 Xuân Thuỷ, Q. Cầu Giấy",Daruma - IPH Xuân Thủy,11h00 – 21h30,3.9,150.000 - 300.000 đ/người
"Buffet, Gọi món nướng Nhật Bản","TTTM Vincom Phạm Ngọc Thạch, Tầng 5, Số 2 Phạm Ngọc Thạch, Q. Đống Đa",Shogun – Phạm Ngọc Thạch,11h00 - 13h30 & 17h30 - 21h00,3.8,300.000 - 380.000 đ/người
Gọi món Âu (phong cách Pháp),"Số 54 Trung Hòa, P. Trung Hòa, Q. Cầu Giấy",Botanica - Trung Hòa ,10h00 – 22h00,3.6,150.000 - 250.000 đ/người
"Buffet, gọi món nướng lẩu Nhật Bản","TTTM Savico Megamall  07 – 09 Nguyễn Văn Linh, Q. Long Biên",Sumo Yakiniku - Savico Megamall,11h00 - 14h00 & 18h00 - 22h00,3.9,250.000 - 400.000 vnđ/người
Gọi món Miền Nam,"Tầng 2 + 3, số 35 Dịch Vọng Hậu, Q. Cầu Giấy",Phương Nam – Dịch Vọng Hậu,10h30 - 14h00 và 17h30 - 21h30,3.5,150.000 - 180.000 đ/người
Buffet Lẩu Châu Á,"Tầng 3, TTTM Aeon Mall Long Biên, số 27 đường Cổ Linh, P. Long Biên, Q. Long Biên",Hotpot Story – Aeon Mall Long Biên   ,11h00 - 13h00	và 18h00 - 21h00,3.7,250.000 - 350.000 đ/người
Gọi món Việt (Chuyên rắn),"Số 10 Ngõ 71 Việt Hưng, Q. Long Biên",Vườn Ẩm Thực Rắn Ráo - Việt Hưng ,09h00 – 22h00 ,3.5,300.000 – 350.000 đ/người
Buffet nướng lẩu Hàn Quốc,"Số 106 – B24 , Ngõ 41, Phố Đông Tác, Q. Đống Đa",Wang Wang - Quán thịt nướng Hàn Quốc – Đông Tác,11h00 – 13h30 & 17h30 – 21h30,3.2,115.000 - 190.000đ/người
Gọi món Âu (Chuyên Steak),"24 Trần Hưng Đạo, Q. Hoàn Kiếm",Steakout - Trần Hưng Đạo,10h00 – 22h00,3.7,200.000 – 400.000đ/người
Buffet nướng lẩu Nhật Bản,"Số 36 Trúc Khê, Q. Đống Đa",Panda BBQ - Trúc Khê,11h00- 13h30	và 18h00 -21h30,3.8,100.000 - 200.000 vnđ/người
Chuyên món Việt,"KĐT Mỹ Đình Sông Đà, Số 4, TT4, Phố Trần Văn Lại, Q. Nam Từ Liêm",Làng Niêu & Nướng - Trần Văn Lai,10h00 - 14h00 và 17h00 - 22h00,3.8,200.000 – 300.000 đ/người
Buffet nướng lẩu Hàn Quốc,"Số 63 Kim Đồng, Q. Hoàng Mai",Nhà hàng A1 Restaurant - Kim Đồng,11h00 – 14h00 và 18h00 – 22h00,3.7,180.000 – 200.000 đ/người
Gọi món Việt,"Số 4 Nguyễn Quyền, Q. Hai Bà Trưng",Hoa Lộc Quán - Nguyễn Quyền,11h00 – 21h30,3.5,170.000 – 250.000 đ/người
Món Âu - Á,"59 Văn Miếu, Q. Đống Đa",Nhà hàng Koto,"10h:30 - 13h:30, 17h:30 - 20h:30",4,150.000 vnđ/người
Chuyên Pizza,"Số 36 Nguyên Hồng, Q. Đống Đa",Full House Pizza - Nguyên Hồng,09h00 - 22h00,3.5,100.000 - 200.000 đ/người
Món Hàn Quốc,"191 Xã Đàn, Q. Đống Đa",Little Korea - Xã Đàn,"10h:30 - 13h:30, 17h:30 - 20h:30",3,100.000 vnđ/người
Gọi món Trung Quốc,"Số 24A, Tôn Thất Thiệp, Q. Ba Đình",Quận 5 Dining House - Tôn Thất Thiệp,10h30 - 22h30,3.8,350.000 - 450.000 đ/người
Ẩm thực Nga,"4 Nguyễn Gia Thiều, Q. Hoàn Kiếm",Giấc Mơ Nhỏ Moscow - Nguyễn Gia Thiều ,09h30 - 14h00 và 16h30 - 21h30,3.5,200.000 – 300.000 vnđ/người
"Món Á Âu, Beer Club","Số 319, Tây Sơn, Quận Đống Đa, Hà Nội",319 Beer Club - Tây Sơn,08h00 – 12h00,4.2,200.000 - 500.000 vnđ/người
Gọi Món Việt (Chuyên Hải Sản),"Số 652 Đường Láng,Q. Đống Đa",Tadifar – Đường Láng,10h00 - 13h30 & 16h30 - 22h30,3.8,150.000 - 250.000 đ/người
Chuyên món Việt,"33 Huỳnh Thúc Kháng, Q. Đống Đa",Nhà hàng Ao Ta - Huỳnh Thúc Kháng,11h00 - 13h30 & 17h30 - 20h30,4,250.000 - 300.000 đ/người
Gọi món Miền Nam,"360 Xã Đàn, Q. Đống Đa",Hẻm Quán – Xã Đàn,10h30 - 14h00 & 17h00 - 22h00,3.9,150.000 - 300.000 vnđ/người
"Buffet lẩu, gọi món Nhật Bản","Mipec Tower, 229 Tây Sơn, Tầng 1 , Q. Đống Đa",Daruma – Mipec Tower,11h00 – 14h00 & 18h00 – 21h30,3.9,250.000 - 400.000 đ/người
Chuyên hải sản tươi sống,"Tầng B2-R6-30, TTTM Royal City, Q. Thanh Xuân",Hải Sản Biển Đông - Royal City ,10h00 - 21h00,4,250.000 - 400.000 vnđ/người
Gọi món Việt,"Số 5 Ngõ Núi Trúc (Ngõ 57 Cũ), Phố Núi Trúc, Q. Ba Đình",Vietnam 938 - Ngõ Núi Trúc,11h00 - 13h30 & 17h00 -  22h00,3.8,220.000 - 300.000 đ/người
Gọi món Việt (Chuyên bò tơ),"Tầng 1, Tòa nhà CT2A, KĐT Nam Cường, Ngõ 234 Hoàng Quốc Việt, Q. Bắc Từ Liêm",Bò Tơ Quán Mộc - Hoàng Quốc Việt,10h30 - 13h30 & 17h30 - 21h30,3.9,180.000 – 220.000 đ/người
Chuyên hải sản tươi sống,"Số 60 Vũ Trọng Khánh, P. Mộ Lao, Q. Hà Đông",Thế Giới Hải Sản - Vũ Trọng Khánh,10h30 – 22h00,4.1,400.000 - 600.000 vnđ/người
Buffet Lẩu,"Biệt thự 2A, Ngõ 521 Cổ Nhuế 2, Quận Bắc Từ Liêm",Buffet Cô Lô Nhuê - Lẩu Hải Sản 2 Ngăn - Cổ Nhuế 2,10h30-13h30 & 18h00-21h30,3.5,120.000 – 220.000 đ/người
Chuyên món Trâu,"Số 145 Bùi Thị Xuân, P. Bùi Thị Xuân, Q. Hai Bà Trưng",Trâu Ngon Quán - Bùi Thị Xuân,10h30 – 14h00 & 17h30 – 22h00,4,200.000 – 250.000 đ/người
Ẩm thực Việt,"Khu 31Ha, Ngõ 237 Ngô Xuân Quảng, Xã Trâu Quỳ, Huyện Gia Lâm",Kim Thủy Quán - Ngô Xuân Quảng    ,09h00-22h00,3.6,200.000 - 250.000 đ/người
Gọi món Âu - Á,"Tầng 9, Số 27 Hàng Bè, P. Hàng Bạc, Q. Hoàn Kiếm",Cloud Nine - Hàng Bè ,11h30 – 21h45,4.5,250.000 - 500.000 đ/người
Gọi món Việt,"BT3, Ngõ 114 Trung Kính, Yên Hòa, Q. Cầu Giấy",Ngan Anh Khoai ,06h00 - 21h00,3.6,99.000 - 169.000 đ/người
Gọi món  (Chuyên hải sản),"Số 33 Đường Nguyễn Văn Huyên, P. Quan Hoa, Q. Cầu Giấy, ",Ốc An - Hải Sản 3 Miền - Nguyễn Văn Huyên,10h00 – 21h30,3.8,150.000 - 250.000 đ/người
Gọi món Việt ,"Km5+200, đường Lê Trọng Tấn, An Khánh, H. Hoài Đức",Hobby - Thiên đường Bảo Sơn,10h00 – 22h00,3.8,220.000 - 350.000 đ/người
"Gọi món Á, Âu","Tầng 4, khách sạn Grand Vista Hanoi, 146 Giảng Võ, P. Giảng Võ, Q. Ba Đình",Déli - Grand Vista Hanoi ,11h30 - 14h00 ,4,200.000 - 800.000 đ/người
"Gọi món Việt (chuyên chim, cá tự nhiên)"," Số 181 Yên Lãng, P.Thịnh Quang, Q. Đống Đa",Chim trời - Cá sông Trình Lưu - Yên Lãng ,10h00-15h00 & 17h00 – 22h00,3.6,150.000 - 300.000 đ/người
Buffet lẩu Hongkong,"Tầng 1 - TTTM Lotte Mart - Số 229 Tây Sơn, Q. Đống Đa",IPOT - Lẩu Hồng Kông - Lotte Mart Tây Sơn,10h30 – 14h00 & 18h00 – 22h00,3.7,200.000 - 300.000 đ/người
Gọi món Việt (chuyên món Huế),"Số 21 Phan Bội Châu, P. Cửa Nam, Q. Hoàn Kiếm",Vỹ Dạ - Phan Bội Châu,09h00 – 15h00 & 17h00 – 22h00,3.6,100.000 - 200.000 đ/người
"Buffet hải sản, lẩu & nướng","Tầng 2 – Tòa nhà D’office, Thành Thái, Tổ 28, P. Dịch Vọng, Q. Cầu Giấy, Hà Nội",London Buffet Hải Sản Lẩu Nướng - Thành Thái,11h00 - 13h00 & 18h00 - 21h00,3.9,300.000 - 500.000 đ/người
Gọi món Nhật Bản,"Tòa nhà N04 Hoàng Đạo Thúy, Q. Cầu Giấy",Tokyo Deli - Hoàng Đạo Thúy,T2-T6: 11h00 – 21h30 ,3.8,160.000 - 250.000 đ/người
Hải sản tươi sống,"Số 5 Trần Kim Xuyến, P. Yên Hòa, Q. Cầu Giấy",Phố Hải Sản - Trần Kim Xuyến  ,10h00 – 22h30,3.9,200.000 - 500.000 đ/người
Gọi món Âu ,"Số 50 Ngõ 36 Giang Văn Minh, Q. Ba Đình",Galleon Pub & Dining - Giang Văn Minh,07h00 -  02h00 (sáng hôm sau),3.6,150.000 - 250.000 đ/người
Gọi món Việt,"23 Lê Thánh Tông, P. Phan Chu Trinh, Q. Hoàn Kiếm",Trường Thịnh - Lê Thánh Tông,10h00 – 15h00 & 16h30 – 22h00,3.9,200.000 - 300.000 đ/người
Buffet Nướng lẩu Hải sản,"Ngách 1 ngõ 233 Tô Hiệu, Q. Cầu Giấy",OHCHA - Tô Hiệu   ,11h00 – 14h00 & 17h30 – 22h00,3.8,200.000 - 300.000 đ/người
Buffet nướng lẩu Hàn Quốc,"T305, Tầng 3, TTTM Aeon Mall, số 27 đường Cổ Linh, Q. Long Biên",King BBQ Buffet - Aeon Mall Long Biên  ,10h00 - 22h00,4,250.000 - 350.000 đ/người
Chuyên Hải sản tươi sống,"16 Phạm Tuấn Tài, P. Dịch Vọng Hậu, Q. Cầu Giấy",Hải Sản Trung Dũng – Phạm Tuấn Tài,11h00 - 21h30,4,300.000 - 450.000 đ/người
Chuyên hải sản tươi sống,"794 Đường Láng, Q. Đống Đa",Hải Sản Biển Đông - 794 Đường Láng,10h30 - 21h00	,3.8,250.000 - 400.000 vnđ/người
Gọi món Việt,"C101 Ngõ Thái Hà, P. Láng Hạ, Q. Đống Đa", +84.Food - Ngõ Thái Hà  ,06h30 – 21h30,3.6,80.000 - 150.000 đ/người
"Buffet Lẩu, Gọi món Việt - Thái","Số 204 Nguyễn Trãi, Q. Thanh Xuân",Food House - Nguyễn Trãi,11h00 -13h00 và 17h30 - 20h30,4,150.000 - 250.000 đ/người
Chuyên Burger & Pizza,"289 Kim Mã, P. Giảng Võ, Q. Ba Đình",Maxi Burger - Kim Mã ,09h00 - 22h00,3.5,100.000 - 150.000 đ/người
Buffet Lẩu,"Số 106 K11A Nguyễn Hiền, P. Bách Khoa, Q. Hai Bà Trưng",Lẩu Laksa 38 - Nguyễn Hiền,10h30 - 14h00 & 17h00 - 22h00,3.8,100.000 - 170.000 đ/người
Chuyên hải sản tươi sống,"3 Trần Quốc Toản , Q. Hoàn Kiếm",Vựa Hải Sản Biển Đông - Trần Quốc Toản,09h30 – 21h30,4,250.000 - 400.000 vnđ/người
Chuyên Burger & Pizza,"Số 1 Văn Miếu, Q. Ba Đình",Maxi Burger - Văn Miếu,09h00 - 22h00,3.5,100.000 - 150.000 đ/người
Chuyên Burger & Pizza,"28 Đại Cổ Việt, Q. Hai Bà Trưng",Maxi Burger - Đại Cồ Việt,09h00 - 22h00,3.5,100.000 - 150.000 đ/người
"Gọi món Âu, Á"," TTTM Times City, 458 Minh Khai, Số 6, đường số 9, B1",Al Fresco’s - Times City,11h00 - 21h00,4.2,200.000 - 250.000 đ/người
Chuyên Burger & Pizza,"Số 168 Trung Kính, P. Yên Hoà, Q. Cầu Giấy",Maxi Burger - Trung Kính,09h00 - 22h00,3.5,100.000 - 150.000 đ/người
"Gọi món Việt (chuyên Gà, Cá)","Số 2 Ngõ 20 Láng Hạ, P. Láng Hạ, Q. Đống Đa",Đệ Nhất Quán – Láng Hạ ,10h00 - 22h00,3.8,150.000 - 200.000 đ/người
Gọi món Hàn Quốc (Chuyên Gà),"250 Hàng Bông, P. Cửa Nam, Q. Hoàn Kiếm",Don Chicken - Hàng Bông,11h00 – 22h00,3.7,150.000 – 300.000 đ/người
Ẩm thực Việt,"11V Trần Phú, P. Điện Biên, Q. Đống Đa",Lim Dim Restaurant - Trần Phú ,10h30-14h30 & 17h30-05h00 (sáng hôm sau),3.7,200.000 - 300.000 đ/người
Gọi món & Vườn Bia,"Số 168 Trường Chinh, P. Khương Thượng , Q. Đống Đa",Vườn Bia M5+ - Trường Chinh,10h00 – 22h00,3.9,250.000 - 500.000 đ/người
"Buffet Lẩu, Gọi món Việt - Thái","Số 227 Tô Hiệu, P. Dịch Vọng, Q. Cầu Giấy",Food House - Tô Hiệu ,11h00 -13h00 và 17h30 - 20h30,4,150.000 - 250.000 đ/người
"Gọi món Âu, Beefsteak"," Lô 22C, Khu biệt thự A10, Nguyễn Chánh, P. Yên Hòa, Q. Cầu Giấy",Joy Plus - Nguyễn Chánh,11h00 – 21h30,3.8,400.000 – 600.000 đ/người
Gọi món (Món ăn trên đĩa nóng),"Gian hàng T257, Tầng 2 TTTM Aeon Mall, P. Dương Nội, Q. Hà Đông",Hotto - Aeon Mall Hà Đông,"T2 – T6: 09h30 – 21h30, T7 - CN: 09h00 – 22h00",3.8,80.000 - 150.000 đ/người
Gọi món Việt (Món đường phố),"Gian hàng T167, Tầng 1 TTTM Aeon Mall, P. Dương Nội, Q. Hà Đông",VietStreet - Aeon Mall Hà Đông,"T2 – T6: 09h30 – 21h30, T7 - CN: 09h00 – 22h00",3.8,120.000 - 180.000 đ/người
Gọi món Việt,"Kiot số 1 chung cư A2 KĐT Mỹ Đình 1, Nguyễn Cơ Thạch, P. Cầu Diễn, Q. Nam Từ Liêm",Hiroshima Lẩu Nấm Thiên Nhiên - Nguyễn Cơ Thạch,10h00 - 14h00 & 16h00 - 21h30,3.7,200.000 - 250.000 đ/người
Buffet lẩu hơi & buffet lẩu nướng,"123-C5 Tô Hiệu, P. Nghĩa Tân, Q. Cầu Giấy",Won Won - Tô Hiệu   ,11h00 – 23h00 ,3.6,100.000 - 200.000 đ/người
"Gọi món, Buffet lẩu nướng","Mặt sau toà nhà Golden Palace, số 54 Lê Văn Lương, P. Nhân Chính, Q. Thanh Xuân",668 BBQ & Hotpot - Lê Văn Lương,10h30 - 14h00 & 18h00 - 22h00,3.7,200.000 - 300.000 đ/người
"Gọi món, Buffet lẩu nướng","Số 2B Trần Thánh Tông, Q.Hai Bà Trưng, Hà Nội",668 BBQ & Hotpot - Trần Thánh Tông,10h30 - 14h00 và 18h00 - 22h00,3.7,200.000 - 300.000 đ/người
Gọi món Việt,"Lô 21-TT1A Khu liền kề, Ngõ 622 Minh Khai, P. Vĩnh Tuy, Q. Hai Bà Trưng",1977 - Minh Khai ,10h30 - 22h00,3.7,100.000 - 300.000 đ/người
Gọi món Việt (chuyên cá lăng sông Đà),"Liền kề 11B-40, KĐT Mỗ Lao, Q. Hà Đông",Lăng+ - KĐT Mỗ Lao,10h30 - 14h00 & 17h30 - 21h00,3.6,150.000 - 200.000 đ/người
Gọi món Việt ,"181 – 183 Nguyễn Tuân, P. Nhân Chính, Q. Thanh Xuân",Dê Việt - Bảo Dương Viên - Nguyễn Tuân ,10h00 – 14h00 & 17h30 – 22h00,4,150.000 - 180.000 đ/người
Buffet lẩu nướng hải sản,"Tầng 4 TTTM Mê Linh Plaza Hà Đông, Tô Hiệu, Q. Hà Đông ",Buffet Lẩu Nướng Hải Sản BBQHome - Melinh Plaza ,10h30 – 14h00 &18h00 – 22h00,4,350.000 - 450.000 đ/người
"Gọi món Á, Âu","Số 17 Đường  Đoàn Trần Nghiệp, P. Lê Đại Hành, Q. Hai Bà Trưng",Hẻm 8 - Đoàn Trần Nghiệp ,08h00 – 22h30 ,3.8,150.000 - 250.000 đ/người
Buffet tự chọn ,"Số 52 Phố Miếu Đầm, P. Mễ Trì, Q. Nam Từ Liêm",Buffet Hải Sản Hương Sen - Miếu Đầm  ,11h00 – 14h00 & 18h00 – 21h30 ,4.5,320.000 - 350.000 đ/người
Gọi món Ý (Chuyên Pizza),"Tầng 2, L2-11, Vincom Center Metropolis, 29 Liễu Giai, P. Ngọc Khánh, Q. Ba Đình",Al Fresco's - Vincom Metropolis Liễu Giai,11h00 - 21h00,4.2,180.000 - 250.000 đ/người
Gọi Món Nhật Bản,"1F, A10, KĐT Nam Trung Yên, P. Yên Hoà, Q. Cầu Giấy",Narita - KĐT Nam Trung Yên ,17h00 – 22h00,4,350.000 - 500.000 đ/người
Gọi món Trung Hoa,"Lô 31, số 35 phố Lê Văn Thiêm, P. Thanh Xuân Trung, Q. Thanh Xuân",Thiên Vương Quán - Lê Văn Thiêm   ,10h30 – 14h00 & 17h30 – 21h00,4,100.000 - 200.000 đ/người
Buffet Nướng Lẩu,"Số 915 Hồng Hà, P. Chương Dương, Q. Hoàn Kiếm",Wang Wang - Hồng Hà,10h00 – 03h00 sáng hôm sau,4,100.000 - 200.000 đ/người
Buffet & Gọi Món,"128 Đường Nguyễn Khoái , P. Thanh Lương, Q. Hai Bà Trưng",Buffet Lẩu TacaTaca - Nguyễn Khoái,10h00 – 23h00 ,3.5,150.000 - 250.000 đ/người
"Gọi món, Buffet lẩu nướng","Số 128 Vũ Phạm Hàm, Q.Cầu Giấy",668 BBQ & Hotpot - Vũ Phạm Hàm,10h30 - 14h00 và 18h00 - 22h00,4.2,200.000 - 300.000 đ/người
Gọi món miền Nam,"Số 8A Hàng Tre, P. Lý Thái Tổ, Q. Hoàn Kiếm",Góc Phố Sài Gòn - Hàng Tre,11h00 – 22h00 ,4,150.000 - 300.000 đ/người
Gọi món Việt,"Tầng 3 AEON Mall Long Biên, 27 Cổ Linh",Ngon Phố - Aeon Mall,"10h:30 - 13h:30, 17h:30 - 20h:30",4,180.000 - 250.000 vnđ/người
"Gọi món, buffet lẩu","Số 21 Ngũ Xã, P. Trúc Bạch, Q. Ba Đình",Vua Hải Sản Đường Phố - Ngũ Xã,10h30 – 13h30 & 17h30 - 22h30,3.6,100.000 - 300.000 đ/người
Gọi món Âu - Á,"123 K1 Giảng Võ, Q. Ba Đình",Pepperonis - Giảng Võ,11h00 - 21h00,3.8,130.000 - 151.000 đ/người
"Gọi món Âu, Á","62 Xuân Diệu, Q. Tây Hồ",Al Fresco’s - Xuân Diệu,11h00 - 21h00,4,185.000 - 395.000 đ/người
Buffet nướng lẩu,"Số 3 Dịch Vọng Hậu, P. Dịch Vọng Hậu, Q. Cầu Giấy",Habit BBQ - Dịch Vọng Hậu,10h30 - 13h00 & 17h30 - 21h00,4,150.000 - 330.000 vnđ/người
Gọi món Âu - Á,"Số 374 Nguyễn Văn Cừ, Q. Long Biên ",Pepperonis - Nguyễn Văn Cừ,11h00 - 21h00,3.8,130.000 - 150.000 đ/người
"Gọi món Âu, Á","Vincom Long Biên, Tầng 4, Gian 402B",Al Fresco’s - Vincom Long Biên,11h00 - 21h00,4.2,200.000 - 250.000 đ/người
"Gọi món Âu, Á","114B2 Nguyễn Chí Thanh, Q. Ba Đình",Pepperonis - Nguyễn Chí Thanh,11h00 - 21h00,3.8,130.000 - 150.000 đ/người
"Gọi món Âu, Á","106 Trần Thái Tông, Q. Cầu Giấy",Al Fresco’s - Trần Thái Tông,11h00 - 21h00,4.2,200.000 - 250.000 đ/người
"Gọi món Âu, Á","Vincom Nguyễn Chí Thanh, L5-16-17 ",Al Fresco’s - Vincom Nguyễn Chí Thanh,11h00 - 21h00,4.2,150.000 - 250.000 đ/người
"Gọi món Á, Âu","23 Nguyễn Đình Chiểu, Q. Hai Bà Trưng",Sứ Bia - Nguyễn Đình Chiểu,10h00 - 22h00,4.1,270.000 - 300.000 đ/người
Gọi món Hong Kong,"13 Hai Bà Trưng, Tầng 12 Sun City",Hải Cảng - Hai Bà Trưng,9h00 - 14h00 & 16h30 - 21h30,4,300.000 - 500.000 vnđ/người
Gọi món Lào,"Số 9 Nhà Chung, Q. Hoàn Kiếm",Khao Lao – Nhà Chung,09h00 - 22h15,3.9,200.000 - 250.000 vnđ/người
Gọi món Nhật Bản,"65 Triệu Việt Vương, Q. Hai Bà Trưng",Shinbashi – Triệu Việt Vương,10h00 – 14h00 & 17h00 – 22h30,4.2,300.000 - 1.500.000 đ/người 
Buffet nướng lẩu Hàn Quốc,"TTTM Mipec Tây Sơn, Tầng 1, 229 Tây Sơn, Q. Đống Đa",King BBQ Buffet Mipec – Tây Sơn ,10h00 - 22h00,4,250.000 - 350.000 đ/người
Gọi món Việt,"Số 35 Nhà Chung, Q. Hoàn Kiếm",Bếp Xuka - Nhà Chung,11h00 - 13h00 & 18h00 - 21h00,3.7,150.000 – 250.000 đ/người
