category,location,name,open_time,point,price
Gọi món Việt - Bia thủ công,"322 Trần Khát Chân, P. Đống Mác, Q. Hai Bà Trưng",Bia Sành Điệu - Trần Khát Chân,10h00 - 22h00,3.8,150.000 - 250.000 đ/người
"Buffet Nướng, Gọi món Hàn Quốc","Tòa M2 Vicom metropolis 29 Liễu Giai, P. Ngọc Khánh, Q. Ba Đình",Jeonbok - Vincom Metropolis Liễu Giai,11h00 – 22h30,4.2,600.000 - 700.000 đ/người
"Buffet Nướng, Gọi món Hàn Quốc","Số 32 Hàm Long, P. Hàng Bài, Q. Hoàn Kiếm",Jeonbok - Hàm Long,11h00 – 22h30,4.2,600.000 - 700.000 đ/người
"Gọi Món, Buffet Lẩu Hải Sản","Số 20 Bát Đàn, P. Hàng Bồ, Q. Hoàn Kiếm",Ẩm Thực Hoàng - Bát Đàn,09h00 – 22h30,3.8,150.000 - 300.000 đ/người
Buffet lẩu Châu Á,"27 Lê Văn Lương, Tầng 5,  TTTM Center Point, Q. Thanh Xuân",Hotpot Story - Center Point ,11h00 - 13h00 & 18h00 - 21h00,3.7,250.000 - 350.000 vnđ/người
Buffet Nướng Lẩu,"Số 109 Nguyễn Hoàng, P. Mỹ Đình, Q. Nam Từ Liêm ",King Fe - Buffet Nướng Lẩu - Nguyễn Hoàng,11h00 - 14h30 & 17h30 - 22h30,3.5,169.000 - 298.000 đ/người
Gọi món Việt,"Số 17A Đường Nguyễn Văn Lộc, P. Mộ Lao, Q. Hà Đông ",Quê Hương - Nguyễn Văn Lộc  ,10h30 – 21h30,4,100.000 - 180.000 đ/người
Gọi món Âu,"16 Phố Quảng An, P. Quảng An, Q. Tây Hồ",El Vino Wine & Restaurant - Quảng An,10h00 – 21h30,4.1,250.000 - 600.000 đ/người
"Gọi món, Buffet Nhật Bản","Số 6 Kim Đồng, Q.Hoàng Mai",Tamaya Japanese Restaurant - Kim Đồng ,10h00 - 14h00 và 17h00 - 22h00,4,140.000 - 500.000 đ/người
Gọi món Nhật Bản,"Shophouse 35-36 Nguyễn Chánh - Khu đô thị mới Nam Trung Yên, P. Trung Hòa, Q. Cầu Giấy",Wabi Premium Japanese Restaurant - Nguyễn Chánh,10h00 - 14h00 & 17h00 - 22h00,4,700.000 - 1.000.000 đ/người
"Gọi món, buffet nướng lẩu Hàn Quốc"," 103, D5C Trần Thái Tông, Quận Cầu Giấy",Yukssam BBQ - Trần Thái Tông      ,11h00 – 14h00; 17h30 – 22h00,4,200.000 - 400.000 đ/người
Chuyên lẩu,"Số 50 Nguyễn Chí Thanh, Láng Thượng, Q. Đống Đa",Hobby - Nguyễn Chí Thanh,09h00 – 20h00,3.6,150.000 - 250.000 đ/người
Gọi món Việt ,"Số 30 Đường Phan Chu Trinh, Q. Hoàn Kiếm",Dê núi - Lươn đồng - Phan Chu Trinh,10h00 – 23h00,3.8,150.000 - 250.000 đ/người
Gọi món Âu,"Số 51 Lý Thường Kiệt , P. Trần Hưng Đạo , Q. Hoàn Kiếm",Teddy’s America Grill House - Lý Thường Kiệt,07h00 – 22h00,4,250.000 - 500.000 đ/người
Gọi món việt,"Số 15 Đào Duy Từ, Q. Hoàn Kiếm",Gạo Restaurant - Đào Duy Từ,10h30 - 23h00,3.5,150.000 - 300.000 đ/người
Món Việt (Lẩu cháo chim),"Số 30 Đại Cồ Việt, P. Lê Đại Hành, Q. Hai Bà Trưng",Lu Quán - Đại Cồ Việt,10h00 - 22h00,3.8,100.000 - 180.000 đ/người
Gọi món Việt (chuyên lẩu),"Số 1B Hàm Long, P. Phan chu Chinh, Q. Hoàn Kiếm", Lẩu Cua Đồng - Hàm Long,07h00 - 23h00,3.6,150.000 - 250.000 đ/người
Chuyên món chả cá,"Số 57 Đường Thành, P. Cửa Đông, Q. Hoàn Kiếm",Chả Cá Lang Liêu - Đường Thành,11h00 – 21h30,3.9,150.000 - 250.000 đ/người
Gọi món Việt,"Cổng Số 7 - Khu Biệt Thự Trung Tâm Hội Nghị Quốc Gia, Đường Miếu Đầm, P. Mễ Trì, Q. Nam Từ Liêm,",NCC - Trung tâm Hội nghị Quốc gia,08h00 - 22h00,4.5,400.000 - 800.000 đ/người
Chuyên cơm gà,"Số 1 ngõ 3B Đặng thái Thân, Q. Hoàn Kiếm",Chicken Now - Cơm gà Singapore ,08h00 - 22h00,3.5,35.000 - 70.000 đ/người
Buffet nướng lẩu Nhật Bản  ,"T246, Tầng 2 TTTM Aeon Mall, Q. Hà Đông",Yakimono - Aeon Mall Hà Đông,11h00 - 13h30 và 18h00 - 21h30,3.8,260.000 - 300.000 đ/người
Chuyên Combo nướng lẩu,"Ngõ 195 Phố Trần Cung , Q. Bắc Từ Liêm",Combo Lẩu Nướng OriFood M2C - Trần Cung  ,09h00 - 21h00,3.6,100.000 - 200.000 đ/người
Gọi món Âu - Á,"Tầng 1M, HH01, phố Tố Hữu, P. Vạn Phúc, Q.Hà Đông",Lounge @M - Tố Hữu,06h00 – 21h30,4,200.000 - 350.000 đ/người
Gọi món việt," Lô 20 TT5B Tây Nam Linh Đàm, Hoàng Mai",Tây Vương Quán – Đệ Nhất Gà Ngon – Linh Đàm ,09h00 - 22h00,4.2,120.000 - 150.000 đ/người
Chuyên món Âu Mỹ,"Số 1 Văn Miếu, Q. Ba Đình",Taco Zone - Văn Miếu ,09h00 - 22h00,3.5,100.000 - 150.000 đ/người
Gọi món lẩu hơi,"Số 25 Nguyễn Thị Định, Q.  Cầu Giấy",Steam Box - Nguyễn Thị Định,10h30 – 14h00 & 17h00 – 22h00,3.5,180.000 - 300.000 đ/người
Chuyên món Âu Mỹ,"Số 168 Trung Kính, P. Yên Hoà, Q. Cầu Giấy",Taco Zone - Trung Kính,09h00 - 22h00,3.5,100.000 - 150.000 đ/người
Chuyên lẩu nướng,"Số 9 Nguyễn Trung Trực, P. Nguyễn Trung Trực, Q. Ba Đình",Lẩu Nướng Cô Quỳnh - Nguyễn Trung Trực,18h00 – 24h00,3.5,100.000 - 200.000 đ/người
Chuyên gà tươi & gà nướng lu,"Số 63, LK 6A, Nguyễn Văn Lộc, P. Mộ Lao, Q. Hà Đông, Hà Nội",Vua Gà Tươi Mạnh Hoạch - Gà Nướng Lu   ,10h00 - 21h30,3.6,150.000 - 200.000 đ/người
Chuyên lẩu nướng,"Số 20B Gầm Cầu, P.Đồng Xuân, Q. Hoàn Kiếm",Lẩu Nướng Cô Quỳnh - Đồng Xuân      ,18h00 – 24h00,3.5,100.000 - 200.000 đ/người
Chuyên món vịt & món nhậu,"Số 7A Ngõ 58 Nguyễn Khánh Toàn, Q. Cầu Giấy",Vịt Cỏ 1991 - Nguyễn Khánh Toàn ,10h00 - 23h00,3.5,150.000 - 200.000 đ/người
Chuyên phở & lẩu,"Số 90 Trần Điền, P. Định Công, Q. Hoàng Mai",Phở Nam Nhất - Trần Điền,06h30 - 23h30,3.5,100.000 - 150.000 đ/người
Chuyên món gà & lẩu,"Số 6, ngõ 1, Khu Hà Trì 1,  P. Hà Cầu, Q. Hà Đông, Hà Nội",Bếp Bà Lan - Hà Trì,08h00 – 22h00,3.5,80.000 - 150.000 đ/người
Chuyên Dimsum & món Việt,"Số 43 ngõ 158 Ngọc Hà, Q.Ba Đình ",Dimsum Ngọc Lục Bảo - Ngọc Hà  ,08h00 - 20h00,3.5,80.000 - 150.000 đ/người
Chuyên cơm văn phòng,"Số 168 Trung Kính, P. Yên Hoà, Q. Cầu Giấy",Rice Home - Trung Kính  ,09h00 - 22h00,3.5,100.000 - 150.000 đ/người
Chuyên cơm văn phòng,"Số 28 Đại Cổ Việt, Q. Hai Bà Trưng, Hà Nội",Rice Home - Hai Bà Trưng,09h00 - 22h00,3.5,100.000 - 150.000 đ/người
Chuyên Pizza,"Số 168 Trung Kính, P. Yên Hoà, Q. Cầu Giấy",Pizza Home - Trung Kính ,09h00 - 22h00,3.5,100.000 - 150.000 đ/người
Chuyên cơm văn phòng,"Số 1 Văn Miếu, Q. Ba Đình",Rice Home - Văn Miếu,09h00 - 22h00,3.5,100.000 - 150.000 đ/người
Gọi món Việt – Chuyên Dê,"Số 11, Ngõ 290  Kim Mã,  P. Kim Mã, Q. Ba Đình",Lẩu Dê Khô Thu Béo - Kim Mã ,09h00 – 22h00 ,3.8,100.000 - 150.000 đ/người
Gọi món Việt,Đường Võ Nguyên Giáp – Thạch Lỗi – Thanh Xuân – Sóc Sơn  ,Tre Vàng - Võ Nguyên Giáp,07h00 - 22h00,3.5,150.000 – 200.000 đ/người
Chuyên Pizza,"Số 1 Văn Miếu, Q. Ba Đình",Pizza Home - Văn Miếu,09h00 - 22h00,3.5,100.000 - 150.000 đ/người
Gọi món Việt (Chuyên dê - gà đồi),"M09 Khu A đô thị mới Dương Nội, P. La Khê, Q. Hà Đông ",GP Cỗ Quán - KĐT Dương Nội,10h00 – 14h00 & 17h00 – 22h00,3.8,200.000 – 300.000 đ/người
"Gọi Món, Buffet Lẩu Hải Sản","Số 259A Tô Hiệu, P. Dịch Vọng, Q,Cầu Giấy",Ẩm Thực Hải Dương Xanh - Tô Hiệu  ,10h00 - 22h30,3.8,250.000 – 400.000đ/người
"Tổ chức sự kiện, Buffet","Cung thể thao dưới nước, đường Lê Đức Thọ",Nhà Hàng Aquaria - Mỹ Đình,"10h:30 - 13h:30, 17h:30 - 20h:30",3,239.000 - 329.000 vnđ/người
Gọi món Việt,"193 Cầu Diễn, P. Phúc Diễn, Q. Bắc Từ Liêm",Thắng Còi - Trâu Giật Tây Bắc - Cầu Diễn ,10h00 – 22h00,3.7,200.000 – 300.000đ/người
Café và món ăn nhẹ Á Âu,"6 Hội Vũ, Q. Hoàn Kiếm",The Hanoi Social Club,"10h:30 - 13h:30, 17h:30 - 20h:30",3,190.000 – 220.000 vnđ/người
"Café, Cocktail, Gọi món Á – Âu","24 Tông Đản, Q. Hoàn Kiếm",Nhà Hàng Cosa Nostra,"10h:30 - 13h:30, 17h:30 - 20h:30",4,100.000 – 130.000 vnđ/người
Gọi món Á (Chuyên rượu vang),"Số 81 Quán Thánh, P. Quán Thánh, Q. Ba Đình ",81QT Restaurant - Quán Thánh,10h00 – 21h00,3.9,250.000 – 300.000 đ/người
Chuyên cơm văn phòng,"Số 289 Kim Mã, P. Giảng Võ, Q. Ba Đình",Rice Home - Kim Mã ,09h00 - 22h00,3.5,100.000 - 150.000 đ/người
"Cơm Hàn Quốc, Gọi món Lẩu","Số 9, Ngõ 233 Tô Hiệu, Q. Cầu Giấy",Chubin Brothers – Tô Hiệu,11h00 – 13h00 & 18h00 – 21h00,3.8,80.000 – 180.000 đ/người
Chuyên món nhậu Việt,"3 ngõ 192 Thái Thịnh, Q. Đống Đa",Nhậu Quán 192 - Thái Thịnh,"10h:30 - 13h:30, 17h:30 - 20h:30",3.5,200.000 vnđ/người
Món Việt đa dạng,"281 Đội Cấn, Q. Ba Đình",Vườn Treo Pacific - Đội Cấn,"10h:30 - 13h:30, 17h:30 - 20h:30",3,100.000 – 200.000 vnđ/người
Chuyên món Hàn Quốc,"30A Thợ Nhuộm, Q. Hoàn Kiếm",Gimbap House - Thợ Nhuộm,08h00 - 22h00,3,100.000 vnđ/người
Chuyên hải sản,"42 Ngõ 12 Nghĩa Dũng, Quận Ba Đình",Nhà Hàng Hải Sản Hương Lan,"10h:30 - 13h:30, 17h:30 - 20h:30",3,130.000 - 150.000 vnđ/người
Chuyên chả cá,"171 Thái Hà, Q. Đống Đa",Chả Cá Lão Ngư - Thái Hà ,"10h:30 - 13h:30, 17h:30 - 20h:30",3,120.000 – 145.000 vnđ/người
Gọi món Việt,"52 Tôn Đức Thắng, Q. Đống Đa",Nhà Hàng FA 1975,"10h:30 - 13h:30, 17h:30 - 20h:30",3,200.000 - 230.000 đ/người
Chuyên chả cá,"14 Lô 2C Trung Hòa, Q. Cầu Giấy",Chả Cá Anh Vũ - Trung Hòa,"10h:30 - 13h:30, 17h:30 - 20h:30",3,150.000 – 180.000 vnđ/người
Chuyên món gà,"76 Nguyễn Chí Thanh, Q. Đống Đa",BBQ Chicken - Nguyễn Chí Thanh,"10h:30 - 13h:30, 17h:30 - 20h:30",3,70.000 – 100.000 vnđ/người
Chuyên món gà,"D9-11A/B1 Times City, 458 Minh Khai",BBQ Chicken – Times City,"10h:30 - 13h:30, 17h:30 - 20h:30",3,70.000 – 100.000 vnđ/người
Chuyên món nấm,"76 Lò Đúc, Q. Hai Bà Trưng",Nấm Việt - Lò Đúc ,"10h:30 - 13h:30, 17h:30 - 20h:30",3,80.000 – 100.000 vnđ/người
Chuyên chả cá,"120 K1 Giảng Võ, Q. Ba Đình",Chả Cá Anh Vũ - Giảng Võ,"10h:30 - 13h:30, 17h:30 - 20h:30",3,150.000 – 180.000 vnđ/người
Gọi món Âu (Chuyên Steak Pháp),"T248, Tầng 2, TTTM Aeon Mall, Q. Hà Đông",Le Monde Steak - Aeon Mall Hà Đông,11h00 - 14h00 & 17h00 - 21h30,4,150.000 - 250.000 đ/người
Chuyên Pizza,"Số 6 Đào Duy Từ, Q. Hoàn Kiếm",Full House Pizza - Đào Duy Từ,09h00 - 22h00,3.5,100.000 - 200.000 đ/người
Gọi món Âu (Chuyên Steak Pháp),"GH - L5 - 01, Tòa A Vincom Center Bà Triệu, Q. Hai Bà Trưng",Le Monde Steak - Vincom Bà Triệu ,11h00 - 14h00 & 17h00 - 21h30,4,150.000 - 250.000 đ/người
Chuyên món ngan,"Số 77 Hai Bà Trưng, P. Cửa Nam, Q. Hoàn Kiếm",Khoa Ngan Xưa và Nay - Hai Bà Trưng,08h00 - 22h00,3.8,200.000 - 300.000 đ/người
Gọi món Việt,"165A Phùng Hưng, P. Cửa Đông, Q. Hoàn Kiếm,",Tùng Lẩu Ngõ Trạm - 165A Phùng Hưng,10h30 -  03h00 sáng hôm sau,4,100.000 - 350.000 đ/người
Gọi món Âu (Chuyên Steak Pháp),"T3-03, Tầng 3, TTTM Aeon Mall, Q. Long Biên",Monde Steak - Aeon Mall Long Biên,11h00 - 14h00 & 17h00 - 21h30,4,150.000 - 250.000 đ/người
"Gọi món, buffet Nhật Bản","Tầng 2, Số 08 Tràng Thi, Q. Hoàn Kiếm",iSushi - Tràng Thi,11h00 - 13h00 & 17h30 - 21h00,4.5,350.000 - 550.000 đ/người
Gọi món Việt,"Tầng 20, Toà nhà 789, Số 147 Hoàng Quốc Việt, P. Nghĩa Đô, Q. Cầu Giấy",789 - Hoàng Quốc Việt,09h30 - 22h00,4.3,150.000 - 250.000 đ/người
Gọi món Việt,"Số 12 Hàng Điếu, Q. Hoàn Kiếm",Bếp Prime - Hàng Điếu ,10h30 - 23h00,4,500.000 - 700.000 đ/người
Gọi món Âu (Chuyên Steak Pháp),"L4-04A, Tầng 4, Tòa nhà A,B, TTTM Vincom Trần Duy Hưng, Q. Cầu Giấy",Le Monde Steak - Vincom Trần Duy Hưng,11h00 - 14h00 & 17h00 - 21h30,4,150.000 - 250.000 đ/người
Buffet nướng lẩu Hàn Quốc,"Số 5 Ngõ 107 Nguyễn Chí Thanh, Q. Đống Đa",Gabil Kimchi - Nguyễn Chí Thanh,11h00 - 14h00 & 17h30 - 22h00,4,100.000 - 200.000 đ/người
"Gọi món, Buffet Nướng Lẩu Thái Lan","Tầng 2, TTTM Aeon Mall, P. Dương Nội, Q.Hà Đông ",Thai Pattaya - Aeon Mall Hà Đông,10h00-14h00 & 17h00-22h00 ,4,200.000 - 350.000 đ/người
Gọi món Việt,"Cổng Số 7 - Khu Biệt Thự Trung Tâm Hội Nghị Quốc Gia, Đường Miếu Đầm, Phường Mễ Trì, Q. Nam Từ Liêm",Xanh Drinks - Trung tâm Hội nghị Quốc gia,08h00 – 22h00,4.5,250.000 - 500.000 đ/người
"Gọi món, Buffet lẩu & Dimsum","Số 45, Phố Trung Hòa, P. Trung Hòa, Q. Cầu Giấy",Yi Long – Dimsum Lẩu Trung Hoa - Trung Hòa,11h00 – 14h00 và 18h00 – 21h30,3.8,200.000 – 250.000 đ/người
Gọi món Việt,"Số 183 Nguyễn Tuân, Q. Thanh Xuân",Focus – Nguyễn Tuân  ,"11h00 – 14h00, 17h00 – 22h00",3.5,200.000  – 250.000 đ/người
Gọi món Á –  Âu,"Số 37A Hùng Vương, P. Điện Biên, Q. Ba Đình",37A Hùng Vương Restaurant - Ba Đình ,06h00 - 23h00,4.5,200.000 - 700.000 đ/người
Gọi món Việt," Số 1187 Giải Phóng, Q. Hoàng Mai ",Trâu Tây Bắc - Giải Phóng ,10h30 - 14h00 & 16h30 - 22h30,3.5,100.000 - 300.000 đ/người
Gọi món Việt,"Số 65 đường 23 KĐTTP Giao Lưu, P. Cổ Nhuế 2, Q. Bắc Từ Liêm",Cánh Buồm Đỏ - KĐTTP Giao Lưu,10h00 – 22h00,3.6,250.000 - 400.000 đ/người
Chuyên món gà,"70 Nguyên Hồng, Q. Ba Đình",Gà 99 - Nguyên Hồng,"10h:30 - 13h:30, 17h:30 - 20h:30",3,250.000 – 280.000 vnđ/người
"Cơm Việt, Món Á","365 Kim Mã, Q. Ba Đình",Nhà Hàng 123 - Kim Mã,"10h:30 - 13h:30, 17h:30 - 20h:30",3,85.000 – 115.000 vnđ/người
Lẩu nướng Nhật Bản,"47 - 49 Mai Hắc Đế, Q. Hai Bà Trưng",Chen - Mai Hắc Đế,"10h:30 - 13h:30, 17h:30 - 20h:30",4,270.000 – 300.000 vnđ/người
"Cơm Việt, Món Á","55 Phố Huế, Q. Hai Bà Trưng",Nhà Hàng 123 - Phố Huế,"10h:30 - 13h:30, 17h:30 - 20h:30",3,85.000 – 115.000 vnđ/người
Chuyên lẩu băng chuyền,"171 Thái Hà, Q. Đống Đa",Lẩu Băng Chuyền BKK,"10h:30 - 13h:30, 17h:30 - 20h:30",3,150.000 vnđ/người
Chuyên món lẩu Nhật Bản,"5 Trúc Bạch, Q. Ba Đình",Lẩu Sỹ Phú - Trúc Bạch ,"10h:30 - 13h:30, 17h:30 - 20h:30",4,190.000 - 220.000 vnđ/người
Chuyên món lẩu Nhật Bản,"152 Đường Láng, Q. Đống Đa",Lẩu Sỹ Phú - Đường Láng,"10h:30 - 13h:30, 17h:30 - 20h:30",4,190.000 - 220.000 vnđ/người
Món Việt,"Tổ 6 Làng Lệ Mật, Q. Long Biên",Quốc Phương Trại Việt Hưng ,"10h:30 - 13h:30, 17h:30 - 20h:30",4,150.000- 180.000 vnđ/người
Chuyên ẩm thực Nhật Bản,"52 - 54 Lý Thường Kiệt, Q. Hoàn Kiếm",Kimono,"10h:30 - 13h:30, 17h:30 - 20h:30",4,270.000 – 300.000 vnđ/người
"Món Việt, chuyên Chả Cá","19 - 2D Đường Thành, Q. Hoàn Kiếm",Chả Cá Thăng Long - Đường Thành,"10h:30 - 13h:30, 17h:30 - 20h:30",3.5,150.000 – 170.000 vnđ/người 
Món chay,"34 Hàng Bài, Q. Hoàn Kiếm",Ưu Đàm Chay - Hàng Bài,,3.8,100.000– 280.000 vnđ/người
"Ẩm thực núi rừng, món Việt","116 Hào Nam, Q. Đống Đa",Nhà hàng Sơn Cước 116 Hào Nam,10h00 – 22h00,3.8,200.000 – 300.000 vnđ/người
Gọi món Việt,"23 - 25 Văn Cao, Q. Ba Đình",Bắc Việt Phố – Văn Cao,10h00 – 21h00,3.2,200.000 – 300.000 đ/người
Chuyên các món baba,"31A Nguyễn Chí Thanh, Q. Ba Đình",Ba Ba Ao Quê - Nguyễn Chí Thanh,11h00 – 14h00 và 18h00 – 21h00,3.8,350.000 – 500.000 vnđ/người
Chuyên món Âu,"28 Hàng Tre, Q. Hoàn Kiếm",Nhà hàng Masterchef - Hàng Tre,11h00 - 14h00; 18h00 - 22h00,4,230.000 - 300.000 vnđ/người
Ẩm thực Thái,"81 Nguyễn Chí Thanh, Q. Đống Đa",Nhà hàng Sayam Chang - Nguyễn Chí Thanh ,10h30 – 22h30,3.8,150.000 – 250.000 vnđ/người
Chuyên các món baba,"129 Thái Thịnh, Q. Đống Đa",Ba Ba Ao Quê – Thái Thịnh,11h00 – 14h00 và 18h00 – 21h00,3.8,350.000 – 500.000 vnđ/người
Chuyên bánh tráng cuốn thịt heo,"45LK6A Làng Việt Kiều, P. Mỗ Lao, Q. Hà Đông",Bánh Tráng Hoàng Bèo - Hà Đông,11h00 - 22h00,3.2,50.000 - 100.000 đ/người
Chuyên bánh tráng cuốn thịt heo,"40 Duy Tân, Q. Cầu Giấy",Bánh Tráng Hoàng Bèo – Duy Tân,11h00 - 22h00,3.2,50.000 - 100.000 đ/người
Chuyên món Âu,"404 Xã Đàn, Q. Đống Đa",Nhà hàng Masterchef – Xã Đàn,11h00 - 14h00; 18h00 - 22h00,4,230.000 - 300.000 vnđ/người
Chuyên bánh tráng cuốn thịt heo,"111 Láng Hạ, Q. Đống Đa",Bánh Tráng Thịt Heo Hoàng Bèo - Láng Hạ,11h00 - 22h00,3.2,50.000 - 100.000 đ/người
Chuyên bánh tráng cuốn thịt heo,"129D Nguyễn Trãi, Q. Thanh Xuân",Bánh Tráng Hoàng Bèo – Nguyễn Trãi,11h00 - 22h00,3.2,50.000 - 100.000 đ/người
Chuyên bánh tráng cuốn thịt heo,"HH2A Linh Đàm, Kiot 20, Q. Hoàng Mai",Bánh Tráng Hoàng Bèo - Linh Đàm,11h00 - 22h00,3.2,50.000 - 100.000 đ/người
Chuyên bánh tráng cuốn thịt heo,"59 Nguyễn Hoàng, Q. Nam Từ Liêm",Bánh Tráng Thịt Heo Hoàng Bèo – Nguyễn Hoàng,11h00 - 22h00,3.2,50.000 - 100.000 đ/người
Chuyên bánh tráng cuốn thịt heo,"60 Trần Đăng Ninh, Q. Cầu Giấy",Bánh Tráng Hoàng Bèo - Trần Đăng Ninh,11h00 - 22h00,3.2,50.000 - 100.000 đ/người
Gọi món Việt (Chuyên Ngỗng),"Số 23 Đỗ Quang, P. Trung Hòa, Q. Cầu Giấy ",Ẩm thực & Âm nhạc Hoàng Tống - Đỗ Quang,10h00 – 22h00,3.5,150.000 – 200.000 đ/người
Chuyên kem,"Aeon Long Biên, T152, Tầng trệt, Số 27 Đường Cổ Linh, Q. Long Biên",Swensen's – Aeon Mall Long Biên,11h00 – 22h00,3.8,Dưới 150.000 đ/người
Chuyên Lẩu,"454 Bạch Đằng, Q. Hoàn Kiếm",Phong Quán - Bạch Đằng,10h30 – 14h00 và 17h00 – 23h00,3,150.000 - 200.000 vnđ/người
Chuyên kem,"Tầng 4 Artemis, Số 03 Lê Trọng Tấn, Q. Thanh Xuân",Swensen's - The Artemis,11h00 – 22h00,3.8,Dưới 150.000 đ/người
Chuyên món chả cá,"Số 269 Kim Mã, P. Giảng Võ, Q. Ba Đình",Chả Cá Ngon Hà Nội - Kim Mã,10h00 - 14h00 & 17h00 - 22h00,3.5,180.000 – 200.000 đ/người
Chuyên bánh tráng cuốn thịt heo,"Số 47 Kim Đồng, Q. Hoàng Mai",Bánh Tráng Thịt Heo Hoàng Bèo - Kim Đồng,11h00 - 22h00,3.5,50.000 - 100.000 đ/người
Chuyên kem,"Lotte Mart, Tầng 1, Số 229 Tây Sơn, Q. Đống Đa",Swensen's – Lotte Mart ,11h00 – 22h00,3.8,Dưới 150.000 đ/người
Chuyên bánh tráng cuốn thịt heo,"Số 82 Vũ Trọng Phụng, P. Thanh Xuân Trung, Q. Thanh Xuân",Bánh Tráng Thịt Heo Hoàng Bèo - Vũ Trọng Phụng,11h00 - 22h00,3.5,50.000 - 100.000 đ/người
Chuyên bánh tráng cuốn thịt heo,"36A Đội Cấn, Q. Ba Đình",Bánh Tráng Thịt Heo Hoàng Bèo – Đội Cấn,11h00 - 22h00,3.2,50.000 - 100.000 đ/người
Gọi món Việt đa dạng,"18 ngõ 264 Âu Cơ, Q. Tây Hồ",Nhà Hàng Hải Yến - Tre Bãi Đá,"10h:30 - 13h:30, 17h:30 - 20h:30",3.5,200.000 – 230.000 đ/người
Chuyên bánh tráng cuốn thịt heo,"Số 273 Phố Ngọc Lâm, Q. Long Biên",Bánh Tráng Thịt Heo Hoàng Bèo - Ngọc Lâm,11h00 - 22h00,3.5,50.000 - 100.000 đ/người
Chuyên bánh tráng cuốn thịt heo,"Số 338 Hồ Tùng Mậu, P. Phú Diễn, Q. Bắc Từ Liêm",Bánh Tráng Thịt Heo Hoàng Bèo - Hồ Tùng Mậu,11h00 - 22h00,3.2,50.000 - 100.000 đ/người
Chuyên kem,"Hầm B1, Gian D9-5B, TTTM Vincom Mega Mall Times City, Hà Nội ",Swensen’s - Times City,11h00 – 22h00,3.8,Dưới 150.000 đ/người
Chuyên bánh tráng cuốn thịt heo,"Số 42Z Lý Thường Kiệt, P. Trần Hưng Đạo, Q. Hoàn Kiếm",Bánh Tráng Thịt Heo Hoàng Bèo - Lý Thường Kiệt,11h00 - 22h00,3.2,50.000 - 100.000 đ/người
Gọi món Việt,"Số 11TT3A Tây Nam Linh Đàm, P. Hoàng Liệt, Q. Hoàng Mai ",Song Cầm Quán - KĐT Tây Nam Linh Đàm,11h00  - 14h00 & 17h00 -  23h00,3.6,200.000 – 250.000 đ/người
"Chuyên Gà Rán, Kem","L3-K1A TTTM Vincom Liễu Giai, Số 29 Liễu Giai, P. Ngọc Khánh, Q. Ba Đình",DQ Grill & Chill – Vincom Liễu Giai ,11h00 – 22h00,3.8,150.000 – 250.000 đ/người
Buffet Chay,"Số 19, Ngõ 275 Âu Cơ, P. Quảng An, Q. Tây Hồ",Chay Veggie Castle - Âu Cơ ,11h00 – 13h30 & 18h00 – 21h00,3.7,150.000 – 200.000 đ/người
Buffet Lẩu Châu Á,"TTTM Vincom Center, Tầng 4, Số 119 Trần Duy Hưng, P. Trung Hòa, Q. Cầu Giấy",Hotpot Story - Vincom Trần Duy Hưng,11h00 - 13h00 & 18h00 - 21h00,3.7,250.000 - 350.000 đ/người
Buffet Chay,"Số 7 Yên Ninh, P. Trúc Bạch, Q. Tây Hồ",Chay Veggie Castle - Yên Ninh,11h00 – 13h30 & 18h00 – 21h00,3.7,150.000 – 200.000 đ/người
Chuyên Chả Cá,"118 Lê Duẩn, P. Cửa Nam, Q. Hoàn Kiếm",Miss Chả Cá – Lê Duẩn,10h30  – 21h30,3.9,130.000 – 180.000 đ/người
Món Việt đồng quê,"19 ngõ 183 Đặng Tiến Đông, Q. Đống Đa",Nhà hàng Góc Quê - Đặng Tiến Đông,10h30 - 22h00,3.5,150.000 – 180.000 vnđ/người 
"Gặp gỡ bạn bè, tiếp khách, liên hoan gia đình, ...","Tòa nhà VTC Online, 18 Tam Trinh, Hai Bà Trưng,Hà Nội",Nhà Hàng PasGo demo - Hà Nội,"10h:30 - 14h:30, 17h:30 - 21h:30",4,200.000 – 350.000 vnđ/người
Món chay,"Số 38 Thi Sách, P. Phạm Đình Hổ, Q. Hai Bà Trưng",ChayA Pizza - Thi Sách,10h00 - 22h30,4,200.000 - 450.000 đ/người
Gọi món Á,"Số 87 Láng Hạ, P.Thành Công, Q. Ba Đình",CityFood - Ngon Ngon Đủ Món - Rạp Chiếu phim Quốc gia,T2-T6 10h00-21h00 & T7&CN : 09h00 - 22h00,3.8,80.000 - 150.000 đ/người
Gọi món Huế,"Số 83, Trần Duy Hưng, Q. Cầu giấy",Nét Huế - Trần Duy Hưng,07h00 - 22h00,3.5,50.000 - 150.000 đ/người
PasGo Demo 2,"25 Lạc Trung, Quận Hai Bà Trưng",Nhà hàng PasGo Demo 2,,5,150.000 – 400.000 vnđ/người
Gọi món Việt,"8 ngõ 97 Phạm Ngọc Thạch, Q. Đống Đa",Quán Sành - Phạm Ngọc Thạch,10h00 - 14h00 & 17h30 - 21h45,3.2,180.000 – 200.000 đ/người
Gọi món Việt,"46/25 ngõ Thổ Quan, Q. Đống Đa",Nhà Sàn Quán Giang Dung - Thổ Quan,10h30 - 13h30 & 17h30 -  20h30,3,150.000 - 250.000 đ/người
Gọi món Nhật Bản,"6 Phan Kế Bính Kéo Dài, Q. Ba Đình",Paku Paku - Phan Kế Bính,10h00 - 13h30 và 17h00 - 21h30,3.8,150.000 – 350.000 vnđ/người
"Gọi món Âu, Á","23L Hai Bà Trưng, Q. Hoàn Kiếm",Al Fresco’s - Hai Bà Trưng,11h00 - 21h00,4.2,200.000 - 250.000 đ/người
Gọi món Miền Nam,"13 Mai Hắc Đế, Q. Hai Bà Trưng",Phương Nam - Mai Hắc Đế,10h30 - 14h00 và 17h30 - 21h30,3.5,150.000 - 180.000 đ/người
Chuyên món chả cá,"32 Nguyễn Văn Huyên, Q. Cầu Giấy",Chả Cá Hà Thành - Nguyễn Văn Huyên,10h00 - 21h30,3.5,180.000 – 250.000 đ/người
Gọi món Việt,"Số 38 Đặng Thai Mai, Q. Tây Hồ",Sen Đầm Trị - Đặng Thai Mai ,"10h00 - 14h00, 17h00 - 22h00",3.9,180.000 - 250.000 đ/người
Gọi món Nhật,"Số 40 - 42 Đào Tấn, Q. Ba Đình, Hà Nội.",New Sake - 40-42 Đào Tấn,10h30 - 13h30 & 17h30 - 21h00,4.1,470.000 - 500.000 vnđ/người
Gọi món Việt,"685 Lạc Long Quân, Q. Tây Hồ",Lẩu Cua Đồng 685 - Lạc Long Quân ,09h00 - 22h00,3.5,150.000 – 170.000 đ/người
Gọi món Việt,"36/76 An Dương, Q. Tây Hồ",Công Viên Nhỏ - An Dương,11h00 - 14h30 và 17h00 - 21h00,4,200.000 - 300.000 đ/người
Gọi món Việt,"48 Bát Đàn, Q. Hoàn Kiếm",An Viên - Bát Đàn,11h00-14h00 & 16h30-23h00,3.2,80.000 - 120.000 đ/người
Gọi món Việt,"127 Chùa Láng, Q. Đống Đa",An Viên - Chùa Láng,11h30 -14h00 & 16h30-22h00,3.2,80.000 - 120.000 đ/người
"Gọi món Âu, Á","TTTM Royal City, B2-R6-29A, 72A Nguyễn Trãi",Al Fresco’s - Royal City  ,11h00 - 21h00,4.2,200.000 - 250.000 đ/người
"Gọi món Âu, Á","TTTM AEON Mall Long Biên, Tầng 3, T308 ",Al Fresco’s – Aeon Mall Long Biên,11h00 - 21h00,4.2,200.000 - 250.000 đ/người
Gọi món Việt (Chuyên lẩu),"61 Ngõ 298 Tây Sơn, Đống Đa ",Lẩu Đức Trọc – Tây Sơn ,10h30 - 13h30 và 17h00 - 22h00,3.5,150.000 - 250.000 vnđ/người
Gọi món Tây Bắc,"Số 45 Nguyễn Khang, P. Yên Hòa, Q. Cầu Giấy",Ẩm Thực Tây Bắc – Nguyễn Khang,10h00 - 22h00,3.7,150.000 - 250.000 đ/người
"Gọi món Âu, Á","TTTM The Garden, Mễ Trì,Tầng G, Cửa số 1 ",Al Fresco’s - The Garden,11h00 - 21h00,4.2,200.000 - 250.000 đ/người
Gọi món Hải Phòng,"108 D5 Trần Thái Tông, Q. Cầu Giấy",An Biên Eatery - Trần Thái Tông,T2-T7: 09h30 - 17h00,3.5,120.000 - 200.000 đ/người
Gọi món Hải Phòng,"111 Triệu Việt Vương, Q. Hai Bà Trưng",An Biên Eatery - Triệu Việt Vương,T2-T7: 09h30 - 17h00,3.5,120.000 - 200.000 đ/người
Gọi món Việt (Chuyên hải sản),"12 Tổ 6, Nguyễn Văn Hưởng, Q. Long Biên",Hương Quê - Long Biên,10h30 - 13h00 & 17h30 - 21h00,4,200.000 – 350.000 đ/người
Gọi món Âu (Chuyên Steak),"59A Trần Quốc Toản, Q. Hoàn Kiếm",Moo Beef Steak - Trần Quốc Toản,10h30 - 13h30 & 18h00 - 21h30,4,350.000 – 500.000 đ/người
Buffet nướng lẩu Hàn Quốc,"Số 10, Lô 10 Ngõ 67 Đường Phùng Khoang, Q. Nam Từ Liêm                                 ",Galbi Express - Phùng Khoang,10h30 – 21h30,3,200.000 –  300.000 đ/người
